judet,uat,echipa_interventie,fond_cinegetic_alungare,data_interventie,longitudine_alungare,latitudine_alungare,numar_raport_alungare,identificare_relocare,fond_cinegetic_relocare,data_relocare,longitudine_relocare,latitudine_relocare,numar_raport_relocare,identificare_eutanasiere,fond_cinegetic_eutanasiere,longitudine_eutanasiere,latitudine_eutanasiere,nr._raport_interventie_eutanasiere,identificare_impuscare,fond_cinegetic_impuscare,longitudine_impuscare,latitudine_impuscare,nr._raport_interventie_impuscare,sex_urs,descriere_eveniment,metoda_interventie,adaugat_de
,VOŞLĂBENI,"Personal  AVPS Gheorgheni, Viceprimar Voslobeni,  Medic veterinar",VOSLOBENI 14,,25.684,46.628,90,,,,,,,,,,,,,,,,,Femela cu pui,Indepartarea unei femele de urs cu 2 pui din apropierea caselor,Alungat,Szabo Szilard
,VOŞLĂBENI,"Personal  AVPS Gheorgheni, Viceprimar Voslobeni,  Medic veterinar",VOSLOBENI 14,,25.691,46.624,89,,,,,,,,,,,,,,,,,Femela cu pui,Alungarea unei femele de urs cu 3 pui din curtea din intravilan,Alungat,Szabo Szilard
,CÂRŢA,"Personal  AVPS Nimrod, Viceprimar Carta,  Personalul Jandarmeria Harghita",CARTA 16,,25.76825,46.54014,7883,,,,,,,,,,,,,,,,,Mascul,Ursula fos inchis accidental in sura in satul Ineu de catre proprietar. A fos eliberat si gonit din localitate prin inerventia Jandarmeriei si personalului de specialitate a gestionarului.,Alungat,Szabo Szilard
Caraș-Severin,BRAŞOV,"Viceprimar Mun.Brasov, reprezentant IJJ Brasov, reprezentant Garda Forestiera Brasov, Medic veterinar",TIMIS 18,,25.576883,45.643093,,"crotalii nespecifice, marcate de reprez comisiei cu nr :BV 001, BV 002,BV 003,BV 004",HIGEG 20,05-10-2021,22.30378,45.12203,107149,,,,,,,,,,,Femela cu pui,"In urma apelurilor repetate la 112, echipa de interventie a indepartat si alungat prin diverse mijloace exemplarul de urs femela cu pui, aceasta devenind agresiva si lansand atacuri false. Prin urmare, s-a procedat la capturarea, tranchilizarea si relocarea acesteia.",Relocat,Mirela Moisa
,COMARNIC,"Primar, reprezentanti UM 0756, paznici vanat. AVPS Campina",COMARNIC 24,,547800.0,416750.0,11427/24.09.2021,,,,,,,,,,,,,,,,,,"Interventie pe o strada unde anterior fusese ranita o persoana, evaluat nivel de risc mare, efectuat scotociri si alungare",Alungat,Crina Popa
,COMARNIC,"Primar, reprez. UM 0756, paznici vanat. AVPS Campina",COMARNIC 24,,547800.0,416750.0,,,,,,,,,,,,,,,,,,Femela cu pui,"Ursoaica cu 2 pui prezenta pe strada in intravilan, a fost indepartata in fondul forestier",Alungat,Crina Popa
,COMARNIC,"Primar, reprez. UM 0756, paznici vanat. AVPS Campina",COMARNIC 24,,547800.0,416750.0,,,,,,,,,,,,,,,,,,,Au fost luate masuri de cautare si indepartare a animalului,Alungat,Crina Popa
,COMARNIC,"Primar, reprez. UM 0756, paznici vanat. AVPS Campina",COMARNIC 24,,547800.0,416750.0,,,,,,,,,,,,,,,,,,,Au fost luate masuri de cautare si indepartare a animalului,Alungat,Crina Popa
,COMARNIC,"Primar, reprez. UM 0756, medic veterinar, paznici vanat. AVPS Campina",COMARNIC 24,,547800.0,416750.0,11725/01.10.2021,,,,,,,,,,,,,,,,,,Alungare prin metode sonore si cu fascicule luminoase,Alungat,Crina Popa
,IZVOARELE,"reprezentant UAT, reprez. UM 0756, paznic vanat. AJVPS Prahova",CAZACU 34,,577189.9,420412.9,1921/03.10.2021,,,,,,,,,,,,,,,,,Femela cu pui,"Alungare prin diverse mijloace, s-a desfasurat actiune de patrulare",Alungat,Crina Popa
,COMARNIC,"Primar, reprez. UM 0756, medic veterinar, paznici vanat. AVPS Campina",,2021-10-01,,,,,,,,,,,,,,,,COMARNIC 24,3933651.247,6016914.732,11726/02.10.2021,Mascul,"Extras prin impuscare deoarece a reaparut dupa alungare si a avut comportament agresiv in prezenta echipei, vrand sa atace",Împușcare,Crina Popa
,LĂZAREA,"Viceprimar Lazarea, Personal Tehnic AVPS, Medic Veterinar, Jandarmeria",REMETEA 12,,25.51624,46.75137,5078,,,,,,,,,,,,,,,,,,Ursul a intrat in curte si a  atacat o persoana. Dupa incident a fost alungat.,Alungat,Szabo Szilard
Dâmbovița,MOROENI,Reprezentant Jandarmerie; Reprezentant UAT Moroeni;Personal tehnic gestionar; Medic veterinar împuternicit,VALEA IALOMITEI 16,,25.2504,45.1732,,ISO11784/5 FDX-B,VALEA IALOMITEI 16,08-09-2021,,,,,,,,,,,,,,Mascul,"Un exemplar de urs care a fost alungat de mai multe ori, a intrat în mai multe curți și anexe gospodărești. Echipa de intervenția a luat decizia tranchilizării și relocării în zona Orzea, f.c. nr. 16 Valea Ialomiței.",Relocat,Nicoleta Vladescu
,BISTRIŢA BÂRGĂULUI,"Pl.Adj. , Viceprimar comuna Bistrița Bârgăului ,  reprezentant al gestionarului fc nr.26 Colibița",COLIBITA 26,,24.887105,47.17253,,,,,,,,,,,,,,,,,,,pana la sosirea echipei de interventie ursul a parasit zona si sa retras,Alungat,Rus Paul
,RUCĂR,"Jandarmerie, Primaria Rucăr, Fond cinegetic",STOENESTI 20,,513232.0,431622.0,1500672,,,,,,,,,,,,,,,,,,"Urs în gospodărie, respectiv bucătărie. a fost alungat prin zgomot catre pădure",Alungat,Marius Dumitru
Dâmbovița,PIETROŞIŢA,Reprezentant Jandermerie; Reprezentant UAT Pietroșița; Personal tehnic gestionar; Medic veterinar împuternicit,RUNCU 13,,25.19222,45.13408,,,RUNCU 13,07-09-2021,,,,,,,,,,,,,,Femela,Un exemplar de urs din intravilanul localității Dealu Frumos a fost tranchilizat și relocat după evaluarea stării de sănătate în zona împădurită din fondul cinegetic nr. 13 Runcu.,Relocat,Nicoleta Vladescu
,LEREŞTI,Jandarmerie,RAUL TARGULUI 18,,505589.0,422984.0,1500728 din 16.08.2021,,,,,,,,,,,,,,,,,,"Urs în gospodărie la ora 2,3 noaptea. Acesta ranise un porc. A fost alungat prin zgomote.",Alungat,Marius Dumitru
,BISOCA,"reprezentant IJJ Buzău  ,reprez.UAT, repez AJVPS Buzau",VINTILA VODA 40,,26.654178,45.541874,,,,,,,,,,,,,,,,,,,"Echipa de intevenție s-a intrunit  ca urmre a unui apel la 112 , la fața locului nu a mai fost gasit exemplarul de urs",Alungat,Ioana Diaconescu
,DÂMBOVICIOARA,"Jandarmerie, Primărie, Fond cinegetic",DAMBOVICIOARA 23,,25.176521,45.387749,9518 din23.08.2021,,,,,,,,,,,,,,,,,,La sosirea echipei ursul nu mai era. Acesta omorâse în gospodăria păgubitei Crăciun Georgeta un taur și două oi. Ursul fusese alungat de caini.,Alungat,Marius Dumitru
,BUGHEA DE SUS,"Jandarmerie, Primarie, Fond cinegetic",RAUL TARGULUI 18,,25.025807,45.301981,1500823 din 26.08.2021,,,,,,,,,,,,,,,,,,"Ursul nu a fost găsit, nu au fost produse pagube.",Alungat,Marius Dumitru
,RUCĂR,"Jandarmerie, Fond cinegetic",STOENESTI 20,,25.167023,45.383843,1500829 din 27.08.2021,,,,,,,,,,,,,,,,,Mascul,"Urs de talie mică în gospodărie, ora 23. Echipa de intervenție nu a găsit ursul, nu au fost pagube.",Alungat,Marius Dumitru
,RUCĂR,"Jandarmerie, Primăria Rucăr, Gestionar Fond cinegetic",STOENESTI 20,,25.1608942,45.404931,1500842 din 30.08.2021,,,,,,,,,,,,,,,,,Mascul,Urs în gospodărie ora 5. Ursul a rănit un porc. Urs de talie mare. A fost alungat cu mijloace acustice și luminoase.,Alungat,Marius Dumitru
,BISOCA,"repez IJJ Buzau, reprez.UAT Bisoca,",VINTILA VODA 40,,26.654178,45.541874,,,,,,,,,,,,,,,,,,,"echipa de intervenție  s-a intrunit ca urmare a unui apel 112 , ursul a fost alungat din zona gospodăriilor",Alungat,Ioana Diaconescu
,BISOCA,"reprezentant  IJJ Buzau, reprezentant UAT",VINTILA VODA 40,,26.654178,45.541874,,,,,,,,,,,,,,,,,,,"echipa  de intervenție s-a intrunit  , apel 112, ursul nu mai era in zona",Alungat,Ioana Diaconescu
,BISOCA,"reprezentant IJJ Bz,  reprez  UAT",VINTILA VODA 40,,26.654178,45.541874,,,,,,,,,,,,,,,,,,,Echipa de intervenție a alungat ursul din zona gospadariilor,Alungat,Ioana Diaconescu
,BISOCA,"reprez IJJ, reprez UAT",VINTILA VODA 40,,26.654178,45.541874,,,,,,,,,,,,,,,,,,,"echipa a fost la fata locului dupa un apel 112, ursul nu a mai fost gasit in zona",Alungat,Ioana Diaconescu
,BISOCA,"reprez IJJ Buzau, reprez UAT",VINTILA VODA 40,,26.654178,45.541874,,,,,,,,,,,,,,,,,,,echipa de intervenție a alungat 2 exemplare de urs ce se aflau in curtea unei gospodării sat Lacuri Bisoca,Alungat,Ioana Diaconescu
,BISOCA,"reprezentant IJJ Bz, reprezentant UAT Bisoca, reprez AJVPS Bz",VINTILA VODA 40,,26.654178,45.541874,,,,,,,,,,,,,,,,,,,Echipa a intreprins actiuni de alungare a unui exemplar de urs ce a patruns in gospodăriile localnicilor sat Lacuri,Alungat,Ioana Diaconescu
,DÂMBOVICIOARA,"Jandarmerie, Primarie, Fond cinegetic",DAMBOVICIOARA 23,,45.301981,25.12035,1500885 din 03.09.2021,,,,,,,,,,,,,,,,,Mascul,In gospodarie a fos gasit un porc ranit. S-a patrulat cu semnale acustice si luminoase.,Alungat,Petruta Ghica
,RUCĂR,"Jandarmerie, Fond cinegetic",RUCAR 22,,45.407411,25.144779,1500911,,,,,,,,,,,,,,,,,Mascul,"Urs patruns in proprietate particulara, ursul nu a fost gasit, nu au fost produse pagube materiale.",Alungat,Petruta Ghica
,RUCĂR,"Jandarmerie, Primarie, Fond Cinegetic",RUCAR 22,,45.406397,25.147853,1500922,,,,,,,,,,,,,,,,,Mascul,"In grajdul din proprietatea aflata in intravilan,  a fost gasit un porc mort si unul ranit,. A fost identificat locul prin care a patruns ursul, respectiv podul grajdului. Ursul nu a fost vazut .",Alungat,Petruta Ghica
,RUCĂR,"Jnadarmerie, Fond cinegetic",RUCAR 22,,45.398873,25.146723,1500922,,,,,,,,,,,,,,,,,Mascul,A fost semnalata prezenta unui urs in aproprierea locuintei. Echipa de interventie a patrulat folosind semnale acustice si luminoase. Ursul nu a mai fost vazut.,Alungat,Petruta Ghica
,RUCĂR,"Jandarmerie, Primarie, Fond cinegetic",,2021-09-08,,,,,,,,,,,,,,,,RUCAR 22,45.407411,25.144779,1500922,Mascul,"Un exemplar de urs a revenit dupa alungare, la o proprietate unde omorase doua suine, si incerca sa patrunda din nou in grajd. Exemplarul a fost impuscat in intravilanul localitatii Rucar, a marcat focul, dar nu a murit pe loc si a fugit in extravilan. Ulterior gestionarul fondului cinegetic a intreprins actiuni de cautare, dar ursul nu a mai fost gasit.",Împușcare,Petruta Ghica
,RUCĂR,"Jandarmerie, Primarie, Fond cinegetic",RUCAR 22,,45.385597,25.169225,1500927,,,,,,,,,,,,,,,,,Mascul,Un urs de talie mare a fost vazut in gspodaria aflata in intravilan. Jandarmeria a folosit  mijloace acustice si luminoase pentru alungare. Dupa patrulare ursul nu a mai fost vazut.,Alungat,Petruta Ghica
,RUCĂR,"Jandarmerie, Primarie, Fond cinegetic",RUCAR 22,,45.377971,25.16627,1500935,,,,,,,,,,,,,,,,,Mascul,"Ursul a patruns in gospodaria aflata in intravilanul comunei Rucar. La sosirea echipei de interventie a fost gasit gardul, rupt, insa ursul nu a mai fost gasit. S-a efectuat patrulare, s-au folosit semnale acustice si luminoase.",Alungat,Petruta Ghica
,RUCĂR,"Jandarmerie, Primarie, Fond cinegetic",RUCAR 22,,45.383968,25.167179,1500952,,,,,,,,,,,,,,,,,Mascul,Ursul a patruns in gospodaria aflata in intravilanul localitatii Rucar. La sosirea echipei de interventie ursul nu a mai fost gasit. S-au folosit mijloace acustice si luminoase si s-au efectuat patrulari in zona.,Alungat,Petruta Ghica
,RUCĂR,"Jandarmerie, Primarie, Fond cinegetic",RUCAR 22,,45.380646,25.168896,1500952,,,,,,,,,,,,,,,,,Mascul,"Ursul a revenit la o gospodarie aflata in intravilanul localitatii Rucar, a patruns in grajd rupand acoperisul si usile si a devorat resturile ovinei ucise cu o seara inainte. S-au folosit semnale acustice si luminoase acustice si luminoase",Alungat,Petruta Ghica
,BUGHEA DE SUS,Jandarmerie,RAUL TARGULUI 18,,,25.038969,1500952,,,,,,,,,,,,,,,,,Mascul,"Ursul a fost vazut in jurul unei gospodarii din intravilanul comunei Bughea de Sus. La sosirea jandarmilor, ursul nu a mai fost gasit. S-a efectuat patrulare si au fost folosite mijloace acustiec si luminoase.",Alungat,Petruta Ghica
,RUCĂR,"Jandarmerie, primarie, Fond cinegetic",RUCAR 22,,45.39887,25.146723,1500979,,,,,,,,,,,,,,,,,Mascul,"Ursul a patruns in mai multe proprietati aflate in intravilanul comunei Rucar, distrugand garduri si pomi fructiferi. Echipa de  interventie a vazut ursul la limita proprietatii, pentru alungare fiind folosite semnale acustice si luminoase.",Alungat,Petruta Ghica
,RUCĂR,"Jandarmerie, Primarie, Fond cinegetic",,2021-09-20,,,,,,,,,,,,,,,,RUCAR 22,45.40327,25.150685,1501027,Mascul,"Ursul vazut la un adapost de animale. Reprezentantul primariei Rucar a hotarat impuscarea exemplarului de urs , datorita numeroaselor pagube produse in intravilanul localitatii Rucar si a numeroaselor alungari.n intravilanul",Împușcare,Petruta Ghica
,RUCĂR,"Jandarmerie, Primarie, Fond cinegetic",RUCAR 22,,45.442788,25.1747,1501046,,,,,,,,,,,,,,,,,Femela cu pui,"Ursoaica cu 2 pui a patruns in curtea unei case din intravilanul comunei Rucar. Echipa de interventie a vazut exemplarele de urs, s-au folosit mijloace acustice si luminoase pentru alungare.vazut",Alungat,Petruta Ghica
,RUCĂR,"Jandarmerie, Primarie, Fond cinegetic",RUCAR 22,,45.398638,25.163759,1501115,,,,,,,,,,,,,,,,,Mascul,In jurul locuintei din intarvilanul localitatii Rucar a fost semnalata prezenta unui exemplar de urs. Echipa de interventie a folosit mijloace acustice si luminoase pentru alungare.,Alungat,Petruta Ghica
,DUMITRIŢA,"Plt. Adj. ISJ BN,  Primar -  UAT Dumitrița,  Medic veterinar împuternicit- CMV Satu Nou",BUDAC 27,,,,,,,,,,,,,,,,,,,,,Mascul,"Un urs a atacat și omorât un porc. Evenimentul s-a petrecut în jurul dimineții, in intravilanul localității Budacu de Sus , porcul a fost luat din cotețul de lângă casă. Ursul a fost alungat. ISU Bistrița a transmis mesajul RO Alert .",Alungat,Nastase Crina
,DUMITRIŢA,"Plt. Adj.  - ISJ BN,  Primar -  UAT Dumitrița, Medic veterinar împuternicit - CMV Satu Nou, Reprezentantul gestionarului AC Ursul Brun",BUDAC 27,,,,,,,,,,,,,,,,,,,,,Mascul,A fost luată măsura alungării ursului din zonă și înștiințarea populației. Evenimentul a avut loc în localitatea  Budacu de Sus . Nu au fost produse pagube.,Alungat,Nastase Crina
,COMARNIC,"Primar, reprez. UM 0756, paznici vanat. AVPS Campina",COMARNIC 24,,547800.0,416750.0,11962/07.10.2021,,,,,,,,,,,,,,,,,,Exemplar de urs pui alungat cu semnale acustice si vizuale,Alungat,Crina Popa
Covasna,BIXAD,"primar, paznic de vânătoare,  medic veterinar,  IJJ Covasna",,,,,,3576389738,DOBRITA ZALAN 8,31-08-2021,25.811172,46.119077,1782,,,,,,,,,,,Femela,"Paznicul comunal  a observat ursul rămas în captiv într-un tomberon în centrul comunei lângă sala de sport, după care a anunțat primarul. Primarul a apelat 112 în urma căruia s-a întrunit comisia de intervenție format din primar, medic veterinar, paznic de vânătoare și echipajul de jandarmi. Ursul a fost tranchilizat de către medicul veterinar, a fost scos din tomberon, cipat și întrodus în cușca metalică apoi transportat și relocat pe fondul de vânătoare nr. 8 Dobrița Zălan, la locul denumit Hani.",Relocat,Berde Lajos
,COMARNIC,"Primar, reprez. UM 0756, medic veterinar, paznici vanat. AVPS Campina",COMARNIC 24,,547800.0,416750.0,12028/08.10.2021,,,,,,,,,,,,,,,,,Femela cu pui,Alungat cu mijloace sonore si luminoase,Alungat,Crina Popa
,COMARNIC,"Primar, reprez. UM 0756, medic veterinar, paznici vanat. AVPS Campina",COMARNIC 24,,547800.0,416750.0,12086/08.10.2021,,,,,,,,,,,,,,,,,Mascul,"Exemplarul se afla intr-o zona unde a existat un atac, dar din cauza vegetatiei abundente actiunea a fost ingreunata, s-a facut alungare prin metode acustice si luminoase",Alungat,Crina Popa
,IZVOARELE,"reprezentant UAT, reprez. UM 0756, paznic vanat. AJVPS Prahova",CAZACU 34,,577189.9,420412.9,1969/10.10.2021,,,,,,,,,,,,,,,,,Mascul,Alungare prin diverse mijloace acustice si luminoase,Alungat,Crina Popa
,COMARNIC,"Primar, reprez. UM 0756, medic veterinar, paznici vanat. AVPS Campina",COMARNIC 24,,549611.0,416609.0,12088/11.10.2021,,,,,,,,,,,,,,,,,Mascul,Alungare prin metode sonore si cu fascicule luminoase,Alungat,Crina Popa
,COMARNIC,"Primar, reprez. UM 0756, medic veterinar, paznici vanat. AVPS Campina",COMARNIC 24,,549254.0,418289.0,12090/11.10.2021,,,,,,,,,,,,,,,,,Mascul,Alungare prin metode sonore si cu fascicule luminoase,Alungat,Crina Popa
,RUCĂR,"Jandarmerie, Primărie, gestionar FC",RUCAR 22,,25.168286,45.379211,1501260 din 11.10.2021,,,,,,,,,,,,,,,,,,Ursul nu se afla în zona sesizată. S-a efectuat patrulare cu mijloace acustice și luminoase.,Alungat,Marius Dumitru
,BRUSTUROASA,Jandarmerie - UM 0836 BACAU; UAT Brusturoasa- VICEPRIMAR ; Personal tehnic gestionar  ; Medic veterinar.,COTUMBA 3,,,,11473,,,,,,,,,,,,,,,,,,"Din relatarile persoanelor care erau la fata locului la momentul intrunirii echipei de  interventie, a rezultat ca un urs adult a atacat o bovina, in spatele imobilului cu nr. 154 din satul Hanganesti, comuna Brusturoasa.  Dupa atac, ursul a plecat , nu a fost necesara alungarea acestuia de catre echipa de interventie.",Alungat,Anca Macor
,STOENEŞTI,Jandarmerie,STOENESTI 20,,25.186166,45.239877,1501288 din 12.10.2021,,,,,,,,,,,,,,,,,,Ursul nu a fost găsit. În gospodăria persoanei păgubote un perete al adăpostului pentru animale era spart și lipsea o ovină.,Alungat,Marius Dumitru
Brașov,BRAŞOV,"Reprezentant Primăria Municipului Brașov, Medic veterinar și reprezentant IJJ Brașov",,,,,,BV005-BV008,,13-10-2021,25.576793,45.643218,109981,,,,,,,,,,,Femela cu pui,"Conducătorul echipei de intervenție a decis în conformitate cu prevederile art.4, alin.1, lit .b) din OUG 81/2021, capturarea, tranchilizarea și relocarea femelei de urs cu 3 pui în cadrul Sanctuarului de urși Libearty Zărnești",Relocat,Viorel Marean
,BRAŞOV,"Primar mun. Brasov, medic veterinar, reprezentant Garda Forestiera Brasov",TIMIS 18,,25.57693,45.643182,111091/15.10.2021,,,,,,,,,,,,,,,,,Femela cu pui,"In urma apelurilor repetate la 112, echipa de interventie a monitorizat zona, iar la ora 23,05pm, in zona Warthe,conducatorul echipei de interventie a decis in conf.cu art 4, alin.1, lit.a, alungarea prin diverse mijloace acustice si olfactive a unui exemplar de urs femela cu pui,",Alungat,Mirela Moisa
,COMARNIC,"Primar, reprez. UM 0756, medic veterinar, paznici vanat. AVPS Campina",COMARNIC 24,,549254.0,418289.0,12321/14.10.2021,,,,,,,,,,,,,,,,,Mascul,"Ursul a ucis doua ovine, a fost alungat folosindu-se metode acustice si luminoase",Alungat,Crina Popa
,COMARNIC,"Primar, reprez. UM 0756, medic veterinar, paznici vanat. AVPS Campina",COMARNIC 24,,548730.0,420496.0,12422/15.10.2021,,,,,,,,,,,,,,,,,Mascul,Alungare prin metode sonore si cu fascicule luminoase,Alungat,Crina Popa
,COMARNIC,"Primar, reprez. UM 0756, medic veterinar, paznici vanat. AVPS Campina",,2021-10-14,,,,,,,,,,,,,,,,COMARNIC 24,548730.0,420496.0,12423/15.10.2021,Mascul,"Alungare prin metode sonore si cu fascicule luminoase, dupa care a devenit agresiv, punand in pericol membrii echipei si a fost impuscat",Împușcare,Crina Popa
,ZĂRNEŞTI,"IJJ Buzau, reprezentant UAT Zarnesti, reprezentant AV Stejarul Bucure;ti",ZARNESTI 57,,26.864385,45.302091,,,,,,,,,,,,,,,,,,,"In urma apelului de urgență echipa s-a deplasat la fața loclului, dar ursul nu a mai fost găsit.",Alungat,Mihaela Ifrim
,CRIZBAV,"Reprezentant Primaria Crizbav, reprezentant Inspectoratul Judetean Jandarmi, medic veterinar, reprezentant gestionar, apelant",CRIZBAV 13,,25.468714,45.813056,4621/15.10.2021,,,,,,,,,,,,,,,,,Mascul,"In jurul orei 07,40 am, a fost observat un urs pe cursul râului care traverseză localitatea Crizbav. Echipa a intervenit și a alungat ursul în zona pădurii Sideriaș prin cimitirul localității.",Alungat,Mirela Moisa
,COMARNIC,"reprez. UM 0756,  paznici vanat. AVPS Campina",COMARNIC 24,,547800.0,416750.0,12565/20.10.2021,,,,,,,,,,,,,,,,,Mascul,"Urs aflat in gradina particulara, alungat prin metode sonore",Alungat,Crina Popa
,CRIZBAV,"Reprezentant Primaria Crizbav, reprezentant Insp.Jud.de Jandarmi BV, medic veterinar, reprezentant gestionar(AVP Dopiresco),apelant",CRIZBAV 13,,25.46566,45.815084,4684/20.10.2021,,,,,,,,,,,,,,,,,Mascul,"În jurul orei 06,22 a fost observat un urs pe raza localității Crizbav, deplasându-se pe cursul râului din centrul localității; echipa de intervenție a alungat animalul prin cimitirul localității spre pădure (Sideriaș).",Alungat,Mirela Moisa
,BUGHEA DE SUS,jandarmerie,RAUL TARGULUI 18,,25.031837,45.295248,1501366 din 18.10.2021,,,,,,,,,,,,,,,,,Mascul,Echipajul de jandarmi imreuna cu persoana păgubită au identificat urme de urs și gardul rupt. Persoana păgubită a observat ca lipsește un porc. Ursul nu a fost găsit.,Alungat,Marius Dumitru
,COMARNIC,"Primar, reprez. UM 0756, medic veterinar, paznici vanat. AVPS Campina",COMARNIC 24,,550986.0,414518.0,12622/21.10.2021,,,,,,,,,,,,,,,,,Mascul,Alungare prin metode sonore si cu fascicule luminoase,Alungat,Crina Popa
,HORODNICENI,"Primar U.A.T. Horodniceni, Medic veterinar, Personal Jandarmerie -Unitatea Fălticeni",ROTOPANESTI 67,-,,,-,-,,-,,,-,-,,,,-,-,,,,-,,"În data de 16.10.2021 în jur de ora 00:30 - 01:00, în apropiere de fabrica de prelucrare a produselor lactate S.C. Laktotrio 2001 Prod S.R.L, comuna Horodniceni, județul Suceava, un urs a atacat turma de oi a fermei, sfâșiind o ovină. incidentul s-a  repetat și în noaptea de 17.10.2021 în jurul orei 23 când în apropierea fabricii au apărut 2 urși. La fața locului s-a deplasat echipa  operativă care a procedat la alungarea animalelor.",Alungat,Florentina Botezat
,COMARNIC,"Primar, reprez. UM 0756, medic veterinar, paznici vanat. AVPS Campina",COMARNIC 24,,550986.0,414518.0,12934/29.10.2021,,,,,,,,,,,,,,,,,Mascul,"Alungare prin metode sonore si cu fascicule luminoase, s-a executat foc de arma in plan vertical, ursul se afla intr-o gradina",Alungat,Crina Popa
,COMARNIC,"Primar, reprez. UM 0756, medic veterinar, paznici vanat. AVPS Campina",COMARNIC 24,,550986.0,414518.0,12883/28.10.2021,,,,,,,,,,,,,,,,,Mascul,"Alungare prin metode sonore si cu fascicule luminoase, s-a executat foc de arma in plan vertical, ursul se afla intr-o gradina",Alungat,Crina Popa
,CHIOJDU,"IJJ Buzau, UAT Chiojdu  DS Buzau",SIRIU 33,,26.192423,45.399142,,,,,,,,,,,,,,,,,,,"A fost sesizat ca un  pui de urs a fost prins în gardul unui cetatean  din satul Poienița de Sus com Chiojdu, comisia a hotarat tranchilizarea acestuia si eliberarea în zona învecinată în fond forestier.",Alungat,Ioana Diaconescu
,PALANCA,"Jandarmerie - UM 0836, UAT Palanca, Personal tehnic gestionar , Medic veterinar imputernicit .",COTUMBA 3,,,,4314,,,,,,,,,,,,,,,,,Mascul,"Un exemplar de urs a fost alungat din intravilanul comunei Palanca, cu ajutorul semnalelor acustice.",Alungat,Anca Macor
,VALEA IAŞULUI,jandarmerie,VALEA DANULUI 6,,24.704787,45.186142,1501538 din 01.11.2021,,,,,,,,,,,,,,,,,Mascul,"Ca urmare a unui apel telefonic, echipa de intervenție s-a deplasat în comuna Valea Iașului, sat Valea Uleiului. Nu a fost gasit ursul. Nu au fost victime sau pagube materiale.",Alungat,Marius Dumitru
,SÂNDOMINIC,"Primarul si viceprimarul comunei, reprezentant AVPS Miercurea Ciuc.",BALAN 15,,25.80363078,46.60325004,5982/08.11.2021,,,,,,,,,,,,,,,,,,"Proprietarul a anuntat telefon viceprimarul comunei despre un urs care intentiona sa intre in grajdul de cai. Animalul a fost indepartat prin gonire, a distrus gardul din BCA.",Alungat,Szabo Szilard
,BROŞTENI,Primar U.A.T. Broșteni                                   Personal Jandarmeria Broșteni                     Medic veterinar zona Broșteni   Personal tehnic -  F.C. Nr.1 Pinu (O.S.Broșteni)                              Personal Poliția Broșteni,PINU 1,2021-11-06,553371.0,638425.0,,,,,,,,,,,,,,PINU 1,553371.0,638425.0,,Mascul,"Exemplarul de urs a fost identificat într-o gospodărie  din intravilanul satului Lungeni, oraș Broșteni, lângă  adăpostul cu animale ( vaci, porci, oi, capre), unde a ucis și consumat un exemplar ovină. S-a procedat la alungarea acestuia prin semnale acustice și luminoase, procedură fără rezultat, ursul devenind agresiv față de membrii  echipei de intervenție. A fost luată decizia recoltării exemplarului de urs prin împușcare.",Împușcare,Florentina Botezat
,BROŞTENI,Viceprimar U.A.T. Broșteni                                                  Personal Jandarmeria Broșteni                     Medic veterinar zona Broșteni   Personal tehnic  F.C. Nr.1 Pinu (O.S.Broșteni),,2021-10-28,,,,,,,,,,,,,,,,PINU 1,552416.0,634547.0,,Femela,"În data de 28 octombrie pe numărul de urgență 112 s-a anunțat faptul că un urs a pătruns în curtea locuinței a două persoane, în intravilan, provocând stricăciuni asupra unor stupi de albine. A fost întrunită comisia conf. O.U.G. 81/2021. Inițial exemplarul de urs a fost alungat, dar după aproximativ 10 min. acesta a revenit. S-a încercat din nou alungarea acestuia, dar nu a mai reacționat, dimpotrivă s-a apropiat mai mult de echipa de intervenție, a devenit agresiv încercând să atace , drept pentru care a fost luată decizia  intervenției prin împușcare.",Împușcare,Florentina Botezat
,COMARNIC,"Primar, reprez. UM 0756, medic veterinar, paznici vanat. AVPS Campina",COMARNIC 24,,550986.0,414518.0,13311/08.11.2021,,,,,,,,,,,,,,,,,Mascul,"Alungare prin metode sonore si cu fascicule luminoase, ursul se afla pe o strada in intravilan",Alungat,Crina Popa
,BUŞTENI,"viceprimar, reprezentant unitate jandarmi, gestionar FC, medic veterinar",SINAIA 25,,541822.0,435043.0,15069/10.11.2021,,,,,,,,,,,,,,,,,,alungare cu semnale acustice si luminoase ale autospecialei jandarmeriei,Alungat,Crina Popa
,GALAŢII BISTRIŢEI,"Plutonier adjunct IJJ BN, Secretar Primăria Galații Bistriței, Medic veterinar, Personal Tehnic AVPS  Vulpea Herina",ALBESTI 31,,,,,,,,,,,,,,,,,,,,,,"A fost luată măsura alungării ursului din zonă prin folosirea de semnale acustice și luminoase. La sosirea echipei de intervenție ursul nu a mai fost observat. Au fost produse pagube materiale, respectiv trei ovine au fost ucise și una rănită.",Alungat,Nastase Crina
,BRAŞOV,"Reprezentant U.A.T.Brasov, Personal tehnic gestionar, Medic Veterinar",TIMIS 18,,25.62876,45.615594,121554/12.11.2021,,,,,,,,,,,,,,,,,Femela cu pui,"Aparitia unei ursoaice cu doi pui in capatul strazii Gladiolelor(cart.Noua), care a fost alungata.Ursoaica prezinta dizabilitate avand o problema la membrul anterior drept.",Alungat,Mirela Moisa
