judet,uat,echipa_interventie,fond_cinegetic_alungare,data_interventie,longitudine_alungare,latitudine_alungare,numar_raport_alungare,identificare_relocare,fond_cinegetic_relocare,data_relocare,longitudine_relocare,latitudine_relocare,numar_raport_relocare,identificare_eutanasiere,fond_cinegetic_eutanasiere,longitudine_eutanasiere,latitudine_eutanasiere,nr._raport_interventie_eutanasiere,identificare_impuscare,fond_cinegetic_impuscare,longitudine_impuscare,latitudine_impuscare,nr._raport_interventie_impuscare,sex_urs,descriere_eveniment,metoda_interventie,adaugat_de
,VĂLENII DE MUNTE,"jandarmi, reprezentant UAT, gestionar FC, medic veterinar",CAZACU 34,,45.199285,26.020526,7161/22.04.2024,,,,,,,,,,,,,,,,,,"La sosiea echipei, ursul nu mai era la fata locului, s-a monitorizat zona, s-au folosit mijloace acustice si luminoase pentru alungare",Alungat,Crina Popa
,POLOVRAGI,"Reprezentatnt jandarmerie, reprezentant UAT , personal tehnic ACV Spartacus",OLTET 14,,234727.0,451130.0,4086 din 19.04.2024,,,,,,,,,,,,,,,,,Femela cu pui,"Exemplarul a fost vazut in apropierea gospodariei, iar cei doi pui au fost observati in punctul rampa in timp de ce hraneau din lesurile dezgropate ale unor animale.Reprezentantii jandarmeriei, reprezentanti fondului cinegetic, primarul au produs semnale acustice cu ajutorul sirenei, claxoanelor si luminoase.",Alungat,Consuela Avram
,AREFU,"Jandarmerie, primărie",AREFU 5,,24.618401,45.438484,,,,,,,,,,,,,,,,,,Femela cu pui,Echipa de intervenție a identificat la fața locului două exemplare urs care au fost îndepartate prin semnale acustice,Alungat,Marius Dumitru
,NEHOIU,IJJ. UAT,COLTI 31,,,,5049,,,,,,,,,,,,,,,,,,"Apel 112 ,  privind  prezența unei ursoaice cu pui pe drum  in com Mlăjet. Oras Nehoiu",Altele,Ioana Diaconescu
,MĂNECIU,"jandarmi, primar, gestionar FC, medic veterinar",TELEAJEN 27,,45.293913,25.998236,6556/22.04.2024,,,,,,,,,,,,,,,,,,"La sosirea echipei, ursul nu mai era la fata locului, a omorat 4 oi si un cocos in gospodarie, a venit de mai multe ori,, zona a fost monitorizata, s-au folosit mijloace acustice si luminoase",Alungat,Crina Popa
,AREFU,"Jandarmerie, Primarie, Garda Forestiera Ploiesti",AREFU 5,,45.215358,24.381038,2 din 22.04.2024 ora 15.55,,,,,,,,,,,,,,,,,Femela cu pui,"Ca urmare a unui apel la numarul de urgenta 112, echipa de interventie s-a deplasat ]n zona hotelului posada, DN 7C, km 64, unde a constatat ca o persoana de sex feminin a fost muscata de urs in timp de facea o fotografie  din masina cu geamul deschis. ursul nu se afla in zona. persoana ranita a primit ingrijirile medicale necesare.",Alungat,Marius Dumitru
,LIVEZENI,"Primar, viceprimar, IJJ Mures, reprezentati asociatia de vanatoare, medic veterinar",COCOS 17,,24.662364,46.542495,552/16.01.2024,,,,,,,,,,,,,,,,,Femela,"Femela de urs cu 3 pui alungat din intravilanul comunei Livezeni, str Sportivilor, nr.32 A, jud Mures.  Ursii au rupt gardul si au ravasit tomberoanele.",Alungat,Nagy Hajnal
,LIVEZENI,"Primar, viceprimar, IJJ Mures, reprezentat asociatie de vanatoare, medic veterinar",COCOS 17,,24.634006,46.545547,107/16.01.2024,,,,,,,,,,,,,,,,,Femela cu pui,"Alungare femela de urs cu 3 pui din intravilanul comunei Livezeni, str Padurii, nr. 99 , jud Mures.",Alungat,Nagy Hajnal
,SÂNPAUL,"Primar, Jandarmerie, reprezentanti asociatie de vanatoare",GIULUS 2,,24.383338,46.130346,1065/11.03.2024,,,,,,,,,,,,,,,,,Mascul,"Alungare un exemplar de urs din intravilanul loc. Valea Izvoarelor, com Sanpaul , jud Mures",Alungat,Nagy Hajnal
,SÂNPAUL,"Primar, IJJ Mures, reprezentanti asociatie vanatoare, medic veterinar",GIULUS 2,,24.393338,46.430346,1065/11.03.2024,,,,,,,,,,,,,,,,,,"Urs alungat din intravilanul loc Valea Izvoarelor, com Sanpaul, jud Mures",Alungat,Nagy Hajnal
,SÂNPAUL,"Primar, IJJ Mures,  reprezentantii asociatie vanatoare,",GIULUS 2,,24.383338,46.430346,1165/13.03.2024,,,,,,,,,,,,,,,,,Mascul,"Alungare a 2 exemplare de ursi din intravilanul loc Valea Izvoarelor, com Sanpaul, jud Mures",Alungat,Nagy Hajnal
,MIERCUREA NIRAJULUI,"Reprezentant primarie, IJJ Mures, reprezentanti asociatie de vanatoare, medic veterinar",NIRAJ 42,,24.81511,46.537662,294828.03.2024,,,,,,,,,,,,,,,,,Femela cu pui,"Alungare ursoaica cu 3 pui din intravilanul ors Miercurea Nirajului, str Marton Aron, jud Mures. Ursoaica a atacat  si o persoana.",Alungat,Nagy Hajnal
,SÂNDOMINIC,"Personal jandarmerie, reprezentant UAT, personal tehnic gestionar fc.",BALAN 15,,25.803084,46.602977,24781/22.04.2024,,,,,,,,,,,,,,,,,,Echipa de interventie a efectuat alungarea unui exemplar de urs din intravilanul localitatii prin mijloace acustice si luminoase.,Alungat,Szabo Szilard
,SÂNDOMINIC,"Personal jandarmerie, reprezentant UAT, personal tehnic gestionar fc.",BALAN 15,,25.804549,46.605997,2479/22.04.2024,,,,,,,,,,,,,,,,,,Echipa de interventie a fost convocata din cauza unui exemplar de urs care a intrat in localitate. Pana la sosirea personalului ursul s-a retras in padure.,Alungat,Szabo Szilard
,NEHOIU,"IJJ, UAT",VALEA NEHOIULUI 32,,,,5218,,,,,,,,,,,,,,,,,,Apel 112 prezenta urs pe strada intrare in sat Chirlesti Nehoiu,Altele,Ioana Diaconescu
,NEHOIU,"Reprezentantul UAT Nehoiu, reprezentant IJJ Buzau, proprietar",VALEA NEHOIULUI 32,,45.4299,26.283378,4,,,,,,,,,,,,,,,,,,"Prin apel 112 a fost semnalata prezenta unui urs in satul Valea Nehoiului, mergand pe DN 10. Nu au fost produse pagube materiale.  echipa de interventie a parcurs la alungarea ursului prin semnale sonore.",Alungat,Mihaela Ifrim
,LEREŞTI,"Jandarmerie, Primărie, Gestionar fond cinegetic",RAUL TARGULUI 18,,45.345042,25.064964,,,,,,,,,,,,,,,,,,,Ca urmare a apelului telefonic echipa de intervenție nu a găsit ursul la fața locului. s-au executat patrulări.,Alungat,Marius Dumitru
,CÂMPURI,"reprezentant UAT, personal din cadrul IJJ Vrancea, reprezentant gestionar fond cinegetic, medic veterinar imputernicit",,,,,2083,,,,,,,,,,,,,,,,,,prezenta  urs (femela si  5 -cinci -pui),Alungat,Radu Sandu
,NEHOIU,"Reprezentant IJJ Buzău, reprezentant UAT Nehoiu",PATARLAGELE 30,,45.3549,26.3434,3,,,,,,,,,,,,,,,,,,"A fost semnalată prezenta unui urs in satul Chirlesti, pe DN 10. Echipa d einterventie a alungat ursul prin semnale sonore si luminoase. Nu au fost pagube.",Alungat,Mihaela Ifrim
,NEHOIU,"Reprezentant UAT Nehoiu, reprezentant IJJ Buzau",PATARLAGELE 30,,45.360778,26.3435371,5,,,,,,,,,,,,,,,,,,"A fost semnalata prezenta unui urs pe drum, in satul Mlajet. Nu sunt pagube.",Alungat,Mihaela Ifrim
,NEHOIU,"Reprezentant UAT Nehioiu, reprezentant IJJ Buzau",PATARLAGELE 30,,45.359173,26.3325139,6,,,,,,,,,,,,,,,,,,"In urma apelului 112, s-a semnalat prezenta unui urs, si s-a deplasat echipa de interventie in satul Chirlesti, S-a efectuat alungarea acestuia. Nu au fost pagube.",Alungat,Mihaela Ifrim
,NEHOIU,"Reprezentant IJJ Buzau, reprezentant primarie oraș Nehoiu",PATARLAGELE 30,,45.35859,26.333133,7,,,,,,,,,,,,,,,,,,"A fost semnalata prezenta unei ursoaicei cu pui in satul Chirlesti, DN 10. S-a parcurs la alungarea acestora.",Alungat,Mihaela Ifrim
,ZĂRNEŞTI,"Personal Jandarmerie, Reprezentant UAT, Personal GFC, medic veterinar",BARSA 31,,25.168483,45.644956,5/02.05.2024,,,,,,,,,,,,,,,,,Femela cu pui,Alungare ursoaica cu 2 pui din zona Plaiul Foii Zărnești. In vederea alungării au fost folosite petarde pentru intervenție.,Alungat,Viorel Marean
,NEHOIU,"IJJ, UAT, AJVPS Buzău",PATARLAGELE 30,,45.859442,26.332923,5547/07.05.2024,,,,,,,,,,,,,,,,,,Apel 112 semnalează prezenta unei ursoaice cu pui in gradina unei locuinte sat Chirlesti Nehoiu,Alungat,Ioana Diaconescu
,ALBA IULIA,"Reprezentant Jandarmerie, UAT, Personal gestionar, medic veterinar",,,,,,,,,,,,,OARDA 37,23.581649,46.029394,50713/ 25.04.2024,,,,,,Mascul,"Un exemplar din specia urs, de aproximativ 2 ani, ranit in urma unui accident de circulatie, a fost gasit in locul numit La ciresi, langa Autostrada A1, Oarda de Jos, mun. Alba Iulia. Deoarece nu se mai putea deplasa, avand numeroase leziuni la nivelul membrelor si bazinului, medicul veterinar a luat decizia impuscarii acestuia.",Eutanasiat,Adina Costea
,POLOVRAGI,"Reprezentant Jandarmerie, reprezentant UAT Polovragi, personal tehnic ACV Spartacus,",OLTET 14,,238100.0,451878.0,4520,,,,,,,,,,,,,,,,,Femela cu pui,In spatele casei langa gard a fost observat un pui de urs care a fost indepartat prn mijloace acustice,Alungat,Consuela Avram
,MĂNECIU,"jandarmi, primar, gestionar FC, medic veterinar",TELEAJEN 27,,45.31431,25.984757,7230/07.05.2024,,,,,,,,,,,,,,,,,,"Urs aflat in curtea unei locuinte, a distrus gardul si un perete al saivanului, incercand sa ajunga la animale, a fost alungat",Alungat,Crina Popa
,ALUNIŞ,"jandarmi, primar, gestionar FC, medic veterinar",PALTINET 35,,45.205651,25.863474,3147/08.05.2024,,,,,,,,,,,,,,,,,Mascul,In urma apelului la 112 s-a facut actiune de alungare pentru un urs cu varsta de circa de 9 ani,Alungat,Crina Popa
,AVRĂMEŞTI,"Reprezentant UAT, personal tehnic gestionar fc., medic veterinar imputernicit",TARCESTI 42,,25.010982,46.335562,2715/03.05.2024,,,,,,,,,,,,,,,,,Femela cu pui,Echipa de interventie a efectuat alungarea unuei femele de urs cu doi pui mari din intravilanul localitatii prin mijloace acustice si luminoase.,Alungat,Szabo Szilard
,AVRĂMEŞTI,"Personal jandarmerie, reprezentant UAT, personal tehnic gestionar fc., medic veterinar imputernicit",TARCESTI 42,,25.014289,46.337642,2720/05.05.2024,,,,,,,,,,,,,,,,,Femela cu pui,Echipa de interventie a efectuat alungarea femelei de urs cu doi pui  din intravilanul localitatii prin mijloace acustice si luminoase.,Alungat,Szabo Szilard
,AVRĂMEŞTI,"Personal jandarmerie, reprezentant UAT, personal tehnic gestionar fc., medic veterinar imputernicit",,2024-05-07,,,,,,,,,,,,,,,,TARCESTI 42,25.340225,46.340225,2738/07.05.2024,Femela cu pui,"Ún urma apelului la nr. 112 echipa de interventie a incercat alungarea din intravilan a femelei de urs cu doi pui mari. Animalul a rectionat agresiv, nu s-a retras in urma focurilor de avertisment, a atacat personalul. Medicului veterinar nu a reusit tranchiliza animalul, motiv din care s-a decis extragerea ei prin impuscare.",Împușcare,Szabo Szilard
,BISTRIŢA,"reprezentant IJJ BN,  viceprimar UAT Bistrița, reprezentant OSM Bistrita RA, medic  veterinar",DUMITRA 22,,,,1065/26.04.2024,,,,,,,,,,,,,,,,,Mascul,"S-a verificat zona, dar nu s-a constatat prezența ursului în apropierea imobilelor",Alungat,Somfelean Nicoleta
,SINAIA,"Jandarmerie, viceprimar, personal GFC, medic veterinar",SINAIA 25,,45.364526,25.545672,12313/15.05.2024,,,,,,,,,,,,,,,,,Mascul,"Exemplarul de urs a intrat in gospodarie si a provocat pagube materiale, gard rupt si gradina distrusa, a provocat panica, a fost alungat in zona impadurita si este monitorizata zona",Alungat,Crina Popa
,LEREŞTI,"Jandarmerie, primarie, Gestionar fond cinegetic",RAUL TARGULUI 18,,45.4465671,25.0062425,,,,,,,,,,,,,,,,,,,Dupa apel telefonic echipa de interventie s-a deplasat în satul Pojorâta unde se semnalase prezența a doi urși. La sosirea echipei cei doi urși fuseseră alungați de localnici prin strigăte.,Alungat,Marius Dumitru
,SINAIA,"jandarmi, viceprimar, gestionar FC, medic veterinar",SINAIA 25,,45.362876,25.54756,12551/17.05.2024,,,,,,,,,,,,,,,,,Mascul,"Urs de 3 ani care intra in gospodarii si nu pleaca in prezenta omului, a fost alungat in padure cu mijloace acustice si luminoase, s-a montat cusca, zona este monitorizata, cetatenii au fost instruiti sa nu il hraneasca si sa nu se apropie de animal",Alungat,Crina Popa
,NEHOIU,"IJJ, UAT Nehoiu , AJVPS Buzau",VALEA NEHOIULUI 32,,45.38357,26.37096,6164/20.05.2024,,,,,,,,,,,,,,,,,,Apel 112 prezenta urs în gtadina unei gospodarii sat Curmatura Oras Nehoiu,Alungat,Ioana Diaconescu
,CĂIUŢI,"Personal Jandarmerie, Reprezentant UAT, Personal tehnic gestionar.",BALCA 50,,,,5392/14.05.2024,,,,,,,,,,,,,,,,,,A fost alungat un exemplar de urs cu ajutorul mijloacelor acustice si luminoase. Au fost folosite 2 petarde.,Alungat,Anca Macor
,CĂIUŢI,"Personal Jandarmerie , Reprezentant  UAT,   Personal tehnic gestionar , Medic veterinar împuternicit.",BALCA 50,,,,5426/15.05.2024,,,,,,,,,,,,,,,,,,A fost alungat un exemplar de urs.,Alungat,Anca Macor
,RÂMNICU VÂLCEA,"Personal jandarmerie, reprezentant UAT , personal tehnic Gestionar",GORANU 16,,24.386518,45.0954031,21080,,,,,,,,,,,,,,,,,Femela cu pui,"A fost semnalat prezenta unei ursoaice cu pui pe str. Fântânii, zona Goranu, Rm Vâlcea. S-au prezentat echipele din cadrul Insp. de Jandarmi Vâlcea, Poliția Locală, reprez. AVPS Vâlcea și reprez. al Primăriei Mun. Rm. Vâlcea. În urma verificării făcute nu a fost găsit animalul sălbatic cu puii, drept urmare s-au luat măsuri de alungare prin semnale acustice.",Alungat,Anca Dicu
,RÂMNICU VÂLCEA,"Personal Jandarmerie, reprezentant UAT Rm Valcea, personal tehnic gestionar, apelant",GORANU 16,,,,21309,,,,,,,,,,,,,,,,,,"În urma apelurilor preluate de serv de urg. 112, direcționate către Jandarmeria Vâlcea, prin care au fost semnalate prezența unui urs în zona Goranu, str. Fântânii. La fața locului s-au prezentat Jandarmeria, Poliția Locală, ISU, AJVPS  Vâlcea și reprez. al Primăriei Rm vâlcea. În urma verificării făcute în zona nu a fost găsit animalul sălbatic(urs), drept urmare s-au luat măsuri de alungare prin semnale acustice.",Alungat,Anca Dicu
,BRETEA ROMÂNĂ,,SILVAS 48,,22.938573,45.685857,4596/20.05.2024,,,,,,,,,,,,,,,,,,"Apel telefonic la 112 prin care se semnala prezența unui exemplar de urs în grădina unui localnic din satul Ocolișu Mare nr. 63 din com. Bretea Română. La fața locului s-a deplasat echipa de interventie, procedând la alungarea animalului. S-a considerat că nivelul de risc a fost unul mediu.",Alungat,Anca Ungureanu
,LUPENI,"Personal jandarmerie, reprezentant UAT, personal tehnic gestionar fc., medic veterinar imputernicit",DEALU 43,,25.2155,46.3575,1/02.05.2024,,,,,,,,,,,,,,,,,,Echipa de interventie a efectuat alungarea unui exemplar de urs din intravilanul localitatii prin mijloace acustice si luminoase.,Alungat,Szabo Szilard
,LUPENI,"Personal jandarmerie, reprezentant UAT, personal tehnic gestionar fc., medic veterinar imputernicit",TARCESTI 42,,25.1958,46.7341,2/02.05.2024,,,,,,,,,,,,,,,,,Femela cu pui,Echipa de interventie a fost convocata si a deplasat la Satu Mic din cauza unei femele de urs cu un pui care a aparut in intravilan. Pana au ajuns in fata locului animalele au fost deja alungate de localnici.,Alungat,Szabo Szilard
,LUPENI,"Personal jandarmerie, reprezentant UAT, personal tehnic gestionar fc., medic veterinar imputernicit",TARCESTI 42,,25.1933,46.3822,3/06.05.2024,,,,,,,,,,,,,,,,,,Echipa de interventie a efectuat alungarea unui exemplar de urs din intravilanul localitatii prin mijloace acustice si luminoase. Ursul a revenit de doua ori pana s-a reusit alungarea.,Alungat,Szabo Szilard
,LUPENI,"Reprezentant UAT, personal tehnic gestionar fc., medic veterinar imputernicit",TARCESTI 42,,25.1933,46.3822,4/09.05.2024,,,,,,,,,,,,,,,,,,Echipa de interventie a efectuat alungarea unui exemplar de urs care a revenit in intravilanul localitatii prin mijloace acustice si luminoase.,Alungat,Szabo Szilard
,LUPENI,"Personal jandarmerie, reprezentant UAT, personal tehnic gestionar fc., medic veterinar imputernicit",DEALU 43,,25.1944,46.3836,5/13.05.2024,,,,,,,,,,,,,,,,,,Echipa de interventie a a fost convocat pentru alungarea unui exemplar de urs din intravilanul localitatii Paltinis. Pana la sosirea in fata locului animalul a fost alungat de localnici.,Alungat,Szabo Szilard
,LUPENI,"Reprezentant UAT, personal tehnic gestionar fc., medic veterinar imputernicit",DEALU 43,,25.2151,46.3633,6/24.04.2024,,,,,,,,,,,,,,,,,,Echipa de interventie a efectuat alungarea unui exemplar de urs din intravilanul localitatii prin mijloace acustice si luminoase. Ursul a fortat usa de intrare a casei.,Alungat,Szabo Szilard
,CORUND,"Personal jandarmerie, reprezentant UAT",CORUND 39,,25.17185,46.49065,4346/16.05.2024,,,,,,,,,,,,,,,,,,Echipa de interventie a efectuat alungarea exemplarului de urs din zona turistica si rezervatie Dealul Melcului prin mijloace acustice.,Alungat,Szabo Szilard
,CORUND,"Personal jandarmerie, reprezentant UAT, personal tehnic gestionar fc., medic veterinar imputernicit",CORUND 39,,25.17185,46.49065,3567/16.05.2024,,,,,,,,,,,,,,,,,,Echipa de interventie a efectuat alungarea unui exemplar de urs din zona turistica Dealul Melcului prin mijloace acustice si luminoase. Ursul a produs distrugeri in bunuri si s-a manifestat agresiv fata de echipa de interventie.,Alungat,Szabo Szilard
,CORUND,"Reprezentant UAT, personal tehnic gestionar fc., medic veterinar imputernicit",CORUND 39,,25.17185,46.49065,3564/16.05.2024,,,,,,,,,,,,,,,,,,Echipa a alungat cu ajutorul petardelor exemplarul de urs care a omorat un caine in zona turistica Dealul Melcului.,Alungat,Szabo Szilard
,OITUZ,"Personal Jandarmerie,  reprezentant UAT, personal tehnic gestionar,  medic veterinar .",,2024-05-18,,,,,,,,,,,,,,,,OITUZ 20,26.604665,46.220595,9999/18.05.2024,Mascul,"Primarul comunei Oituz a convocat echipa de interventie pentru eliberarea(prin tranchilizare) a unui exemplar de urs prins in sarma unui gard. Ursul a rupt sarma, atacand echipa de interventie, moment in care s-a luat decizia de a impusca exemplarul de urs.",Împușcare,Anca Macor
,RÂMNICU VÂLCEA,"Personal Jandarmerie, reprez. UAT, personal tehnic Gestionar",GORANU 16,,24.4019,45.1123,21315,,,,,,,,,,,,,,,,,,"În urma apelului la serv. de urgență 112, direcționat către Jandarmeria Vâlcea prin care un cetățean a semnalat prezența unui animal sălbatic (urs) în vecinătatea gospodăriei din str. Islazului, nr. 12 Goranu, Rm vâlcea. La fața locului s-au deplasat Jandarmeria Vâlcea, AJVPS, reprez. UAT, Poliția Locală. În urma verificărilor făcute nu a fost găsit animalul sălbatic, s-au luat măsurile de alungare prin semnale sonore.",Alungat,Anca Dicu
,DUMITRIŢA,"Plt. Adj- I.J.J BN, viceprimar comuna Dumitrița, Reprezentant gestionar fond cinegetic",BUDAC 27,,,,1923/21.05.2024,,,,,,,,,,,,,,,,,,"La sosirea echipei de interventie ursul nu mai era in zona, s-au folosit semnalele acustice si sonore",Alungat,Rus Paul
,RUCĂR,"Jandarmerie, Primarie, Gestionar Fond cinegetic",RUCAR 22,,25.1193485,45.5003484,,,,,,,,,,,,,,,,,,,Apelantul a relatat faptul ca a vazut un urs in gspodarie. echipa de interventie nu a gasit ursul in zona. nu au fost pagube. S-a procedat la patrulare.,Alungat,Marius Dumitru
,RÂMNICU VÂLCEA,"Personal Jandarmerie, reprezentant UAT Rm Valcea",GORANU 16,,,,21565,,,,,,,,,,,,,,,,,,"În urma apelului la serviciul de urgență 112, direcționat către Jandarmerie, prin care un cetățean a semnalat prezența unui animal sălbatic (urs) în vecinătatea gospodăriei din strada Islazului, zona Goranu, pct Islaz, din Rm Valcea. La fața locului s-au prezentat Jandarmeria, ISU si reprezentant UAT Rm. Valcea. În urma verificării la fața locului animalul nu a fost găsit. S-au luat măsuri de alungare.",Alungat,Anca Dicu
,NEHOIU,"UAT, IJJ, AJVPS Buzau",COLTI 31,,45.3787898,26.3296845,6360/22.05.2024,,,,,,,,,,,,,,,,,,Apel 112 prezenta ursoaica cu pui la o stupina în gradina gospodăriei  loc Mlăjet,Alungat,Ioana Diaconescu
,VALEA DOFTANEI,"Jandarmerie, primar, personal GFC, medic veterinar",SETU 21,,45.31327,25.72328,8759/17.05.2024,,,,,,,,,,,,,,,,,Femela cu pui,Femela cu doi pui care au fost alungati in zona impadurita fara sa produca pagube,Alungat,Crina Popa
,SCORŢENI,"Jandarmerie, viceprimar, personal GFC, medic veterinar",MISLEA 19,,45.096358,25.815328,8831/21.05.2024,,,,,,,,,,,,,,,,,,"Echipa s-a intrunit la apel 112, s-au folosit semnale acustice si luminoase pentru alungare",Alungat,Crina Popa
,SINAIA,"Jandarmerie, viceprimar, personal GFC, medic veterinar",SINAIA 25,,45.35454,25.54547,12775/21.05.2024,,,,,,,,,,,,,,,,,Femela cu pui,"Femela cu doi pui care intra in gospodarii si produc panica, au fost alungati in zona impadurita cu semnale acustice si luminoase si spray pentru animale",Alungat,Crina Popa
,SINAIA,"Jandarmerie, viceprimar, personal GFC, medic veterinar",SINAIA 25,,45.354696,25.544651,12777/21.052024,,,,,,,,,,,,,,,,,Mascul,"Mascul de 3 ani care a tranzitat parcul, a patruns prin gospodarii, a urcat pe Furnica, a intrat in curte, a fost alungat cu semnale acustice, luminoase si spray pentru animale",Alungat,Crina Popa
,MIERCUREA-CIUC,"Personal jandarmerie, reprezentant UAT, personal tehnic gestionar fc., medic veterinar imputernicit",PAULENI 23,,25.83129,46.38071,20585/30.04.2024,,,,,,,,,,,,,,,,,,La or 22 echipa a intervenit pentru alungarea unui exemplar de urs din curtea casei. Ursul a mai intrat si intr-o alta curte pana s-a reusit alungarea spre padure.,Alungat,Szabo Szilard
,MIERCUREA-CIUC,"Personal jandarmerie, reprezentant UAT, personal tehnic gestionar fc., medic veterinar imputernicit",PAULENI 23,,25.8292,46.37837,22995/21.05.2024,,,,,,,,,,,,,,,,,,Echipa a intervenit din cauza a 3 pui de ursi mari care au fost alungati de mai multe ori din zona. Din auza riscului s-a incercat tranchilizarea si relocarea acestora dar fara succes. Exemplarele s-au retras in padure.,Alungat,Szabo Szilard
,MIERCUREA-CIUC,"Personal jandarmerie, reprezentant UAT, personal tehnic gestionar fc., medic veterinar imputernicit",,2024-05-22,,,,,,,,,,,,,,,,PAULENI 23,25.82886,46.37759,23545/23.05.2024,,A fost solicitata interventia echipei din cauza faptului ca cei trei pui de ursi mari (1mascul si 2 femele de apr 3 ani) cu antecedente in intravilan au intrat in curtea unei case si au incercat sa patrunda in cladire. Ursii alungati s-au retras pana in zona izvorului dar acolo s-au intors inpotriva echipei de interventie si s-au manifestat agresiv. Din cauza riscului ridicat si neavand alta optiune de a rezolva situatia echipa s-a decis extragerea acestora prin impuscare.,Împușcare,Szabo Szilard
,OITUZ,"Personal Jandarmerie , reprezentant UAT, personal tehnic gestionar,  medic veterinar împuternicit",OITUZ 20,,,,10697/25.05.2024,,,,,,,,,,,,,,,,,,Exemplarul de urs nu a fost identificat. Au fost folosite preventiv semnale acustice.,Alungat,Anca Macor
,SINAIA,"jandarmi, viceprimar, gestionar FC, medic veterinar",SINAIA 25,,45.35142,25.538194,13206/27.05.2024,,,,,,,,,,,,,,,,,Femela cu pui,"Femela cu doi pui de 4 luni care au patruns in gospodarii, producand panica si pagube materiale, nu se indeparteaza la prezenta omului, au fost alungati cu mijloace acustice si luminoase si spray pentru urs, nu s-a reusit capturarea lor.",Alungat,Crina Popa
,CIUMANI,"Personal jandarmerie, reprezentant UAT, personal tehnic gestionar fc., medic veterinar imputernicit",BORZONT 13,,25.528438,46.671946,1953/23.05.2024,,,,,,,,,,,,,,,,,Femela cu pui,Echipa de interventie a efectuat alungarea unui exemplar de urs din intravilanul localitatii prin mijloace acustice si luminoase.,Alungat,Szabo Szilard
Harghita,TOPLIŢA,"Personal jandarmerie, reprezentant UAT, personal tehnic gestionar fc., medic veterinar imputernicit",,,,,,07 URS E DON VET,TOPLITA 1,28-05-2024,25.35181,46.916184,fn/28.05.2024,,,,,,,,,,,Mascul,Echipa de interventie a efectuat tranchilizarea si relocarea pa aceeasi fond cinegetic a unui exemplar de urs mascul de apr. 2 ani care a intrat in mod regulat in intravilan.,Relocat,Szabo Szilard
Harghita,TOPLIŢA,"Personal jandarmerie, reprezentant UAT, personal tehnic gestionar fc., medic veterinar imputernicit",,,,,,URS 06 E DONVET,TOPLITA 1,20-05-2024,25.349754,46.91644,fn./20.05.2024,,,,,,,,,,,Femela,Echipa de interventie a efectuat tranchilizarea si relocarea pe aceeasi fond cinegetic a unui exemplar de urs femel de apr. 2 ani care a intrat in mod regulat in intravilan.,Relocat,Szabo Szilard
,SÂNDOMINIC,"Personal jandarmerie, reprezentant UAT, personal tehnic gestionar fc., medic veterinar imputernicit",BALAN 15,,25.801183,46.595483,3113/27.05.2024,,,,,,,,,,,,,,,,,Mascul,Echipa de interventie a fost convocata prin nr. 112 pentru alungarea unui examplar de urs din intravilan care a intrat intr-o curte si a omorat un caine.,Alungat,Szabo Szilard
,NOCRICH,"Reprezentanți ai Jandarmeriei, Primăriei, Gestionarului, Medicul veterinar",MARPOD 39,,24.451,45.8289,3674,,,,,,,,,,,,,,,,,,"Urmare apelului la 112 s-a format comisia. La ora întrunirii nu au mai fost regăsiți urșii, care au atacat efectivul de bovine al apelantului.",Altele,Gabriela Capatana
,DALNIC,"Primar, paznic de vânătoare, medic veterinar, jandarmerie",,,,,,,,,,,,,DALNIC 16,25.996523,45.913004,1054/06.04.2024,,,,,,Femela,"În data de 06.04.2024 ora 18:)) a fost sesizat prezenta unei exemplar de urs în intravilanul localității Dalnic. La convocarea comisiei s-a prezentat membrii si s-adecis alungarea exemplarului, fără rezultat, după care animalul a fost tranchilizat si prin exemenul clinic s-a constatat că animalul suferă de fractură de bazin, care este incompatibil cu viata si ca urmare s-a decis la eutanasierea exemplarului.",Eutanasiat,Berde Lajos
Covasna,BIXAD,"primar, jandarmerie, paznic de vânătoare, medic veterinar",,,,,,TWP - URS - 017,BICSAD 12,30-04-2024,25.9232,46.129,1034/30.04.2024,,,,,,,,,,,Femela,"In jurul orei 14 in data de 30.04.2024 a fost semnalat prezenta unui urs langa marginea drumului DN 11C in urma caruia a fost convov=cat echipa de interventie conform OUG nr. 81, respectiv a fost solicitat si ajutorul politiei, echipajul din raza comunei Bixad. dupa intrunirea echipei de interventie s-a luat decizia de relocare a exemplarului, care cerseste de mai mult timp in acea zona.",Relocat,Berde Lajos
,ÎNTORSURA BUZĂULUI,"Jandarmerie, primar, paznic de vânătoare, medic veterinar",ZABRATAU 33,,26.05483,46.122241,25053/13.05.2024,,,,,,,,,,,,,,,,,,La locul anuntat nu s-a identificat prezenta unui urs.,Alungat,Berde Lajos
,ÎNTORSURA BUZĂULUI,"viceprimar, medic veterinar",ZABRATAU 33,,26.03681,46.10571,25473/16.05.2024,,,,,,,,,,,,,,,,,,animalul nu a mai fost vazut la fata locului la sosirea echipei de interventie.,Alungat,Berde Lajos
