NR. CRT.,Indicativ drum,De la km,Pana la km,De la data,Pana la data,Intre localitatile,Cauza,Masuri de remediere,viz_name,map_zoom
1.1,DN11,85+600,85+650,2024-11-06 14:00:00,2024-11-06 14:59:00,OITUZ (CV) - OITUZ (CV),"Tamponare intre 2 autoutilitare, carosabil uscat.",Se circula alternativ pe banda libera.,DN11,"['85', '600', '85', '650']"
1.2,DN17,55+000,55+000,2024-11-06 13:30:00,2024-11-06 16:00:00,VIISOARA (BN) - VIISOARA (BN),Coliziune intre un autobus si un autovehciul. Circulatia se desfasoara alternativ dirijat.,"Prezenta la fata locului: politia, ambulanta.",DN17,"['55', '0', '55', '0']"
1.3,DN6,308+000,309+000,2024-11-05 21:00:00,2024-11-06 20:00:00,IGIROASA (MH) - ,Accident feroviar.,"Partea carosabila curata si uscata. In urma evenimentului feroviar de pe Magistrala 100, kilometrul feroviar 330, din localitatea Igiroasa, judetul Mehedinti, in urma caruia 4 vagoane ale trenului de marfa 66078 au deraiat, alte 3 s-au rasturnat, iar dintr-unul sunt scurgeri de benzina, a fost instituita o zona de siguranta de aproximativ 300 metri, fiind oprita total circulatia rutiera pe DN 6, intre kilometrii 308 si 309. Traficul auto este dirijat pe DN 67A, prin localitatea Strehaia si pe DN 56A, prin localitatea Simian. In zona sunt formate coloane de aproximativ 500 de metri pe ambele sensuri de mers, care sunt dirijate de politistii rutieri pe rutele ocolitoare stabilite. Se estimeaza reluarea circulatiei in conditii normale in jurul orei 20:00.",DN6,"['308', '0', '309', '0']"
1.4,DN67C,34+800,79+200,2024-06-01 08:00:00,2024-11-16 18:00:00,RANCA (GJ) - CURPAT (SB),"Incepand cu data de 01.06.2024, se redeschide circulata rutiera pe timpul zilei pe DN 67C Transalpina, intre orele: 08:00-18:00 cu restrictie de viteza de 30 km/h, iar accesul autovehiculele cu MTMA > 3,5 to este interzis. In interval orar: 18:00-08:00 accesul este interzis din cauze obiective care tin de specificul acestei zone montane aflate la mare altitudine . INCEPAND CU DATA DE 20.09.2024 INTERVALUL ORAR DE CIRCULATIE SE VA MODIFICA , ASTFEL: 09:00 - 20:00, ramanand in vigoare celelalte restrictii .",Respectarea acestor restrictii este obligatorie pentru evitarea unor evenimente periculoase si pentru deplasarea in conditii de siguranta.,DN67C,"['34', '800', '79', '200']"
1.5,DN7,160+000,160+000,2024-11-06 12:20:00,2024-11-06 16:00:00,MILCOIU (VL) - ,"Eveniment rutier, un autotren (TIR) in urma unei defectiuni, a ramas imobilizat in partea carosabila. Partea carosabila, curata si uscata. Nu sunt victime. Cauza accidentului, defectiune tehnica.",Circulatia rutiera se desfasoara pe 1/2 cale. La fata locului se afla Politia si o echipa de interventie de la Drumuri.,DN7,"['160', '0', '160', '0']"
