NR. CRT.,Indicativ drum,De la km,Pana la km,De la data,Pana la data,Intre localitatile,Cauza,Masuri de remediere,viz_name,map_zoom
1.1,A2,11+700,15+500,2024-06-10 23:00:00,2024-06-14 04:00:00, - ,Trafic restrictionat pe A2 intre orele 23:00-04:00. Se executa lucrari de slefuire si vopsire la pasajul care traverseaza autostrada.,"Rute ocolitoare:- Directia de deplasare Bucuresti (Bd. Theodor Pallady) - Constanta:Bd. Theodor Pallady - A2, nod rutier km 12 - Centura Bucuresti DNCB - DN3, Fundulea - A2, Constanta- Directia de deplasare Constanta - Bucuresti:A2 - nod rutier km 15 - DJ301, Cernica - Centura Bucuresti DNCB.",A2,"['11', '700', '15', '500']"
1.2,DN11,48+500,48+600,2024-06-13 07:00:00,2024-06-13 12:00:00,CERNAT (CV) - TARGU SECUIESC (CV),Ploua abundent. Apa pe partea carosabila partea stanga. Se circula ingreunat pe un sens.,La fata locului s-au deplasat echipe de la politie si lucratori de la drumuri nationale.,DN11,"['48', '500', '48', '600']"
1.3,DN67C,34+800,79+200,2024-06-01 08:00:00,2024-11-01 18:00:00,RANCA (GJ) - CURPAT (SB),"Incepand cu data de 01.06.2024, se redeschide circulata rutiera pe timpul zilei pe DN 67C Transalpina, intre orele: 08:00-18:00 cu restrictie de viteza de 30 km/h, iar accesul autovehiculele cu MTMA > 3,5 to este interzis. In interval orar: 18:00-08:00 accesul este interzis din cauze obiective care tin de specificul acestei zone montane aflate la mare altitudine.",Respectarea acestor restrictii este obligatorie pentru evitarea unor evenimente periculoase si pentru deplasarea in conditii de siguranta.,DN67C,"['34', '800', '79', '200']"
1.4,DN76,153+154,153+154,2024-06-13 06:10:00,2024-06-13 09:30:00,CEICA (BH) - BUCIUM (BH),Accident rutier. Eroare umana intre 2 autocamioane .Se circula alternativ pe o singura banda.,"Politie ,Smurd si personal propriu la fata locului.",DN76,"['153', '154', '153', '154']"
1.5,DN7C,104+000,129+500,2024-06-07 07:00:00,2024-06-30 21:00:00,PISCUL NEGRU (AG) - BALEA CASCADA (SB),"Incepand cu data de 07.06.2024, se redeschide circulata rutiera pe timpul zilei pe DN 7C Transfagarasan, intre orele 07:00 - 21:00. In cazul unor fenomene meteorologice nefavorabile drumul va fi inchis temporar pana cand vremea va permite redeschiderea.",,DN7C,"['104', '0', '129', '500']"
