NR. CRT.,Indicativ drum,De la km,Pana la km,De la data,Pana la data,Intre localitatile,Cauza,Masuri de remediere,viz_name,map_zoom
1.1,A0 SUD,75+000,75+000,2024-04-17 19:15:00,2024-04-17 22:00:00, - ,"Nodul rutier de la KM 75+000. Breteaua de inrare din DN 5 spre Bragadiru. Implicate doua autoturisme. Fara victime. Carosabil umed. Se circula pe banda 1. Banda 2 este blocata. Starea timpului ploua. La fata locului se afla politia, ambulanta, SMURD si lucratori de la drumuri nationale.",,A0 SUD,"['75', '0', '75', '0']"
1.2,DN 22J,0+000,4+200,2024-04-18 07:00:00,2024-04-18 16:00:00,SMARDAN (TL) - SMARDAN (TL),Se executa lucrari de colmatare rosturi.,"Circulatie alternativa, semnalizare de pozitionare a lucrarilor (balize, conuri de dirijare + piloti de circulatie).",DN 22J,"['0', '0', '4', '200']"
1.3,DN64,66+800,74+000,2024-04-18 08:00:00,2024-04-18 18:00:00,CALINA (VL) - ZAVIDENI (VL),Se lucreaza la reparatii asfaltice.,"Circulatia rutiera se desfasoara pe 1/2 cale, dirijata de piloti de circulatie.",DN64,"['66', '800', '74', '0']"
1.4,DN67,138+000,139+000,2024-04-18 08:00:00,2024-04-18 16:00:00,MILOSTEA (VL) - SLATIOARA (OT),Se lucreaza la montare/reparare parapet metalic.,"Circulatia rutiera se desfasoara pe 1/2 cale, dirijata de piloti de circulatie.",DN67,"['138', '0', '139', '0']"
1.5,DN7,143+000,143+000,2024-04-17 01:03:00,2024-04-18 12:00:00,LINTESTI (AG) - ,Va informam ca a avut loc un eveniment rutier in care un camion s-a rasturnat pe partea carosabila. In urma evenimentului nu au fost raportate victime.,Circulatia se desfasoara pe cate o banda in fiecare sens de deplasare.,DN7,"['143', '0', '143', '0']"
1.6,DN7,198+400,200+000,2024-04-18 09:00:00,2024-04-18 15:30:00,CACIULATA (VL) - BREZOI (VL),Se lucreaza la ranguire versanti.,"Circulatia rutiera se inchide/deschide in reprize de max. 20 minute, dirijata de piloti de circulatie.",DN7,"['198', '400', '200', '0']"
1.7,DN7CC,5+000,7+000,2024-04-18 08:00:00,2024-04-18 16:00:00,JIBLEA NOUA (VL) - PAUSA (VL),Se lucreaza la cosit vegetatie mecanizat.,Circulatia rutiera se desfasoara ingreunat pe ambele sensuri de mers.,DN7CC,"['5', '0', '7', '0']"
