NR. CRT.,Indicativ drum,De la km,Pana la km,De la data,Pana la data,Intre localitatile,Cauza,Masuri de remediere,viz_name,map_zoom
1.1,A1,518+000,518+000,2025-02-19 05:10:00,2025-02-19 10:00:00,ORTISOARA (TM) - ,"Un TIR a lovit din spate un utilaj de deszapezire, iar in urma impactului TIR - ul s-a rasturnat pe partea carosabila.Drum uscat, cer senin, temperatura - 6 grade C.","Banda 1 si banda 2 - inchise (Calea 1).Se circula pe banda de urgenta.Se estimeaza reluarea circulatiei normale, in jurul orei 10:00.",A1,"['518', '0', '518', '0']"
1.2,DN1B,48+000,48+000,2025-02-19 07:50:00,2025-02-19 12:00:00,SAHATENI (BZ) - ,"O cisterna Mercedes a ramas blocata pe partea stanga a carosabilului, sens Buzau - Ploiesti. A ramas fara directie, oprindu-se motorul. Circulatie alternativa.","Politie, echipa SDN Buzau la fata locului.",DN1B,"['48', '0', '48', '0']"
1.3,DN6,77+500,77+500,2025-02-18 09:30:00,2025-02-19 12:00:00,VITANESTI (TR) - ,"Un autocamion a ramas imobilizat pe carosabil (defectiune tehnica) de la ora 9,30/ 18.02.2025. Circulatia rutiera este ingreunata (dirijata de politie) de la ora 9,30.",Se asteapta sosirea unui utilaj pentru a trage tirul de pe partea carosabila.,DN6,"['77', '500', '77', '500']"
1.4,DN6,19+400,19+400,2025-02-18 22:25:00,2025-02-19 10:00:00, - ,"DN 6, Giurgiu, baraj Mihailesti.  Doua autotrenuri au derapat si ocupa banda 1 pe sensul Mihailesti-- Bucuresti",,DN6,"['19', '400', '19', '400']"
1.5,DN67C,34+800,79+200,2024-11-11 08:00:00,2025-03-31 20:00:00,RANCA (GJ) - CURPAT (SB),"Incepand de luni, 11.11.2024, avand in vedere conditiile meteo nefavorabile, se inchide circulatia rutiera pe Transalpina (DN 67C), conform ADN 615-2020 ,,Normativ privind circulatia rutiera pe drumurile montane",,DN67C,"['34', '800', '79', '200']"
1.6,DN67C,16+000,34+800,2024-12-23 15:58:00,2025-03-31 23:59:00,NOVACI (GJ) - RANCA (GJ),"Zapada, viscol. Circulatia este restrictionata temporar pentru autovehiculele cu MTMA mai mare de 7,5 tone.",Nu exista.,DN67C,"['16', '0', '34', '800']"
