NR. CRT.,Indicativ drum,De la km,Pana la km,De la data,Pana la data,Intre localitatile,Cauza,Masuri de remediere,viz_name,map_zoom
1.1,DN1,264+400,343+152,2024-07-06 13:00:00,2024-07-09 17:30:00,SCOREIU (SB) - MIERCUREA SIBIULUI (SB),"In perioada 06.07. - 09.07.2024 se va desfasura Turul Ciclistic al Sibiului 2024, editia XIV-a circulatia rutiera va fi restrictionata pe urmatoarele sectoare de drum, astfel :06.07.2024, Etapa I :- DN 14    km    5+000 - 31+133  intervalul orar 13,00 - 13,30.- DN 14B km  44+587 - 49+587  intervalul orar 13,40 - 13,45.- DN  7H  km    0+000 -   3+300  intervalul orar  15,20 - 15,25.- DN  1 km 282+100 - 319+181 intervalul orar  15,25 - 15,30 - 15,35 - 15,40.07 iulie 2024 Etapa II A - DN  1 km 343+152 - 326+515  intervalul orar  11,20 - 11,30 - 11,40 - 11,50.08 iulie 2024 Etapa III - jud. Sibiu- DN 14 km 71+121 - 81+430    intervalul orar  12,30 - 12,45.- DN 1 km 264+400 - 267+152  intervalul orar  14,35 - 14,50 - 14,55.- DN 7C km 151+955 - 116+800  intervalul orar 14,40 - 14,55 - 16,00 - 16,15.-  DN 7C km 116+800 - 147+785 intervalul orar 11,15 - 14,30 ( competitie pentru amatori, conexa Turului Ciclistic al Sibiului)- Inchiderea DN 7C km 130+800 - 147+785 intervalul orar 10,15 - 12,15.- Inchiderea DN 7C km 116+800 - 130+800 intervalul orar 11,15 - 14,30.08 iulie 2024 Etapa III jud. Mures- DN 14 km 81+430 - 89+400   intervalul orar 12,45 - 12,58.09 iulie 2024 Etapa IV  jud.Sibiu- DN 14    km 6+250  - 57+500   intervalul orar 13,00 - 14,00.- DN 14A km 0+000 -  13+000   intervalul orar 15,45 - 16,05.- DN 14A km 0+000 -  13+000   intervalul orar 17,000 - 17,20.09 iulie 2024 Etapa IV jud.Mures- DN 14A km 15+250 - 18+384  intervalul orar  16,05 - 16,10.- DN 14A km 15+250 - 20+400  intervalul orar 17,00 - 17,10.","Circulatia participantilor la eveniment se va face pe partea dreapta a drumului, cat mai aproape de marginea partii carosabile.Pentru evitarea unor evenimente rutiere , organizatorul impreuna cu personalul Serviciului Rutier din jud. Sibiu si Mures va supraveghea zona.",DN1,"['264', '400', '343', '152']"
1.2,DN67C,34+800,79+200,2024-06-01 08:00:00,2024-11-01 18:00:00,RANCA (GJ) - CURPAT (SB),"Incepand cu data de 01.06.2024, se redeschide circulata rutiera pe timpul zilei pe DN 67C Transalpina, intre orele: 08:00-18:00 cu restrictie de viteza de 30 km/h, iar accesul autovehiculele cu MTMA > 3,5 to este interzis. In interval orar: 18:00-08:00 accesul este interzis din cauze obiective care tin de specificul acestei zone montane aflate la mare altitudine . INCEPAND CU DATA DE 01.07.2024 INTERVALUL ORAR DE CIRCULATIE SE VA MODIFICA , ASTFEL : 07:00 - 21:00 , ramanand in vigoare celelalte restrictii .",Respectarea acestor restrictii este obligatorie pentru evitarea unor evenimente periculoase si pentru deplasarea in conditii de siguranta.,DN67C,"['34', '800', '79', '200']"
1.3,DN7,242+600,250+000,2024-07-08 06:00:00,2024-08-09 20:00:00,LAZARET (SB) - BOITA (SB),Se vor executa lucrari de defrisare a versantului aflat in zona de protectie a DN 7.,"Variante propuse pentru autovehiculele cu MTMA > 7,5 tone aflate in tranzit:Pentru relatia Bucuresti - Vestem (Sibiu) si retur:Bucuresti  A3  Ploiesti   DN1A  Brasov  DN 1  Vestem - intersectie cu DN 7Pentru relatia Pitesti - Brasov si retur:Pitesti  DN73 - A3  Rasnov   BrasovPentru relatia Bucuresti - A1 Simeria (precum si zonele de vest, centru si nord ale tarii) si retur:Bucuresti  A1  Pitesti  DN7  Ramnicu Valcea  DN67  Targu Jiu  DN66  Simeria  Nod Rutier Simeria A1Totodata pentru aceasta relatie sunt propuse si urmatoarele variante alternative:Bucuresti  A1  Pitesti  DN65 - DEx12  Craiova  DN6  Filiasi  DN66  Targu Jiu  DN66  Simeria  Nod Rutier Simeria A1Bucuresti  A1  Pitesti  DN65 - DEx12  Craiova  DN6  Dr. Tr. Severin  DN6  Lugoj  A6  Nod Rutier Lugoj A1Bucuresti  DN6  Alexandria  DN6  Craiova  DN6  Filiasi  DN66  Targu Jiu  DN66  Simeria  Nod Rutier Simeria A1Bucuresti  DN6  Alexandria  DN6  Craiova  DN6  Dr. Tr. Severin  DN6  Lugoj  A6  Nod Rutier Lugoj A1Circulatia vehiculelor rutiere intre Ramnicu Valcea si punctul de lucru de la km 242 + 600, precum si intre Sibiu/Boita si punctul de lucru de la km. 250 + 000 se va desfasura pe DN7 conform reglementarilor legale in vigoare.Pentru autovehiculele cu MTMA < 7,5 tone pot fi utilizate ca variante de ocolire drumurile nationale si judetene din proximitatea sectorului inchis circulatiei pe DN7.In intervalele orare 7:30 - 8:00 si 16:30 -17:00 executantul lucrarilor va ridica temporar masura de inchidere a traficului, pentru a permite tranzitarea sectorului de drum de catre riveranii care lucreaza in localitatile din proximitatea acestuia. Trecerea autovehiculelor se va realiza sub supravegherea constructorului, astfel incat sa fie eliminat riscul aparitiei oricarui eveniment care sa puna in pericol integritatea participantilor la trafic sau a personalului implicat in desfasurarea lucrarilor.Pe perioada instituirii inchiderii circulatiei pe sectorul de drum mentionat mai sus, va fi permisa circulatia autovehiculelor cu regim de circulatie prioritara precizate la art.32 alin 2 lit. a) si b) din OUG 195/2002, precum si a autovehiculelor speciale de transport pacienti. Trecerea autovehiculelor se va realiza sub supravegherea constructorului, astfel incat sa fie eliminat riscul aparitiei oricarui eveniment care sa puna in pericol integritatea participantilor la trafic sau a personalului implicat in desfasurarea lucrarilor.Concomitent, au fost demarate actiuni pentru permiterea accesului pe DN10, Buzau - Brasov, a autovehiculelor cu masa totala maxima autorizata de pana la 30 t. De asemenea, au fost luate masuri astfel incat pe variantele recomandate si propuse, in toata aceasta perioada sa nu fie instituite alte restrictii de circulatie ce ar putea afecta fluenta si siguranta circulatiei, iar acolo unde exista acestea sa fie ridicate in cel mai scurt timp posibil (asa cum este cazul restrictiei de circulatie instituite pentru reabilitarea podului situat pe DN1 km 194+400 in zona localitatii Vladeni, unde circulatia se desfasoara semaforizat si cu piloti de trafic pe o singura banda in dublu sens). Mentionam ca lucrarile ce se efectueaza in acest moment urmeaza a fi finalizate in aproximativ 2 saptamani, continuarea lor fiind reluata dupa ridicarea restrictiilor de pe DN7. Rugam participantii la trafic sa urmareasca indicatoarele rutiere din aceasta zona, si sa utilizeze si variantele de traseu propuse pe urmatoarele relatii:-Fagaras DN1  Sercaia  DN73A  Brasov si retur-Fagaras DN1  Sercaia  DN1S  Hoghiz  DN13  Brasov si retur",DN7,"['242', '600', '250', '0']"
1.4,DN7C,104+000,129+500,2024-06-07 07:00:00,2024-07-30 21:00:00,PISCUL NEGRU (AG) - BALEA CASCADA (SB),"Incepand cu data de 07.06.2024, se redeschide circulata rutiera pe timpul zilei pe DN 7C Transfagarasan, intre orele 07:00 - 21:00. In cazul unor fenomene meteorologice nefavorabile drumul va fi inchis temporar pana cand vremea va permite redeschiderea.",,DN7C,"['104', '0', '129', '500']"
1.5,DN7C,115+926,116+808,2024-07-06 22:00:00,2024-07-08 17:30:00,AREFU (AG) - CARTISOARA (SB),"Se desfasoara Turul ciclist al Sibiului, Editia a XIV-a.",Circulatia rutiera prin Tunelul Balea Lac este inchisa in data de 08.07.2024 intre orele 10:00 - 17:30.,DN7C,"['115', '926', '116', '808']"
