NR. CRT.,Indicativ drum,De la km,Pana la km,De la data,Pana la data,Intre localitatile,Cauza,Masuri de remediere,viz_name,map_zoom
1.1,A1,255+800,255+950,2024-04-08 09:00:00,2024-04-08 14:00:00,SIBIU (SB) - CRISTIAN (SB),"Pe calea 1 a autostrazii A1, se executa lucrari de reparatii la rosturile de dilatatie. Banda 1 si banda de urgenta restrictionate  (sens Sibiu-Sebes)",Se circula ingreunat pe banda 2 a caii 1.,A1,"['255', '800', '255', '950']"
1.2,DN15D,6+900,6+900,2024-04-08 08:38:00,2024-04-08 10:00:00,TURTURESTI (NT) - TURTURESTI (NT),"DN 15D km 6+900 stg, extravilan loc. Turturesti, eveniment rutier soldat cu pagube materiale. Cauza probabila a accidentului: neadaptarea vitezei pe un sector de curba periculoasa, semnalizata corespunzator. Carosabil uscat, circulatia se desfasoara pe jumatate din cale, o banda de circulatie fiind ocupata de vehiculul avariatTraficul este dirijat de politia rutiera",Districtul Piatra Neamt curata partea carosabila,DN15D,"['6', '900', '6', '900']"
1.3,DN67B,97+000,101+000,2024-04-08 08:00:00,2024-04-08 18:00:00,BOTORANI (VL) - ,Se lucreaza cu UNIMOG-ul cu foarfeca la reconorare arbori pentru asigurare vizibilitate.,Circulatia se desfasoara pe 1/2 cale dirijata de piloti de circulatie.,DN67B,"['97', '0', '101', '0']"
1.4,DN7,215+000,220+000,2024-04-08 08:00:00,2024-04-08 18:00:00,CALINESTI (VL) - TUTULESTI (VL),Se executa reparatii asfaltice.,Circulatia se desfasoara pe 1/2 cale dirijata de piloti de circulatie.,DN7,"['215', '0', '220', '0']"
1.5,DN7CC,0+900,1+100,2024-04-08 08:00:00,2024-04-08 16:00:00,CALIMANESTI (VL) - ,Lucrari de reparatii parapet.,Circulatia se desfasoara pe 1/2 cale dirijata de piloti de circulatie.,DN7CC,"['0', '900', '1', '100']"
