NR. CRT.,Indicativ drum,De la km,Pana la km,De la data,Pana la data,Intre localitatile,Cauza,Masuri de remediere,viz_name,map_zoom
1.1,DN28D,3+000,3+000,2024-11-22 07:01:00,2024-11-22 10:30:00,URICANI (IS) - URICANI (IS),"Circulatie ingreunata pe DN 28D, km 3, in zona localitatii Uricani, jud. Iasi, din cauza unui autocamion ramas fara combustibil.",,DN28D,"['3', '0', '3', '0']"
1.2,DN67C,34+800,79+200,2024-11-11 08:00:00,2025-03-31 20:00:00,RANCA (GJ) - CURPAT (SB),"Incepand de luni, 11.11.2024, avand in vedere conditiile meteo nefavorabile, se inchide circulatia rutiera pe Transalpina (DN 67C), conform ADN 615-2020 ,,Normativ privind circulatia rutiera pe drumurile montane",,DN67C,"['34', '800', '79', '200']"
1.3,DN7,234+100,234+300,2024-11-19 09:00:00,2024-12-15 17:00:00,CAINENII MARI (VL) - ,"In vederea executarii lucrarilor de amenajare a sensului giratoriu in solutie provizorie pentru asigurarea accesului la organizarea de santier, din cadrul obiectivului Proiectare si executie autostrada Sibiu-Pitesti, sectiunea 2 Boita - Cornetu, km. 13+170 - km. 44+500, vor fi instituite restrictii de circulatie, astfel: - pentru executarea, in afara DN7, a lucrarilor de largire a partii carosabile, racordare a drumului nou construit la sectorul de drum national, amenajare a insulelor separatoare de sensuri si a insulei centrale a giratiei, traficul se va desfasura in ambele sensuri ale DN7, pe un sector ingustat, avand latimea de minimum 5,5 m- pentru executarea, in partea carosabila a DN7, a lucrarilor de finalizare a insulei centrale a giratiei precum si de aplicare a marcajelor rutiere temporare, pe perioade limitate de timp (intervale de maxim 7 minute), se va circula altenativ, pe un singur sens, dirijat cu piloti de circulatie, marcajele urmand a fi realizate cu un utilaj semnalizat corespunzator.Dupa finalizarea lucrarilor, circulatia rutiera se va desfasura prin sensul giratoriu realizat in solutie provizorie, pe toata perioada executarii lucrarilor din cadrul obiectivului precizat anterior.",,DN7,"['234', '100', '234', '300']"
1.4,DN7,203+500,203+500,2024-11-22 07:02:00,2024-11-22 12:00:00,BREZOI (VL) - ,Accident rutier. Eroare umana,"Partea carosabila curata si uscata. Din cauza unei depasiri neregulamentare 2 tiruri s-au lovit, 2 victime. La fata locului se afla Politia, Ambulanta si un echipaj de la Drumuri. Traficul rutier este blocat. Se asteapta o macara, se estimeaza reluarea circulatiei in conditii normale in aproximativ 4 ore.",DN7,"['203', '500', '203', '500']"
1.5,DN7,240+000,240+100,2024-11-22 07:00:00,2024-11-22 09:59:00,TALMACIU (SB) - LAZARET (SB),"Copaci si crengi cazute pe carosabil  , iar la km 253 Talmaciu (Sb)- Boita (Sb), un ansamblu tir este oprit pe banda 1 a sensului Sibiu - Valcea.",Traficul se desfasoara alternativ,DN7,"['240', '0', '240', '100']"
