NR. CRT.,Indicativ drum,De la km,Pana la km,De la data,Pana la data,Intre localitatile,Cauza,Masuri de remediere,viz_name,map_zoom
1.1,A0,61+000,61+000,2025-11-21 13:00:00,2025-11-21 16:00:00, - ,"A0 km 61+000. Ora 13:00. Accident rutier. Nod rutier DN 4 cu A0. Breteaua de acces din Frumusani catre A0. Soferul unui autoturism a facut infarct in timp ce conducea si a intrat in parapet. Soferul a decedat in timp ce-i facea resuscitarea. La fata locului se afla politia, ambulanta, SMURD si lucratori de la drumuri nationale. Circulatia este blocata total pe bretea. Se asteapta criminalistica.",,A0,"['61', '0', '61', '0']"
1.2,A7,2+100,2+100,2025-11-21 08:07:00,2025-11-21 15:00:00,TRESTIENII DE JOS (PH) - TRESTIENII DE JOS (PH),Autoturism abandonat pe calea 1.,Echipa Drumuri Nationale Buzau va semnaliza corespunzator autoturismul.,A7,"['2', '100', '2', '100']"
1.3,DN1A,119+800,119+800,2025-11-21 10:30:00,2025-11-21 15:00:00,MALU VANAT (PH) - MALU VANAT (PH),DN 1A km 119+800. Calea 2. Ora 10:30. Accident rutier. Sens Brasov - Ploiesti. Localitatea Malu Vanat/PH. Doua Tiruri implicate. Un Tir este in afara partii carosabile. Celalalt Tir se afla pe carosabil. Fara victime. Carosabil umed. Circulatia se desfasoara pe celalalt sens alternativ dirijat de politie. La fata locului se afla politia si lucratori de la drumuri nationale.,,DN1A,"['119', '800', '119', '800']"
1.4,DN73,118+300,126+057,2025-11-22 07:00:00,2025-11-23 23:00:00,CRISTIAN (BV) - RASNOV (BV),Lucrari de inlocuire a suprastructurii caii ferate la trecerea la nivel cu calea ferata.,Traficul rutier va fi deviat pe urmatoarea ruta ocolitoare: - DN 73 Km 118+300 intersectie A3 Bucuresti - Brasov Km 162+300  - Autostrada A3 Brasov - intersectie A3 Bucuresti - Brasov Km 168+600 cu DN 73 G Km 0+000 intre DN 73G Km 3+563 - DN 73Km 126+057 - Brasov.,DN73,"['118', '300', '126', '57']"
1.5,DN7C,57+200,57+200,2025-11-20 14:26:00,2025-11-21 17:00:00, - ,Se circula ingreunat ca urmare a unor caderi de pietre de pe versanti pe partea carosabila.,Se actioneaza pentru degajarea carosabilului.,DN7C,"['57', '200', '57', '200']"
