NR. CRT.,Indicativ drum,De la km,Pana la km,De la data,Pana la data,Intre localitatile,Cauza,Masuri de remediere,viz_name,map_zoom
1.1,DN1,138+800,138+850,2025-03-06 07:30:00,2025-03-06 09:00:00,PREDEAL (BV) - PREDEAL (BV),"ACCIDENT INTRE DOUA AUTOTURISME DEPASIRE NEREGULAMENTARA, 4 VICTIME, CAROSABIL USCAT",TRAFIC BLOCAT,DN1,"['138', '800', '138', '850']"
1.2,DN64,77+600,77+600,2025-03-06 08:03:00,2025-03-06 11:10:00,ORLESTI (VL) - ,Accident rutier. Eroare umana,"Partea carosabila uscata. Un autoturism care iesea de pe drumul lateral nu s-a asigurat si a intrat intr un alt autoturism care a ricosat intr un tir stationat pe partea carosabila. Circulatia rutiera este inchisa pentru masuratori, urmand ulterior a fi deschisa circulatiei pe 1/2 cale pana la curatarea carosabilului. La fata locului se afla Politia, Descarcerarea, Salvarea si un echipaj de la Drumuri. Se estimeaza reluarea circulatiei in conditii normale in aproximativ 3 ore.",DN64,"['77', '600', '77', '600']"
1.3,DN67C,34+800,79+200,2024-11-11 08:00:00,2025-03-31 20:00:00,RANCA (GJ) - CURPAT (SB),"Incepand de luni, 11.11.2024, avand in vedere conditiile meteo nefavorabile, se inchide circulatia rutiera pe Transalpina (DN 67C), conform ADN 615-2020 ,,Normativ privind circulatia rutiera pe drumurile montane",,DN67C,"['34', '800', '79', '200']"
1.4,DN67C,16+000,34+800,2024-12-23 15:58:00,2025-03-31 23:59:00,NOVACI (GJ) - RANCA (GJ),"Zapada, viscol. Circulatia este restrictionata temporar pentru autovehiculele cu MTMA mai mare de 7,5 tone.",Nu exista.,DN67C,"['16', '0', '34', '800']"
1.5,DN7,201+215,201+320,2025-03-04 07:00:00,2025-03-31 18:00:00,CACIULATA (VL) - BREZOI (VL),"Lucrari de protectie versanti, zona Cascada Lotrisor.","Pe perioada lucrarilor in intervalul orar 08:00 - 15:00 circulatia rutiera se va inchide/deschide in reprize de aproximativ 15 de minute iar in rest circulatia se va desfasura pe 1/2 cale, dirijata cu piloti de trafic. Programul de desfasurare a lucrarilor:-Luni-joi: 7-18-Vineri : 7-14-Sambata: 7-18",DN7,"['201', '215', '201', '320']"
