NR. CRT.,Indicativ drum,De la km,Pana la km,De la data,Pana la data,Intre localitatile,Cauza,Masuri de remediere,viz_name,map_zoom
1.1,22J,3+100,3+200,2024-11-23 08:00:00,2024-11-25 16:00:00,SMARDAN (TL) - SMARDAN (TL),"LUCRARI de demontare si montare parapet metalic marginal, pe ambele sensuri.","Circulatia se va desfasura alternant, pe un sens de mers dirijat cu piloti de trafic. / Vor fi utilizate balize directionale Galben/Rosu + lampi de culoare galbena intermitenta pe timpul noptii pt a semnaliza zona marginala a partii carosabile (ambele sensuri).",22J,"['3', '100', '3', '200']"
1.2,A2,202+500,202+800,2024-11-25 07:00:00,2024-11-25 17:00:00,VALU LUI TRAIAN (CT) - VALEA DACILOR (CT),"Lucrari de frezare si asfaltare (covor asfaltic), banda de urgenta si banda numarul unu sunt inchise circulatiei rutiere la kilometrul 202+800 - km 202+500, calea 2 (pe sensul de mers Constanta - Bucuresti), autostrada A2.",Traficul se desfasoara pe banda numarul doi cu limita de viteza la 60 km/h.,A2,"['202', '500', '202', '800']"
1.3,DN21,58+000,63+000,2024-11-25 07:00:00,2024-11-25 17:30:00,BARAGANUL (BR) - BARAGANUL (BR),Se executa lucrari de reparatii asfaltice.,Se circula alternativ. Dirijare cu piloti de trafic.,DN21,"['58', '0', '63', '0']"
1.4,DN64,112+800,113+200,2024-11-25 08:00:00,2024-11-25 16:00:00,TROIAN (VL) - ,Se lucreaza la montare parapet din beton.,"Circulatia rutiera se desfasoara pe 1/2 cale, dirijata de indicatoare rutiere si piloti de circulatie.",DN64,"['112', '800', '113', '200']"
1.5,DN67B,70+000,78+000,2024-11-25 08:00:00,2024-11-25 16:00:00,ZATRENI (VL) - POPESTI (TETOIU) (VL),Se lucreaza la taiere acostamente.,"Circulatia rutiera se desfasoara pe 1/2 cale, dirijata de indicatoare rutiere si piloti de circulatie.",DN67B,"['70', '0', '78', '0']"
1.6,DN67B,47+400,49+000,2024-11-25 08:00:00,2024-11-25 16:00:00,OBISLAVU (VL) - ,Se lucraza la taiere acostamente.,"Circulatia rutiera se desfasoara pe 1/2 cale, dirijata de indicatoare rutiere si piloti de circulatie.",DN67B,"['47', '400', '49', '0']"
