NR. CRT.,Indicativ drum,De la km,Pana la km,De la data,Pana la data,Intre localitatile,Cauza,Masuri de remediere,viz_name,map_zoom
1.1,A1,245+000,246+000,2025-12-08 09:30:00,2025-12-08 15:00:00,SIBIU (SB) - SIBIU (SB),Montat minibalize si curatare parte carosabila de materii solide. Banda 2 de pe calea 2 restrictionata.,Se circula ingreunat pe banda 1 a caii 2.,A1,"['245', '0', '246', '0']"
1.2,A1,444+450,445+300,2025-12-08 08:00:00,2025-12-08 20:00:00,TRAIAN VUIA (TM) - TRAIAN VUIA (TM),Pe calea 2  se vor executa lucrari de frezare - asfaltare.,B1 si BU vor fi restrictionate respectiv pe B2 se circula.,A1,"['444', '450', '445', '300']"
1.3,A1,271+000,292+000,2025-12-08 09:00:00,2025-12-08 15:00:00,SALISTE (SB) - CUNTA (AB),Reparatii provizorii cu mixtura stocabila. Restrictie mobila. Banda 1/ banda 2 inchisa pe calea 1 (Sens Sibiu -Orastie).,Se va circula ingreunat pe banda1/banda 2 a caii 1.,A1,"['271', '0', '292', '0']"
1.4,A1,302+000,303+000,2025-12-08 08:15:00,2025-12-08 16:00:00,SEBES (AB) - SEBES (AB),Pe  calea 2  se vor executa lucrari de montare - demontare parapet median.,"Circulatia se desfasoara pe  B1 si BU, iar  B2 este restrictionata pana la ora 16:00.",A1,"['302', '0', '303', '0']"
1.5,A1,309+000,310+000,2025-12-08 08:15:00,2025-12-08 20:00:00,SEBES (AB) - SEBES (AB),Pe  calea 2  se vor executa lucrari de montare - demontare parapet median .,"Circulatia se desfasoara pe  B1 si BU, iar  B2 este restrictionata pana la ora 16:00.",A1,"['309', '0', '310', '0']"
1.6,DN7,207+500,209+000,2025-12-07 08:00:00,2025-12-08 17:00:00,BREZOI (VL) - ,Se executa lucrari de reparatii asfaltice.,"Circulatia rutiera se desfasoara pe 1/2 cale, dirijata de piloti de circulatie.",DN7,"['207', '500', '209', '0']"
