NR. CRT.,Indicativ drum,De la km,Pana la km,De la data,Pana la data,Intre localitatile,Cauza,Masuri de remediere,viz_name,map_zoom
1.1,22J,2+500,3+200,2024-12-19 08:00:00,2024-12-19 16:30:00,SMARDAN (TL) - SMARDAN (TL),Refacere rigola acostament.,"Trafic restrictionat pe o banda. Traficul se desfasoara alternativ, dirijat cu piloti de trafic pe banda libera. Semnalizare cu piloti de trafic.",22J,"['2', '500', '3', '200']"
1.2,A2,143+000,144+000,2024-12-19 07:55:00,2024-12-19 17:00:00,FETESTI (IL) - FETESTI (IL),"Lucrari pe autostrada A2, calea 2 (pe sensul de mers Constanta - Bucuresti), Nod Rutier Fetesti,  km 143 -  km 144,  covor asfaltic cu preluare de planeitate","In intervalul orar   07:30 -  12:00, banda 2 se va inchide circulatiei rutiere, traficul rutier se va desfasura pe banda 1 cu limita de viteza la 60 km/hIn intervalul orar  12:00 - 17:00,  banda de decelerare si banda 1 se vor inchide circulatiei rutiere traficul se va desfasura pe banda 2 cu limita de vitezala60km/h.",A2,"['143', '0', '144', '0']"
1.3,DN2B,116+000,122+000,2024-12-19 07:00:00,2024-12-19 20:00:00,BALDOVINESTI (BR) - SENDRENI (GL),Se desfasoara lucrari de reparatii asfaltice.,"Traficul este restrictionat pe o banda si se desfasoara alternativ, dirijat cu piloti de trafic pe banda libera. Semnalizare cu piloti de trafic",DN2B,"['116', '0', '122', '0']"
1.4,DN67B,86+000,89+000,2024-12-19 08:00:00,2024-12-19 16:00:00,GIULESTI (VL) - ,Se lucreaza la taiere acostamente.,"Circulatia rutiera se desfasoara pe 1/2 cale, dirijata de indicatoare rutiere si piloti de circulatie.",DN67B,"['86', '0', '89', '0']"
1.5,DN73C,61+343,68+134,2024-12-19 08:00:00,2024-12-19 16:00:00,DAESTI (POPESTI) (VL) - BLIDARI (VL),"Se lucreaza la aplicare marcaje rutiere , in functie de conditiile meteo .","Circulatie rutiera se desfasoara ingreunat pe ambele sensuri , in zona utilajului de aplicat marcaje .",DN73C,"['61', '343', '68', '134']"
1.6,DNCB,29+700,30+200,2024-12-19 22:00:00,2024-12-20 05:00:00,POPESTI LEORDENI (IF) - ,"In noaptea de marti, 19.12.2024, spre miercuri, 20.12.2024, in intervalul orar 22:00 -05:00, se va inchide circulatia rutiera pe rampa de urcare dinspre Glina spre Bucuresti a pasajului Oltenita, pentru a permite executia lucrarilor de reprofilare a stratului de uzura prin frezare.inchiderea circulatiei in zona mentionata mai sus va afecta sensurile de mers dinspre DNCB/Glina spre Bucuresti si spre Oltenita.","- Pentru intrarea in Bucuresti/Popesti Leordeni se va proceda la continuarea deplasarii spre Jilava si intoarcerea in sensul giratoriu de la Berceni, apoi la revenirea in giratia suspendata de la DN4 si coborarea din aceasta spre Bucuresti/Popesti Leordent.- Pentru sensul de mers dinspre Glina spre Oltenita se va proceda la continuarea deplasarii spre Jilava si intoarcerea in sensul giratoriu de la Berceni, apoi la revenirea in giratia suspendata de la DN4 si coborarea din aceasta spre Frumusani/Oltenita.",DNCB,"['29', '700', '30', '200']"
