NR. CRT.,Indicativ drum,De la km,Pana la km,De la data,Pana la data,Intre localitatile,Cauza,Masuri de remediere,viz_name,map_zoom
1.1,A1,537+550,552+500,2025-12-04 08:00:00,2025-12-04 20:00:00,ARAD (AR) - PECICA (AR),"De la ora 08:00, pe A1 de la kilometrul 537+550 pana la kilometrul 552+500 calea 2, ARAD (AR), se vor executa lucrari de frezare si asfaltare. BU si B1 vor fi restrictionate , iar pe B2 se va circula ingreunat pana la ora 20:00.",,A1,"['537', '550', '552', '500']"
1.2,A1,537+550,553+800,2025-12-04 08:00:00,2025-12-04 20:00:00,ARAD (AR) - PECICA (AR),"De la ora 08:00, pe A1 de la kilometrul 537+550 pana la kilometrul 553+800 calea 1, PECICA (AR), se vor executa lucrari de frezare si asfaltare. BU si B1 vor fi restrictionate , iar pe B2 se va circula ingreunat pana la ora 20:00.",,A1,"['537', '550', '553', '800']"
1.3,A1,327+000,329+000,2025-12-04 07:30:00,2025-12-04 16:00:00,VINTU DE JOS (AB) - SIBOT (AB),"De la ora 07:30, pe A1 de la kilometrul 327+000 pana la kilometrul 329+000 calea 2, VINTU DE JOS - SIBOT (AB), se executa lucrari de demontare - montare parapet median. B2 este restrictionata , iar pe B1 si pe BU se va circula ingreunat pana la ora 16:00.",,A1,"['327', '0', '329', '0']"
1.4,A11,0+200,2+200,2025-12-04 08:00:00,2025-12-04 20:00:00,ARAD (AR) - ARAD (AR),"De la ora 08:00, pe A11 de la kilometrul 0+200 pana la kilometrul 2+200 calea 2, ARAD (AR), se vor executa lucrari de frezare si asfaltare. BU si B1 vor fi restrictionate , iar pe B2 se va circula ingreunat pana la ora 20:00.",,A11,"['0', '200', '2', '200']"
1.5,DN65C,87+000,89+500,2025-12-04 08:00:00,2025-12-04 18:00:00,DAESTI (POPESTI) (VL) - ,Se lucreaza la reparatii asfaltice .,"Circulatia rutiera se desfasoara pe 1/2 cale, dirijata de piloti de circulatie.",DN65C,"['87', '0', '89', '500']"
