NR. CRT.,Indicativ drum,De la km,Pana la km,De la data,Pana la data,Intre localitatile,Cauza,Masuri de remediere,viz_name,map_zoom
1.1,A1,527+345,533+900,2024-10-11 10:00:00,2024-10-11 18:00:00,SAGU (AR) - SAGU (AR),"Eveniment rutier pe A1 calea2 Sagu - Lucrari - Frezare si asfaltare,banda de urgenta si banda 1 sunt restrictionate,se circula pe banda2,se estimeaza reluarea normala a circulatiei in jurul orei 18:00",,A1,"['527', '345', '533', '900']"
1.2,DN64,106+000,112+800,2024-10-11 08:00:00,2024-10-11 18:00:00,STOLNICENI (VL) - RAURENI (VL),Se lucreaza la reparatii asfaltice.,"Circulatia rutiera se desfasoara pe 1/2 cale, dirijata de piloti de circulatie.",DN64,"['106', '0', '112', '800']"
1.3,DN65C,42+000,43+000,2024-10-11 08:00:00,2024-10-11 18:00:00,OTETELISU (VL) - ,Se lucreaza la colmatari cu mastic.,"Circulatia se desfasoara pe 1/2 cale, dirijata de piloti de circulatie.",DN65C,"['42', '0', '43', '0']"
1.4,DN67B,57+200,57+300,2024-10-11 08:00:00,2024-10-11 18:00:00,GRADISTEA (VL) - ,Se lucreaza la reparatii podet .,"Circulatia se desfasoara pe 1/2 cale, dirijata de piloti de circulatie.",DN67B,"['57', '200', '57', '300']"
1.5,DN67B,129+200,157+000,2024-10-11 13:00:00,2024-10-11 17:00:00,VULTURESTI (OT) - CHILIA (OT),Se lucreaza la reparatii cu mixtura asfaltica.,"Circulatia rutiera se desfasoara pe 1/2 cale, cu smnalizare si piloti de circulatie.",DN67B,"['129', '200', '157', '0']"
