NR. CRT.,Indicativ drum,De la km,Pana la km,De la data,Pana la data,Intre localitatile,Cauza,Masuri de remediere,viz_name,map_zoom
1.1,A1,352+000,353+000,2024-09-13 08:00:00,2024-09-13 15:00:00,SIMERIA VECHE (HD) - SIMERIA VECHE (HD),"Eveniment rutier - Lucrari pe A1 km 352 - km 353 calea 2 Simeria Veche - Montare parapet median,banda doi este restrictionata,pe banda de urgenta si banda unu se circula,se estimeaza reluarea normala a traficului la ora 15:00",,A1,"['352', '0', '353', '0']"
1.2,A1,271+200,272+300,2024-09-13 08:31:00,2024-09-13 19:00:00,APOLDU DE JOS (SB) - SALISTE (SB),"Se executa lucrari de reparatii la partea carosabila. Banda 1 si Banda de Urgenta de pe Calea 2(Sens Sebes-Sibiu),sunt restrictionate.",Se circula ingreunat pe Banda 2 de pe Calea 2(sens Sebes-Sibiu).,A1,"['271', '200', '272', '300']"
1.3,DN2S,4+500,6+600,2024-08-06 09:15:00,2024-09-20 19:00:00,VADENI (BR) - SMARDAN (TL),Frezare si asternere imbracaminte bituminoasa.,"Devierea traficului rutier de pe Calea 2 pe Calea 1 la km 7+000, cu revenire in Calea 2 la km 3+000. Circulatia rutiera se desfasoara in ambele sensuri cu restrictie de viteza de 30km/h. / Semnalizare cu balize directionale si lampi de culoare galbena intermitenta pe timpul noptii.",DN2S,"['4', '500', '6', '600']"
1.4,DN64,73+000,74+000,2024-09-13 08:00:00,2024-09-13 18:00:00,PRUNDENI (VL) - ZAVIDENI (VL),Se lucreaza la tratare burdusiri.,"Circulatia rutiera se desfasoara pe 1/2 cale, dirijata de piloti de circulatie.",DN64,"['73', '0', '74', '0']"
1.5,DN67,158+700,160+800,2024-09-13 08:00:00,2024-09-13 18:00:00,COSTESTI (VL) - NEGRULESTI (VL),Se lucreaza la taiere acostamente.,"Circulatia rutiera se desfasoara pe 1/2 cale, dirijata de piloti de circulatie.",DN67,"['158', '700', '160', '800']"
1.6,DN67,138+000,158+000,2024-09-13 08:00:00,2024-09-13 18:00:00,MILOSTEA (VL) - COSTESTI (VL),Se lucreaza la reparatii asfaltice.,"Circulatia se desfasoara pe 1/2 cale, dirijata de piloti de circulatie.",DN67,"['138', '0', '158', '0']"
1.7,DN7,159+400,159+900,2024-09-13 08:00:00,2024-09-13 14:00:00,MILCOIU (VL) - ,Se executa lucrari pregatitoare pentru montare parapet.,"Circulatia rutiera se desfasoara pe 2/3 cale, dirijata prin indicatoare rutiere.",DN7,"['159', '400', '159', '900']"
1.8,DN7,163+000,163+500,2024-09-13 08:00:00,2024-09-13 14:00:00,MILCOIU (VL) - ,Se lucreaza la montare parapet cu role .,"Circulatia rutiera se desfasoara pe 1/2 din cale, dirijata de piloti de circulatie.",DN7,"['163', '0', '163', '500']"
1.9,DN7A,10+500,11+300,2024-09-13 08:00:00,2024-09-13 16:00:00,VALEA LUI STAN (VL) - VALEA MACESULUI (VL),Se lucreaza la decolmatare santuri.,"Circulatia rutiera se desfasoara pe 1/2 cale, dirijata de piloti de circulatie.",DN7A,"['10', '500', '11', '300']"
