NR. CRT.,Indicativ drum,De la km,Pana la km,De la data,Pana la data,Intre localitatile,Cauza,Masuri de remediere,viz_name,map_zoom
1.1,DN2B,78+000,78+100,2024-10-24 07:00:00,2024-10-24 17:00:00,SILISTRARU (BR) - OPRISENESTI (BR),Se executa lucrari de reparatii la rosturile de dilatatie pod.,Se circula alternativ pe un sens. Dirijare cu piloti / semafor.,DN2B,"['78', '0', '78', '100']"
1.2,DN67,143+000,145+000,2024-10-24 08:00:00,2024-10-24 16:00:00,SLATIOARA (VL) - ,Se lucreaza la demontare/montare parapet metalic .,"Circulatia rutiera se desfasoara pe 1/2 din cale , dirijata de piloti de circulatie .",DN67,"['143', '0', '145', '0']"
1.3,DN7,198+200,198+500,2024-10-24 07:00:00,2024-10-24 16:00:00,CACIULATA (VL) - BREZOI (VL),"Se lucreaza la consolidare versanti, in functie de conditiile meteo .","Circulatia rutiera se inchide/deschide in reprize de max.15 minute , dirijata de piloti de circulatie .",DN7,"['198', '200', '198', '500']"
1.4,DN7,162+900,163+800,2024-10-24 08:00:00,2024-10-24 16:00:00,MILCOIU (VL) - BLIDARI (VL),Se executa lucrari de montare parapet din beton .,"Circulatia rutiera se desfasoara pe 2 benzi din 3 , dirijata de piloti de circulatia si indicatoare rutiere .",DN7,"['162', '900', '163', '800']"
1.5,DN7,207+900,208+100,2024-10-24 08:00:00,2024-10-24 16:00:00,BREZOI (VL) - ,Se lucreaza la reparatii asfaltice .,"Circulatia rutiera se desfasoara pe 1/2 cale , dirijata de piloti de circulatie .",DN7,"['207', '900', '208', '100']"
