NR. CRT.,Indicativ drum,De la km,Pana la km,De la data,Pana la data,Intre localitatile,Cauza,Masuri de remediere,viz_name,map_zoom
1.1,DN2S,3+000,7+000,2024-08-06 09:15:00,2024-08-26 19:00:00,VADENI (BR) - SMARDAN (TL),Frezare si asternere imbracaminte bituminoasa.,"Devierea traficului rutier de pe Calea 2 pe Calea 1 la km 7+000, cu revenire in Calea 2 la km 3+000. Circulatia rutiera se desfasoara in ambele sensuri cu restrictie de viteza de 30km/h. / Semnalizare cu balize directionale si lampi de culoare galbena intermitenta pe timpul noptii.",DN2S,"['3', '0', '7', '0']"
1.2,DN65C,96+500,100+000,2024-08-13 08:00:00,2024-08-13 18:00:00,POPESTI (POPESTI) (VL) - OTESANI (VL),Se lucreaza la reparatii asfaltice.,"Circulatia rutiera se desfasoara pe 1/2 din cale, dirijata de piloti de circulatie.",DN65C,"['96', '500', '100', '0']"
1.3,DN67,138+500,138+700,2024-08-13 08:00:00,2024-08-13 16:00:00,MILOSTEA (VL) - ,Se lucreaza la montare parapet.,"Circulatia rutiera se desfasoara pe 1/2 cale, dirijata de piloti de circulatie.",DN67,"['138', '500', '138', '700']"
1.4,DN67B,96+975,101+480,2024-08-13 08:00:00,2024-08-13 16:00:00,BOTORANI (VL) - GUSOENI (VL),Se lucreaza la cosit vegetatie mecanizat.,"Circulatia rutiera se desfasoara ingreunat, pe ambele sensuri de mers, in zona utilajului de cosit vegetatie.",DN67B,"['96', '975', '101', '480']"
1.5,DN7,226+000,231+000,2024-08-13 08:00:00,2024-08-13 18:00:00,ROBESTI (VL) - CAINENII MICI (VL),Se lucreaza la reparatii asfaltice.,"Circulatia rutiera se desfasoara pe 1/2 cale, dirijata de piloti de circulatie .",DN7,"['226', '0', '231', '0']"
1.6,DN7,198+400,199+000,2024-08-13 08:00:00,2024-08-13 16:00:00,CALIMANESTI (VL) - ,Se executa lucrari pregatitoare pentru consolidare versanti.,"Circulatia rutiera se desfasoara pe 1/2 din cale, dirijata de piloti de circulatie.",DN7,"['198', '400', '199', '0']"
1.7,DN7,176+000,176+500,2024-08-13 08:00:00,2024-08-13 18:00:00,BUJORENI (VL) - ,Se lucreaza la montare parapet cu role .,"Circulatia rutiera se desfasoara pe 1/2 cale, dirijata de piloti de circulatie.",DN7,"['176', '0', '176', '500']"
