NR. CRT.,Indicativ drum,De la km,Pana la km,De la data,Pana la data,Intre localitatile,Cauza,Masuri de remediere,viz_name,map_zoom
1.1,A1,310+500,311+000,2025-02-11 09:00:00,2025-02-11 16:00:00,SEBES (AB) - ,Pe Calea 2 se executalucrari de reparatii gropi cu mixtura stocabila,Pe Calea 2 se circula pe Banda 2. Banda 1 si Banda de Urgenta sunt restrictionate pana la finalizarea lucrarilor,A1,"['310', '500', '311', '0']"
1.2,A1,267+000,267+200,2025-02-11 09:13:00,2025-02-11 15:00:00,SALISTE (SB) - CRISTIAN (SB),"Se executa lucrari de reparatii la parapetul lateral, banda 1 si banda de urgenta de pe calea 2 (sens Sebes-Sibiu) este restrictionate.",Se circula ingreunat pe banda 2 a caii 2.,A1,"['267', '0', '267', '200']"
1.3,A1,535+000,535+000,2025-02-11 09:10:00,2025-02-11 15:00:00,ARAD (AR) - ,Pe Calea 1 se executa lucrari de demontare / montare parapet median,Pe Calea 1 se circula pe Banda 1 si Banda de Urgenta. Banda 2 este restrictionata pana la finalizarea lucrarilor,A1,"['535', '0', '535', '0']"
1.4,A1,507+000,508+500,2025-02-11 11:00:00,2025-02-11 19:00:00,GIARMATA (TM) - ,Pe Calea 1 se executa lucrari de construire a pasajului peste A1 - drum de legatura cu DN69,Pe Calea 1 se circula pe Banda 2. Banda 1 si Banda de Urgenta sunt restrictionate pana la finalizarea lucrarilor,A1,"['507', '0', '508', '500']"
1.5,A3,12+600,13+300,2025-02-11 12:13:00,2025-02-11 15:30:00, - ,Lucrari parte carosabila. Calea 1 (Bucuresti-Ploiesti) banda 1 restrictionata.,,A3,"['12', '600', '13', '300']"
1.6,DN1,205+050,205+150,2025-02-11 08:00:00,2025-02-11 16:00:00,VLADENI (BV) - PERSANI (BV),Lucrari de montare parapet metalic,Trafic dirijat cu piloti de dirijare,DN1,"['205', '50', '205', '150']"
1.7,DN2S,4+500,5+000,2025-02-11 12:00:00,2025-02-11 17:00:00,VADENI (BR) - VADENI (BR),Reparatii rost de dilatatie.Trafic restrictionat  pe Banda 2 se circula pe Banda 1 Calea 2.,"Semnalizare cu Indicatoare, Balize directionale si Panou cu semnalizare luminoasa.",DN2S,"['4', '500', '5', '0']"
1.8,DN67B,91+000,93+000,2025-02-11 08:00:00,2025-02-11 16:00:00,OVESELU (VL) - OVESELU (VL),"Pe sectorul de drum DN 67B km 91+000 - km 93+000, pe raza localitatii Oveselu, se lucreaza la taiere acostamente intre orele 08:00 - 16:00.",Circulatia rutiera se desfasoara pe 1/2 din cale dirijata de indicatoare rutiere si pilotidecirculatie.,DN67B,"['91', '0', '93', '0']"
1.9,DN7A,33+900,34+650,2025-02-11 08:00:00,2025-02-11 16:00:00,VALEA MACESULUI (VL) - VALEA MACESULUI (VL),Pe  sectorul de drum DN 7A km 33+900 - km 34+650 in extravilanul localitatii Valea Macesului se executa lucrari de ranguire versanti intre orele 08:00 - 16:00.,Circulatia rutiera se inchide/deschide in reprize de max.20 de minute dirijata de piloti de circulatie.,DN7A,"['33', '900', '34', '650']"
