NR. CRT.,Indicativ drum,De la km,Pana la km,De la data,Pana la data,Intre localitatile,Cauza,Masuri de remediere,viz_name,map_zoom
1.1,22J,2+400,3+300,2024-10-02 07:00:00,2024-10-04 19:00:00,SMARDAN (TL) - SMARDAN (TL),Lucrari de frezare si asternere imbracaminte bituminoasa.,"Trafic alternant semaforizat pe sensul de mers Macin -  Braila, cu circulatie deschisa pe sensul de mers Braila - Macin. Restrictie permanenta.",22J,"['2', '400', '3', '300']"
1.2,A1,271+000,272+000,2024-10-04 08:55:00,2024-10-04 19:00:00,SALISTE (SB) - APOLDU DE JOS (SB),"Se executa lucrari de reparatii la partea carosabila. Banda 1 si Banda de Urgenta de pe Calea 1(sens Sibiu-Sebes),sunt restrictionate.",Se circula ingreunat pe Banda 2 de pe Calea 1(sens Sibiu-Sebes).,A1,"['271', '0', '272', '0']"
1.3,A1,261+000,262+000,2024-10-04 09:07:00,2024-10-04 19:00:00,SIBIU (SB) - CRISTIAN (SB),"Se executa lucrari de reparatii la partea carosabila. Banda 1 si Banda de Urgenta de pe Calea 1(sens Sibiu-Sebes),sunt restrictionate.",Se circula ingreunat pe Banda 2 de pe Calea 1(sens Sibiu-Sebes).,A1,"['261', '0', '262', '0']"
1.4,A1,540+000,540+000,2024-10-04 09:00:00,2024-10-04 16:00:00,ARAD (AR) - ARAD (AR),Se executa lucrari de demontare parapet avariat la accident. Calea 2.,"Circulatia se desfasoara ingreunat pe Banda 1 si pe Banda de Urgenta , iar Banda 2 este restrictionata.",A1,"['540', '0', '540', '0']"
1.5,DN2S,4+500,6+600,2024-08-06 09:15:00,2024-10-31 19:00:00,VADENI (BR) - SMARDAN (TL),Frezare si asternere imbracaminte bituminoasa.,"Devierea traficului rutier de pe Calea 2 pe Calea 1 la km 7+000, cu revenire in Calea 2 la km 3+000. Circulatia rutiera se desfasoara in ambele sensuri cu restrictie de viteza de 30km/h. / Semnalizare cu balize directionale si lampi de culoare galbena intermitenta pe timpul noptii.",DN2S,"['4', '500', '6', '600']"
1.6,DN64,127+000,133+400,2024-10-04 08:00:00,2024-10-04 18:00:00,PAUSESTI-MAGLASI (VL) - OLANESTI (VL),Se lucreaza la reparatii aslaltice.,"Circulatia rutiera de desfasoara pe 1/2 cale, dirijata de piloti de circulatie .",DN64,"['127', '0', '133', '400']"
1.7,DN67B,87+200,87+300,2024-10-04 08:00:00,2024-10-04 16:00:00,GIULESTI (VL) - ,Se lucreaza la reparatii podet .,"Circulatia rutiera se desfasoara pe 1/2 cale, dirijata de piloti de circulatie .",DN67B,"['87', '200', '87', '300']"
1.8,DN67B,57+200,57+300,2024-10-03 08:00:00,2024-10-04 18:00:00,GRADISTEA (VL) - LIVEZI (VL),"Se lucreaza la reparatie podet, in functie de conditiile meteo .","Circulatia rutiera de desfasoara pe 1/2 cale, dirijata de piloti de circulatie .",DN67B,"['57', '200', '57', '300']"
1.9,DN7,198+200,198+500,2024-10-03 07:00:00,2024-10-04 16:00:00,CALIMANESTI (VL) - ,Se lucreaza la consolidare versanti.,Circulatia rutiera se inchide/deschide  in reprize de max.15 de minute dirijata de piloti de circulatie .,DN7,"['198', '200', '198', '500']"
