NR. CRT.,Indicativ drum,De la km,Pana la km,De la data,Pana la data,Intre localitatile,Cauza,Masuri de remediere,viz_name,map_zoom
1.1,A1,449+200,449+200,2025-12-16 08:30:00,2025-12-16 16:00:00,CLICIOVA (TM) - ,Pe Calea 1 se executa lucrari de intretinere la rosturile de dilatatie.,"Banda de urgenta si Banda 1 sunt inchise, iar pe Banda 2 se circula ingreunat pana la ora 16:00.",A1,"['449', '200', '449', '200']"
1.2,A1,305+000,306+000,2025-12-16 08:40:00,2025-12-16 16:00:00,SEBES (AB) - ,"Pe Calea 1 si pe Calea 2, se executa lucrari de demontare / montare parapet median.","Benzile 2 de pe ambele cai ale A1 sunt inchise.Se circula pe banda 1 si pe banda de urgenta.Se estimeaza reluarea circulatiei normale si incheierea lucrarilor, in jurul orei 16:00.",A1,"['305', '0', '306', '0']"
1.3,A1,311+000,311+300,2025-12-16 12:50:00,2025-12-16 16:00:00,SEBES (AB) - ,Pe Calea 1 se executa lucrari de demontare si montare parapet marginal.,"Banda de urgenta este inchisa.Se circula pe banda 1 si pe banda 2.Se estimeaza reluarea circulatiei normale si incheierea lucrarilor, in jurul orei 16:00.",A1,"['311', '0', '311', '300']"
1.4,DN2B,27+660,42+850,2025-12-16 08:00:00,2025-12-18 16:00:00,CILIBIA (BZ) - SURDILA-GRECI (BR),"Trafic inchis pe ambele sensuri la trecerea la nivel cu cafea-ferata, in perioada 16.12.2025 ora 08.00 - 18.12.2025 ora 16.00. Se executa lucrari de refacere a substratului caii ferate Buzau-Faurei.",Se va circula pe ruta ocolitoare astfel: DN2B km27+660 - intersectia cu DJ203i (km0+000) Cilibia - Caragele - DJ214A - Luciu - Largu - Rusetu DJ203N - Surdila Greci DN2B km42+850 si retur.,DN2B,"['27', '660', '42', '850']"
1.5,DN65C,41+000,44+000,2025-12-16 08:00:00,2025-12-16 17:00:00,BALCESTI (VL) - ,Se lucreaza la reparatii asfaltice.,"Circulatia rutiera se desfasoara pe 1/2 din cale, dirijata de piloti de circulatie.",DN65C,"['41', '0', '44', '0']"
1.6,DN7,225+000,229+000,2025-12-16 09:00:00,2025-12-16 17:00:00,ROBESTI (VL) - CALINESTI (VL),Se executa lucrari de reparatii asfaltice izolate.,"Circulatia rutiera se desfasoara pe 1/2 cale, dirijata de piloti de circulatie.",DN7,"['225', '0', '229', '0']"
