NR. CRT.,Indicativ drum,De la km,Pana la km,De la data,Pana la data,Intre localitatile,Cauza,Masuri de remediere,viz_name,map_zoom
1.1,DN2B,78+000,81+000,2024-06-06 07:30:00,2024-06-06 19:00:00,OPRISENESTI (BR) - SILISTRARU (BR),Reparati asfaltice.,Se circula alternativ pe un sens.Dirijare cu piloti de trafic.,DN2B,"['78', '0', '81', '0']"
1.2,DN2B,94+500,95+500,2024-06-06 07:30:00,2024-06-06 19:00:00,LACU SARAT (BR) - SILISTRARU (BR),Reparati asfaltice.,Se circula alternativ pe un sens.Dirijare cu piloti de trafic.,DN2B,"['94', '500', '95', '500']"
1.3,DN2S,1+700,1+900,2024-06-06 07:00:00,2024-06-06 19:00:00,VADENI (BR) - ,Lucrari de frezare si asternere imbracaminte bituminoasa.,"Trafic restrictionat calea 1, banda 1, se circula pe banda 2.Semnalizare cu balize directionale  + lampi de culoare galbena intermitenta pe timpul noptii.",DN2S,"['1', '700', '1', '900']"
1.4,DN2S,3+100,3+300,2024-06-06 07:00:00,2024-06-06 19:00:00,VADENI (BR) - VADENI (BR),Lucrari de frezare si asternere imbracaminte bituminoasa.,"Trafic restrictionat,calea 1, banda 1,se circula pe banda 2.Semnalizare cu balize directionale + lampi de culoare galbena intermitenta pe timpul noptii.",DN2S,"['3', '100', '3', '300']"
1.5,DN2S,1+700,1+900,2024-06-06 07:00:00,2024-06-06 19:00:00,VADENI (BR) - VADENI (BR),Lucrari de frezare si asternere imbracaminte bituminoasa.,"Trafic restrictionat, calea 2, banda 1 , se circula pe banda 2.Semnalizare cu balize directionale + lampi de culoare galbena intermitenta pe timpul noptii.",DN2S,"['1', '700', '1', '900']"
1.6,DN2S,2+900,3+200,2024-06-06 07:00:00,2024-06-06 18:00:00,VADENI (BR) - VADENI (BR),"Montare parapet metalic mobil.Trafic restrictionat calea 2, banda 2, se circula pe banda 1.",Semnalizare cu indicatoare rutiere si balize directionale.,DN2S,"['2', '900', '3', '200']"
1.7,DN2S,4+800,5+200,2024-06-06 07:00:00,2024-06-06 19:00:00,VADENI (BR) - VADENI (BR),Frezare si asternere imbracaminte bituminoasa.,"Trafic restrictionat, Calea 2, Banda 1, se circula pe banda 2.Semnalizare cu balize directionale + lampi de culoare galbena pe timpul noptii.",DN2S,"['4', '800', '5', '200']"
1.8,DN6,298+000,313+000,2024-06-06 08:00:00,2024-06-06 18:00:00,CIOCHIUTA (MH) - PRUNISOR (MH),"Se lucreaza la executie covor asfaltic , in functie de conditiile meteo .",Circulatia rutiera se desfasoara pe 1/2 cale dirijata de piloti de circulatie .,DN6,"['298', '0', '313', '0']"
