NR. CRT.,Indicativ drum,De la km,Pana la km,De la data,Pana la data,Intre localitatile,Cauza,Masuri de remediere,viz_name,map_zoom
1.1,A1,347+200,347+500,2024-11-19 09:30:00,2024-11-19 16:00:00,TURDAS (AB) - TURDAS (AB),"Calea 2 , se vor executa lucrari de demontare parapet median.","Circulatia rutiera se va desfasura ingreunat pe Banda 1 si pe Banda de Urgenta, respectiv Banda 2 va fi restrictionata.",A1,"['347', '200', '347', '500']"
1.2,A1,302+100,303+700,2024-11-19 10:30:00,2024-11-19 16:00:00,SEBES (AB) - SEBES (AB),"Calea 1 , se vor executa lucrari de reparatii parapet median.",Circulatia se desfasoara ingreunat pe  Banda 1 si Banda de Urgenta iar Banda 2 va fi restrictionata.,A1,"['302', '100', '303', '700']"
1.3,A3,44+800,44+800,2024-11-19 10:04:00,2024-11-19 15:30:00, - ,Lucrari parte carosabila. Calea 2 (Ploiesti-Bucuresti) Banda 1 restrictionata.,,A3,"['44', '800', '44', '800']"
1.4,A3Ms,35+800,36+800,2024-11-19 12:00:00,2024-11-19 17:00:00,CHETANI (MS) - IERNUT (MS),"Se executa lucrari de reparatii la rosturi de dilatare. Banda 1 si Banda de Urgenta de pe Calea 2 (Sens Turda-Tg Mures),sunt restrictionate.",Se circula ingreunat pe Banda 2 de pe Calea 2(sens Turda-Tg Mures).,A3Ms,"['35', '800', '36', '800']"
1.5,DN21,58+850,58+850,2024-11-19 08:00:00,2024-11-19 15:00:00,BARAGANUL (BR) - BARAGANUL (BR),Lucrari de inlocuire dale beton trecere cale ferata,Se circula alternativ pe un sens. Dirijare cu piloti de circulatie,DN21,"['58', '850', '58', '850']"
1.6,DN65C,95+000,96+000,2024-11-19 08:00:00,2024-11-19 16:00:00,POPESTI (FARTATESTI) (VL) - OTESANI (VL),Se lucreaza la taiere acostamente.,Circulatia rutiera se desfasoara pe 1/2 din cale dirijata de indicatoare rutiere si piloti de circulatie.,DN65C,"['95', '0', '96', '0']"
1.7,DN67B,57+000,59+700,2024-11-19 08:00:00,2024-11-19 16:00:00,LIVEZI (VL) - ,Se lucreaza la taiere acostamente.,Circulatia rutiera se desfasoara pe 1/2 din cale dirijata de indicatoare rutiere si pilotidecirculatie.,DN67B,"['57', '0', '59', '700']"
1.8,DN7,234+100,234+300,2024-11-19 09:00:00,2024-11-19 17:00:00,CAINENII MARI (VL) - ,Se lucreaza la frezare parte carosabila in vederea executarii unui sens giratoriu pentru accesul la organizarea de santier.,Circulatia rutiera se desfasoara pe 1/2 din cale dirijata de indicatoare rutiere si piloti de circulatie.,DN7,"['234', '100', '234', '300']"
