NR. CRT.,Indicativ drum,De la km,Pana la km,De la data,Pana la data,Intre localitatile,Cauza,Masuri de remediere,viz_name,map_zoom
1.1,DN21,42+000,49+000,2024-07-03 06:00:00,2024-07-03 19:00:00,VIZIRU (BR) - BARAGANUL (BR),Executare lucrari asternere covor asfaltic.,Se circula alternativ pe un sens.Dirijare cu semafor.,DN21,"['42', '0', '49', '0']"
1.2,DN2S,3+100,3+300,2024-06-25 19:00:00,2024-07-03 16:00:00,VADENI (BR) - VADENI (BR),Lucrari de frezare si asternere imbracaminte bituminoasa.,"Trafic restrictionat,calea 1, banda 2, se circula pe banda 1.Semnalizare cu balize directionale + lampi de culoare galbena intermitenta pe timpul noptii.",DN2S,"['3', '100', '3', '300']"
1.3,DN2S,4+800,6+900,2024-06-25 08:40:00,2024-07-12 19:30:00,SMARDAN (BZ) - VADENI (BR),Frezare si asternere imbracaminte bituminoasa.,"Trafic restrictionat, Calea 2, Banda 1, se circula pe banda 2.Semnalizare cu balize directionale + lampi de culoare galbena pe timpul noptii.",DN2S,"['4', '800', '6', '900']"
1.4,DN2S,3+100,3+300,2024-06-25 08:30:00,2024-07-03 16:00:00,VADENI (BR) - VADENI (BR),Frezare si asternere imbracaminte bituminoasa.,"Trafic restrictionat,calea 2, banda 2,se circula pe banda 1.Semnalizare cu balize directionale + lampi de culoare galbena intermitenta pe timpul noptii.",DN2S,"['3', '100', '3', '300']"
1.5,DN56A,62+000,64+000,2024-07-03 08:00:00,2024-07-03 18:00:00,ROGOVA (MH) - HINOVA (MH),Se lucreaza la montare parapet.,"Circulatia rutiera se desfasoara pe 1/2 cale, dirijat cu piloti de circulatie.",DN56A,"['62', '0', '64', '0']"
1.6,DN7,160+000,165+000,2024-07-02 19:00:00,2024-07-03 06:00:00,MILCOIU (VL) - BLIDARI (VL),Se lucreaza la frezare denivelari .,Circulatia rutiera se desfasoara pe 1/2 cale dirijara de piloti de circulatie .,DN7,"['160', '0', '165', '0']"
