NR. CRT.,Indicativ drum,De la km,Pana la km,De la data,Pana la data,Intre localitatile,Cauza,Masuri de remediere,viz_name,map_zoom
1.1,DN67,145+000,150+000,2025-11-27 08:00:00,2025-11-27 18:00:00,SLATIOARA (VL) - HOREZU (VL),Pe sectorul de drum DN 67 km 154+000 - km 155+000 in extravilanul localitatii Tomsani se lucreaza la reparatii asfaltice intre orele 08:00 - 18:00.,Circulatia rutiera se desfasoara pe 1/2 dirijata de piloti de circulatie.,DN67,"['145', '0', '150', '0']"
1.2,DN7,200+500,201+500,2025-11-27 08:00:00,2025-11-27 18:00:00,CALIMANESTI (VL) - ,Pe sectorul de drum DN 7 km 200+500 - km 201+500 in extravilanul localitatii Calimanesti se executa lucrari de reparatii rosturi de dilatare.,"Circulatia rutiera se desfasoara pe 1/2 cale dirijata prin semafoare,  iar in cazul unor valori mari de trafic se va trece la dirijarea circulatie rutiere cu piloti de circulatie.",DN7,"['200', '500', '201', '500']"
1.3,DN7,198+220,198+240,2025-11-27 07:30:00,2025-11-27 15:30:00,CALIMANESTI (VL) - ,Se lucreaza  la reparatii rosturi de dilatare in regim de urgenta.,Circulatia rutiera se desfasoara pe 1/2 din cale dirijata de piloti de circulatie.,DN7,"['198', '220', '198', '240']"
1.4,DN7,216+450,217+400,2025-11-27 08:00:00,2025-11-27 16:00:00,CALIMANESTI (VL) - ,Se executa lucrari la pila 1 de la Ecoductul Calinesti.,"Circulatia rutiera se desfasoara pe 1/2 din cale dirijata de piloti de circulatie, iar in cazuri exceptionale se inchide/deschide in reprize de 15 minute.",DN7,"['216', '450', '217', '400']"
1.5,DN7A,16+400,16+800,2025-11-27 08:00:00,2025-11-27 14:00:00,BRADISOR (VL) - ,Se lucreaza in regim de urgenta la taiere de arbori periculosi pentru siguranta circulatiei.,Circulatia rutiera se inchide/deschide in reprize demax.15minute.,DN7A,"['16', '400', '16', '800']"
