NR. CRT.,Indicativ drum,De la km,Pana la km,De la data,Pana la data,Intre localitatile,Cauza,Masuri de remediere,viz_name,map_zoom
1.1,A1,35+500,39+000,2025-11-13 08:00:00,2025-11-13 18:00:00, - ,Se lucreaza la aplicare marcaje rutiere. Calea 1 banda 2 restrictionata.,,A1,"['35', '500', '39', '0']"
1.2,A1,495+000,496+000,2025-11-13 08:00:00,2025-11-13 16:00:00,BUCOVAT (REMETEA MARE) (TM) - BUCOVAT (REMETEA MARE) (TM),Pe Calea 1 se excuta lucrari de curatare rigola mediana,"BU va fi restrictionata, iar pa B1 si pe B2 sa va circula normal.",A1,"['495', '0', '496', '0']"
1.3,A1,527+300,527+300,2025-11-13 08:00:00,2025-11-13 16:00:00,SAGU (AR) - SAGU (AR),Pe Calea 1 se desfasoara lucrari - demontare si montare parapet median.,"B2 va fi restrictionata, iar pa B1 si pe BU sa va circula normal.",A1,"['527', '300', '527', '300']"
1.4,A1,292+000,295+000,2025-11-13 08:00:00,2025-11-13 16:00:00,SPRING (AB) - CALNIC (AB),Pe Calea 2 se desfasoara lucrari - curatat sant marginal si transport material rezultat.,"BU va fi restrictionata, iar pa B1 si pe B2 sa va circula normal.",A1,"['292', '0', '295', '0']"
1.5,DN7,216+450,217+400,2025-11-13 08:00:00,2025-11-13 16:00:00,CALINESTI (VL) - CALINESTI (VL),Pe sectorul de drum DN 7 km 216+450 - km 217+400 pe raza localitatii Calinesti se executa lucrari la pila 1 de la Ecoductul Calinesti intre orele 08:00 - 16:00.,"Circulatia rutiera se desfasoara pe 1/2 din cale dirijata de piloti de circulatie, iar in cazuri exceptionale se inchide/deschide in reprize de 15 minute.",DN7,"['216', '450', '217', '400']"
1.6,DN7,200+143,200+340,2025-11-13 07:00:00,2025-11-13 18:00:00,CALIMANESTI (VL) - ,"Pe sectorul de drum DN 7 km 200+143- km 200+340, in extravilanul localitatii Calimanesti se executa lucrari de punere in siguranta versanti intre orele 07:00 - 18:00.","In  intervalul orar 08:00 - 16:00 circulatia rutiera se inchide/deschide in reprize de max.15 minute, iar in rest circulatia rutiera se desfasoara pe 1/2 cale dirijata de piloti de circulatie.",DN7,"['200', '143', '200', '340']"
1.7,DN7,218+200,218+300,2025-11-13 08:00:00,2025-11-13 16:00:00,TUTULESTI (VL) - ,Pe sectorul de drum DN 7 km 218+200 - km 218+300 in extravilanul localitatii Tutulesti se executa lucrari pregatitoare zid sprijin  intre orele 08:00 - 16:00.,Circulatia rutiera se desfasoara pe 1/2 din cale dirijata de piloti de circulatie.,DN7,"['218', '200', '218', '300']"
1.8,DN7A,17+000,18+000,2025-11-13 08:30:00,2025-11-13 15:00:00,BRADISOR (VL) - BRADISOR (VL),"Pe sectoarele de drum DN 7A km 17+000 - km 18+000 , pe raza localitatii Bradisor, se lucreaza la ranguire versanti intre orele 8:30 - 15:00.","Circulatia rutiera se desfasoara pe 1/2 cale dirijata de piloti de circulatie,  iar in cazuri exceptionale se inchide/deschide in reprize de 15 minute.",DN7A,"['17', '0', '18', '0']"
