NR. CRT.,Indicativ drum,De la km,Pana la km,De la data,Pana la data,Intre localitatile,Cauza,Masuri de remediere,viz_name,map_zoom
1.1,A0,62+000,63+000,2024-06-14 21:04:00,2024-06-15 08:00:00, - ,Lucrari parapet median. Calea 2 banda 2 blocata.,,A0,"['62', '0', '63', '0']"
1.2,DN22J,2+400,3+300,2024-06-14 07:00:00,2024-06-17 19:00:00,SMARDAN (TL) - SMARDAN (TL),Lucrari de frezare si asternere imbracaminte bituminoasa.,Trafic alternant semaforizat pe sensul de mers Braila - Macin. Circulatie deschisa pe sensul de mers Macin - Braila.,DN22J,"['2', '400', '3', '300']"
1.3,DN2S,3+100,3+300,2024-06-12 07:00:00,2024-06-17 19:00:00,VADENI (BR) - VADENI (BR),Lucrari de frezare si asternere imbracaminte bituminoasa.,"Trafic restrictionat,calea 1, banda 1,se circula pe banda 2.Semnalizare cu balize directionale + lampi de culoare galbena intermitenta pe timpul noptii.",DN2S,"['3', '100', '3', '300']"
1.4,DN2S,4+800,5+200,2024-06-13 09:50:00,2024-06-17 19:00:00,VADENI (BR) - VADENI (BR),Frezare si asternere imbracaminte bituminoasa.,"Trafic restrictionat, Calea 2, Banda 2, se circula pe banda 1.Semnalizare cu balize directionale + lampi de culoare galbena pe timpul noptii.",DN2S,"['4', '800', '5', '200']"
1.5,DN2S,3+100,3+300,2024-06-14 07:00:00,2024-06-17 19:00:00,VADENI (BR) - VADENI (BR),Frezare si asternere imbracaminte bituminoasa.,"Trafic restrictionat,calea 2, banda 1,se circula pe banda 2.Semnalizare cu balize directionale + lampi de culoare galbena intermitenta pe timpul noptii.",DN2S,"['3', '100', '3', '300']"
1.6,DN66,102+410,110+700,2024-06-12 08:00:00,2024-06-17 17:00:00,BUMBESTI-JIU (GJ) - PETROSANI (HD),Se lucreaza la ranguire versanti.,"Circulatia se inchide/deschide in reprize de 15-20 minute, pentru degajarea partii carosabile de materialul pietros rezultat, dirijata de piloti de circulatie.",DN66,"['102', '410', '110', '700']"
1.7,DN66,116+932,121+000,2024-06-12 08:00:00,2024-06-17 17:00:00,BUMBESTI-JIU (GJ) - PETROSANI (HD),Se lucreaza la ranguire versanti.,"Circulatia se inchide/deschide in reprize de 15-20 minute, pentru degajarea partii carosabile de materialul pietros rezultat, dirijata de piloti de circulatie.",DN66,"['116', '932', '121', '0']"
1.8,DN7,236+000,238+000,2024-06-13 19:00:00,2024-06-15 06:00:00,CAINENII MARI (VL) - ,Se lucreaza la asternere covor asfaltic.,"Circulatia se desfasoara pe 1/2 cale, dirijata de piloti de circulatie.",DN7,"['236', '0', '238', '0']"
