NR. CRT.,Indicativ drum,De la km,Pana la km,De la data,Pana la data,Intre localitatile,Cauza,Masuri de remediere,viz_name,map_zoom
1.1,DN2S,4+500,6+600,2024-08-06 09:15:00,2024-09-20 19:00:00,VADENI (BR) - SMARDAN (TL),Frezare si asternere imbracaminte bituminoasa.,"Devierea traficului rutier de pe Calea 2 pe Calea 1 la km 7+000, cu revenire in Calea 2 la km 3+000. Circulatia rutiera se desfasoara in ambele sensuri cu restrictie de viteza de 30km/h. / Semnalizare cu balize directionale si lampi de culoare galbena intermitenta pe timpul noptii.",DN2S,"['4', '500', '6', '600']"
1.2,DN67,144+000,151+000,2024-09-17 08:00:00,2024-09-17 18:00:00,SLATIOARA (VL) - HOREZU (VL),"Se lucreaza la taiere acostamente, in functie de conditiile meteo .","Circulatia rutiera se desfasoara pe 1/2 cale, dirijata de piloti de circulatie .",DN67,"['144', '0', '151', '0']"
1.3,DN67B,106+000,107+000,2024-09-17 08:00:00,2024-09-17 18:00:00,CRETENI (VL) - ,"Se lucreaza la reparatii asfaltice, in functie de conditiile meteo .","Circulatia rutiera se desfasoara pe 1/2 cale, dirijata de piloti de circulatie .",DN67B,"['106', '0', '107', '0']"
1.4,DN7,159+400,159+900,2024-09-17 08:00:00,2024-09-17 18:00:00,MILCOIU (VL) - ,"Se executa lucrari pregatitoare pentru montare parapet , in functie de conditiile meteo .","Circulatia rutiera se desfasoara pe 2 benzi de circulatie din 3 , dirijata prin indicatoare rutiere .",DN7,"['159', '400', '159', '900']"
1.5,DN7,163+000,163+500,2024-09-17 08:00:00,2024-09-17 18:00:00,MILCOIU (VL) - BLIDARI (VL),"Se lucreaza la montare parapet cu role, in functie de conditiile meteo .","Circulatia rutiera se desfasoara pe 1/2 cale , dirijata de piloti de circulatie .",DN7,"['163', '0', '163', '500']"
1.6,DN7,191+000,191+100,2024-09-17 09:00:00,2024-09-17 12:00:00,CALIMANESTI (VL) - ,Se lucreaza la demontare parapet.,"Circulatia rutiera se desfasoara pe 1/2 cale, dirijata de piloti de circulatie.",DN7,"['191', '0', '191', '100']"
1.7,DN73C,62+000,63+000,2024-09-17 08:00:00,2024-09-17 18:00:00,PRUNDENI (VL) - ZAVIDENI (VL),"Se lucreaza la tratare burdusiri, in functie de conditiile meteo .","Circulatia rutiera se desfasoara pe 1/2 cale, dirijata de piloti de circulatie .",DN73C,"['62', '0', '63', '0']"
