NR. CRT.,Indicativ drum,De la km,Pana la km,De la data,Pana la data,Intre localitatile,Cauza,Masuri de remediere,viz_name,map_zoom
1.1,A1,100+500,101+300,2024-06-25 07:30:00,2024-06-25 15:00:00,CATEASCA (AG) - ,Se esxecuta lucrari de reparatie la partea carosabila pe sensul Pitesti-Bucuresti. Banda doi este restrictionata.,,A1,"['100', '500', '101', '300']"
1.2,DN2S,3+100,3+300,2024-06-17 19:00:00,2024-06-25 19:00:00,VADENI (BR) - VADENI (BR),Lucrari de frezare si asternere imbracaminte bituminoasa.,"Trafic restrictionat,calea 1, banda 2, se circula pe banda 1.Semnalizare cu balize directionale + lampi de culoare galbena intermitenta pe timpul noptii.",DN2S,"['3', '100', '3', '300']"
1.3,DN2S,4+800,6+900,2024-06-25 08:40:00,2024-07-01 19:30:00,SMARDAN (BZ) - VADENI (BR),Frezare si asternere imbracaminte bituminoasa.,"Trafic restrictionat, Calea 2, Banda 1, se circula pe banda 2.Semnalizare cu balize directionale + lampi de culoare galbena pe timpul noptii.",DN2S,"['4', '800', '6', '900']"
1.4,DN2S,3+100,3+300,2024-06-21 19:00:00,2024-06-25 19:00:00,VADENI (BR) - VADENI (BR),Frezare si asternere imbracaminte bituminoasa.,"Trafic restrictionat,calea 2, banda 1,se circula pe banda 2.Semnalizare cu balize directionale + lampi de culoare galbena intermitenta pe timpul noptii.",DN2S,"['3', '100', '3', '300']"
1.5,DN7,208+000,214+000,2024-06-25 08:00:00,2024-06-25 18:00:00,BREZOI (VL) - CALINESTI (VL),Se lucreaza la aplicare marcaje rutiere.,Circulatia rutiera se desfasoara ingreunat pe ambele sensuri de mers in zona utilajului de aplicat marcaje.,DN7,"['208', '0', '214', '0']"
1.6,DN7,208+000,208+200,2024-06-25 19:00:00,2024-06-26 06:00:00,BREZOI (VL) - ,Se lucreaza la la asfaltare parcare.,Circulatia rutiera se desfasoara ingreunat pe ambele sensuri dirijata prin indicatoare rutiere.,DN7,"['208', '0', '208', '200']"
1.7,DN7,214+000,225+000,2024-06-25 19:00:00,2024-06-26 06:00:00,CALINESTI (VL) - ROBESTI (VL),Se executa lucrari de reparatii asfaltice.,Circulatia rutiera se desfasoara pe 1/2 din cale dirijata de pilotidecirculatie.,DN7,"['214', '0', '225', '0']"
