NR. CRT.,Indicativ drum,De la km,Pana la km,De la data,Pana la data,Intre localitatile,Cauza,Masuri de remediere,viz_name,map_zoom
1.1,A1,331+500,331+700,2025-02-05 13:30:00,2025-02-05 16:00:00,AUREL VLAICU (HD) - ,Pe Calea 2 se executalucrari de reparatii gropi cu mixtura stocabila,Pe Calea 2 se circula pe Banda 2. Banda 1 si Banda de Urgenta sunt restrictionate pana la finalizarea lucrarilor,A1,"['331', '500', '331', '700']"
1.2,A2,131+400,131+400,2025-02-05 09:30:00,2025-02-05 15:30:00,STEFAN VODA (CL) - ,"Pe A2, Calea 1 (pe sensul de mers Bucuresti - Constanta) se executa lucrari de montare panouri antiorbire.",Banda numarul doi este inchisa circulatiei rutiere in intervalul orar 09:30 - 15:30 traficul rutier se desfasoara pe banda numarul unu cu limita de viteza la 60 km/h. Semnalizare corespunzatoare.,A2,"['131', '400', '131', '400']"
1.3,A3,12+000,12+800,2025-02-05 12:00:00,2025-02-05 15:00:00, - ,Calea 1. Banda 1 restrictionata. Sens Bucuresti - Ploiesti. Lucrari taiat drajoni.,,A3,"['12', '0', '12', '800']"
1.4,DN64,13+000,14+000,2025-02-05 08:00:00,2025-02-05 16:00:00,BRANCOVENI (OT) - ,Se executa lucrari de decoronare arbori pentru ridicare de gabarit.,Se circula dirijat cu semnalizare rutiera si piloti de circulatie.,DN64,"['13', '0', '14', '0']"
1.5,DN64,21+000,23+000,2025-02-05 08:00:00,2025-02-05 16:00:00,VALENI (BRANCOVENI) (OT) - VALENI (BRANCOVENI) (OT),Se executa lucrari de decoronare arbori pentru ridicare de gabarit.,"Se circula dirijat cu semnalizare rutiera si piloti de circulatie, intre orele 08:00 - 16:00.",DN64,"['21', '0', '23', '0']"
1.6,DN7A,14+000,15+000,2025-02-05 08:00:00,2025-02-05 16:00:00,SALISTEA (MALAIA) (VL) - ,Se executa lucrari de ranguire versanti.,"Circulatia rutiera se inchide/deschide in reprize de max. 20 minute, dirijata de piloti de circulatie.",DN7A,"['14', '0', '15', '0']"
