NR. CRT.,Indicativ drum,De la km,Pana la km,De la data,Pana la data,Intre localitatile,Cauza,Masuri de remediere,viz_name,map_zoom
1.1,DN21,42+000,49+000,2024-07-05 06:00:00,2024-07-05 19:00:00,VIZIRU (BR) - BARAGANUL (BR),Executare lucrari asternere covor asfaltic.,Se circula alternativ pe un sens.Dirijare cu semafor.,DN21,"['42', '0', '49', '0']"
1.2,DN2S,4+800,6+900,2024-06-25 08:40:00,2024-07-12 19:30:00,SMARDAN (BZ) - VADENI (BR),Frezare si asternere imbracaminte bituminoasa.,"Trafic restrictionat, Calea 2, Banda 1, se circula pe banda 2.Semnalizare cu balize directionale + lampi de culoare galbena pe timpul noptii.",DN2S,"['4', '800', '6', '900']"
1.3,DN2S,6+000,6+700,2024-07-04 09:10:00,2024-07-12 19:00:00,SMARDAN (TL) - SMARDAN (TL),Lucrari de frezare si asternere imbracaminte bituminoasa.,"Trafic restrictionat, calea 1, banda 1, se circula pe banda 2. Semnalizare cu balize directionale si lampi de culoare galbena intermitenta pe timpul noptii.",DN2S,"['6', '0', '6', '700']"
1.4,DN7,160+000,166+000,2024-07-04 19:00:00,2024-07-05 06:00:00,MILCOIU (VL) - COASTA (GOLESTI) (VL),Se lucreaza la frezare denivelari .,Circulatia rutiera se desfasoara pe 1/2 cale dirijara de piloti de circulatie .,DN7,"['160', '0', '166', '0']"
1.5,DN7,197+700,198+000,2024-07-04 19:00:00,2024-07-05 06:00:00,CALIMANESTI (VL) - ,Se lucreaza la frezare denivelari .,Circulatia rutiera se desfasoara ingreunat in zona utilajului de cosit.,DN7,"['197', '700', '198', '0']"
