NR. CRT.,Indicativ drum,De la km,Pana la km,De la data,Pana la data,Intre localitatile,Cauza,Masuri de remediere,viz_name,map_zoom
1.1,A1,24+000,29+100,2025-02-19 16:30:00,2025-02-21 23:59:00,BOLINTIN-VALE (GR) - BUCURESTI (B),"A A1 , Calea 2 : km 29+100 - 24+000 : Circulatia este restrictionata pe banda de urgenta si banda 1 din cauza gropilor, se circula pe banda 2.",,A1,"['24', '0', '29', '100']"
1.2,A1,70+000,86+400,2025-02-19 16:30:00,2025-02-21 23:59:00,PETRESTI (AG) - PETRESTI (AG),"A A1, Calea 2, Banda 1 : km 70+000 - 86+000. Se executa lucrari de reparatii la partea carosabila.",,A1,"['70', '0', '86', '400']"
1.3,A1,295+100,295+900,2025-02-21 09:20:00,2025-02-21 16:00:00,CUNTA (AB) - ,"Pe Calea 2, se desfasoara lucrari - reparatii cu mixtura asfaltica.","Se circula pe banda 2.Banda 1 si banda de urgenta - inchise.Se estimeaza reluarea circulatiei normale si incheierea lucrarilor, in jurul orei 16:00.",A1,"['295', '100', '295', '900']"
1.4,A1,70+000,86+000,2025-02-21 10:00:00,2025-02-21 23:59:00,PETRESTI (AG) - PETRESTI (AG),"A A1, Calea 1, Banda 1 : km 70+000 - 86+000. Se executa lucrari de reparatii la partea carosabila",,A1,"['70', '0', '86', '0']"
1.5,A2,105+000,116+000,2025-02-21 09:00:00,2025-02-21 17:00:00,DRAJNA NOUA (CL) - DRAJNA NOUA (CL),"Lucrari de  intretinere si reparatii la partea carosabila, A2, banda 1 este inchisa. Traficul rutier se desfasoara pe banda 2 cu limita de viteza la 60 km/h. Semnalizare corespunzatoare.",,A2,"['105', '0', '116', '0']"
1.6,DN67B,99+000,100+000,2025-02-21 08:00:00,2025-02-21 16:00:00,GUSOENI (VL) - ,Se lucreaza la taiere acostamente.,"Circulatia rutiera se desfasoara pe 1/2 cale, dirijata de indicatoare rutiere si piloti de circulatie.",DN67B,"['99', '0', '100', '0']"
