NR. CRT.,Indicativ drum,De la km,Pana la km,De la data,Pana la data,Intre localitatile,Cauza,Masuri de remediere si variante de ocolire,viz_name,map_zoom
4.1,DN17D,86+100,103+632,2023-12-08 13:15:00,2024-03-31 23:59:00, - ,Circulatie inchisa pe timp de iarna (nivel IV de viabilitate).,,DN17D,"['86', '100', '103', '632']"
4.2,DN1R,58+550,62+000,2023-12-08 13:15:00,2024-03-31 23:59:00, - ,Circulatie inchisa pe timp de iarna (nivel IV de viabilitate).,,DN1R,"['58', '550', '62', '0']"
4.3,DN67C,34+800,79+200,2023-11-06 08:00:00,2024-03-31 23:59:00,RANCA (GJ) - CURPAT (SB),Sector de drum inchis pe timp de iarna - nivel IV de viabilitate.,Semnalizarea rutiera specifica pe teren in conformitate cu prevederile reglementarilor tehnice in vigoare si a Normativalui privind circulatia rutiera pe drumurile montane - Drumul National DN 7C Transfagarasan si Drumul National DN 67C Transalpina - indicativ AND 615-2020.,DN67C,"['34', '800', '79', '200']"
4.4,DN67C,34+800,79+200,2024-01-03 09:00:00,2024-03-31 23:59:00, - ,Circulatie inchisa pe timp de iarna (nivel IV de viabilitate).,,DN67C,"['34', '800', '79', '200']"
4.5,DN7C,104+000,130+800,2023-11-06 08:00:00,2024-06-30 23:59:00,PISCUL NEGRU (AG) - BALEA CASCADA (SB),"Avand in vedere scaderea temperaturilor la altitudine, a intensificarii bruste a vantului, a posibilitatii aparitiei cetii dense in orice moment al zilei si pentru siguranta participantilor la trafic s-a luat decizia ca circulatia rutiera sa fie interzisa pentru toate categoriile de autovehicule.",,DN7C,"['104', '0', '130', '800']"
