NR. CRT.,Indicativ drum,De la km,Pana la km,De la data,Pana la data,Intre localitatile,Cauza,Masuri de remediere,viz_name,map_zoom
1.1,A1,109+000,109+300,2023-12-19 08:00:00,2023-12-19 15:00:00,PITESTI (AG) - ,Lucrari de reparatie la rosturi de dilatatie. Banda 1 si Banda de urgenta de pe Calea 2(sens Pitesti-Bucuresti) sunt restrictionate.,,A1,"['109', '0', '109', '300']"
1.2,A1,46+000,47+000,2023-12-19 09:00:00,2023-12-19 17:00:00,IZVORU (VANATORII MICI) (GR) - ,Se executa lucrari de reparatie partea carosabila.  Banda 1 pe sensul Bucuresti- Pitesti este restrictionata.,,A1,"['46', '0', '47', '0']"
1.3,DN55,25+500,25+500,2023-12-19 09:03:00,2023-12-19 23:10:00,BRATOVOESTI (DJ) - ,Accident rutier. Eroare umana,"Partea carosabila curata si uscata. Un autoturism a intrat pe contrasens si a lovit un alt autovehicul din care a rezultat decesul unei persoane. Circulatia rutiera se desfasoara ingreunat 1/2 cale dirijat de Politie. La fata locului se afla Politia, Smurd, un echipaj de la Drumuri. Se estimeaza reluarea circulatiei in conditii normale in aproximativ 2 ore.",DN55,"['25', '500', '25', '500']"
1.4,DN67B,119+236,119+236,2023-09-07 19:10:00,2023-12-31 00:00:00,DRAGASANI (VL) - POGANU (OT),"Podul peste raul Olt nu prezinta siguranta pentru autovehiculele cu MTMA > 7,5 TO .","Circulatia rutiera se desfasoara pe 1/2 cale , dirijata prin semafoare . Ruta ocolitoare pentru autovehiculele cu MTMA > 7,5 TO - DN 64 - DJ 678C - DJ 678 - DN 67B .",DN67B,"['119', '236', '119', '236']"
1.5,DN7CC,3+150,3+150,2023-06-25 16:00:00,2023-12-31 00:00:00,PAUSA (VL) - ,"Datorita precipitatiilor din ultima perioada, pe DN 7CC (Centura ocolitoare a orasului Calimanesti ) , din cauza unei alunecari de teren care a antrenat cantitati insemnate de material aluvionar (pietre, bolovani si arbori).","Circulatia rutiera se desfasoara alternativ pe 1/2 cale, cu restrictionare pe sensul de mers Sibiu - Rm. Valcea. Circulatia rutiera este dirijata cu ajutorul semafoarelor si semnalizata cu balize, indicatoare si lampi de iluminare intermitenta.",DN7CC,"['3', '150', '3', '150']"
