NR. CRT.,Indicativ drum,De la km,Pana la km,De la data,Pana la data,Intre localitatile,Cauza,Masuri de remediere,viz_name,map_zoom
1.1,A1,270+000,272+600,2023-10-07 09:00:00,2023-10-07 13:00:00,ACILIU (SB) - SALISTE (SB),Se executa lucrari de reparatii la partea carosabila. Banda 1 si Banda de urgenta de pe Calea 2 (sens Sebes-Sibiu) sunt restrictionate.,Se circula ingreunat pe banda 2 de pe calea 2(sens Sebes-Sibiu).,A1,"['270', '0', '272', '600']"
1.2,A1,237+432,279+560,2023-10-07 07:00:00,2023-10-10 22:00:00,TALMACIU (SB) - SEBES (AB),"Trafic rutier desfasurat cu dificultate datorita unui transport agabaritic(camion cu masa 94,06 T) pe ruta  BORS 2 PTF -  tranzitarea pe sectorul de drum a DRDP Brasov pe : A1-SEBES -SIBIU - DN 7/DN 1- TALMACIU - DN 7 - LAZARET - DN 7 -  CENTURA CALIMANESTI.","Etapele de desfasurare ale transportului sunt stabilite de Politia Rutiera,care asigura insotirea vehiculelor. Transportul va fi insotit de 2 vehicule si 2 agenti de insotire specializati, fiecare.",A1,"['237', '432', '279', '560']"
1.3,A1,242+500,242+800,2023-10-07 09:00:00,2023-10-07 14:00:00,SIBIU (SB) - SIBIU (SB),Se executa lucrari de reparatii la partea carosabila. Banda 1 si Banda de urgenta de pe Calea 2 (sens Sebes-Sibiu) sunt restrictionate.,Se circula ingreunat pe Banda 2 de pe Calea 2(sens Sebes-Sibiu).,A1,"['242', '500', '242', '800']"
1.4,DN11,24+100,24+150,2023-10-07 08:43:00,2023-10-07 12:00:00,OZUN (CV) - OZUN (CV),Accident in care au fost implicate  2 autoturisme soldat cu victime .,"Echipe de la Smurd ,politie la fata locului . Trafic dirijat de catre politie , se circula pe un sens.",DN11,"['24', '100', '24', '150']"
1.5,DN67B,119+236,119+236,2023-09-07 19:10:00,2023-10-31 00:00:00,DRAGASANI (VL) - POGANU (OT),"Podul peste raul Olt nu prezinta siguranta pentru autovehiculele cu MTMA>7,5 TO.","Circulatia rutiera se desfasoara pe 1/2 cale, dirijata prin semafoare. Ruta ocolitoare pentru autovehiculele cu MTMA > 7,5 TO - DN 64-DJ678C-DJ678-DN 67B.",DN67B,"['119', '236', '119', '236']"
1.6,DN7CC,3+150,3+150,2023-06-25 16:00:00,2023-10-31 00:00:00,PAUSA (VL) - ,"Datorita precipitatiilor din ultima perioada, pe DN 7CC (Centura ocolitoare a orasului Calimanesti ) , din cauza unei alunecari de teren care a antrenat cantitati insemnate de material aluvionar (pietre, bolovani si arbori).","Circulatia rutiera se desfasoara alternativ pe 1/2 cale, cu restrictionare pe sensul de mers Sibiu - Rm. Valcea. Circulatia rutiera este dirijata cu ajutorul semafoarelor si semnalizata cu balize, indicatoare si lampi de iluminare intermitenta.",DN7CC,"['3', '150', '3', '150']"
