NR. CRT.,Indicativ drum,De la km,Pana la km,De la data,Pana la data,Intre localitatile,Cauza,Masuri de remediere,viz_name,map_zoom
1.1,A1,86+000,87+000,2023-12-05 09:00:00,2023-12-05 16:00:00, - ,Reparatii parte carosabila. Banda 1 calea 1 (Bucuresti-Pitesti) blocata.,,A1,"['86', '0', '87', '0']"
1.2,A1,554+500,554+500,2023-12-05 09:10:00,2023-12-05 16:00:00,PECICA (AR) - PECICA (AR),"Informare Eveniment rutier - Lucrari  pe A1 km 554+500 calea 1 Pecica -Inlocuire parapet median se circula pe banda unu si cea de urgenta,banda doi este restrictionata.",,A1,"['554', '500', '554', '500']"
1.3,A1,548+000,550+500,2023-12-05 09:10:00,2023-12-05 16:00:00,ARAD (AR) - ARAD (AR),"Informare Eveniment rutier-Lucrari pe A1 km 548+500-550+500 calea 2 Arad-Lucrari-reparatii cu mixtura stocabila,banda de urgenta si banda unu sunt restrictionate ,se circula pe banda doi,se estimeaza reluarea normala a circulatiei in jurul orei 16:00",,A1,"['548', '0', '550', '500']"
1.4,DN67B,119+236,119+236,2023-09-07 19:10:00,2023-12-31 00:00:00,DRAGASANI (VL) - POGANU (OT),"Podul peste raul Olt nu prezinta siguranta pentru autovehiculele cu MTMA > 7,5 TO .","Circulatia rutiera se desfasoara pe 1/2 cale , dirijata prin semafoare . Ruta ocolitoare pentru autovehiculele cu MTMA > 7,5 TO - DN 64 - DJ 678C - DJ 678 - DN 67B .",DN67B,"['119', '236', '119', '236']"
1.5,DN7CC,3+150,3+150,2023-06-25 16:00:00,2023-12-31 00:00:00,PAUSA (VL) - ,"Datorita precipitatiilor din ultima perioada, pe DN 7CC (Centura ocolitoare a orasului Calimanesti ) , din cauza unei alunecari de teren care a antrenat cantitati insemnate de material aluvionar (pietre, bolovani si arbori).","Circulatia rutiera se desfasoara alternativ pe 1/2 cale, cu restrictionare pe sensul de mers Sibiu - Rm. Valcea. Circulatia rutiera este dirijata cu ajutorul semafoarelor si semnalizata cu balize, indicatoare si lampi de iluminare intermitenta.",DN7CC,"['3', '150', '3', '150']"
