NR. CRT.,Indicativ drum,De la km,Pana la km,De la data,Pana la data,Intre localitatile,Cauza,Masuri de remediere,viz_name,map_zoom
1.1,A1,270+000,292+000,2024-01-30 11:58:00,2024-01-30 15:00:00,SALISTE (SB) - CUNTA (AB),Restrictie mobila. Lucrari de colmatare fisuri. Banda 1 si banda de urgenta de pe Calea 1(sens Sibiu-Sebes) si Calea 2 (sens Sebes-Sibiu) sunt restrictionate.,Se circula ingreunat pe banda 2 a caii 1 si a caii 2.,A1,"['270', '0', '292', '0']"
1.2,A3,14+000,14+000,2024-01-30 09:00:00,2024-01-30 17:00:00, - ,Un TIR s-a rasturnat in afara partii carosabile. Fara victime.,Circulatia este blocata pe banda 1 pe breteaua de iesirea catre DNCB (Ploiesti-Bucuresti). Se circula pe banda 2.,A3,"['14', '0', '14', '0']"
1.3,DN24,32+850,32+850,2024-01-30 11:10:00,2024-01-30 15:00:00,GARA BERHECI (GL) - GARA BERHECI (GL),"Accident rutier in care au fost implicate un autoturism si un camion. Partea carosabila, curata si uscata.",Circulatia este blocata.,DN24,"['32', '850', '32', '850']"
1.4,DN67B,119+236,119+236,2024-01-01 00:00:00,2024-01-31 23:59:00,DRAGASANI (VL) - POGANU (OT),"Podul peste raul Olt nu prezinta siguranta pentru autovehiculele cu MTMA > 7,5 TO .","Circulati a rutiera se desfasoara pe1/2 cale , dirijata prin semafoare. Ruta ocolitoare pentru autovehiculele cu MTMA > 7,5 TO - DN 64 - DJ 678C - DJ 678 - DN 67B.",DN67B,"['119', '236', '119', '236']"
1.5,DN7CC,3+150,3+150,2023-06-25 16:00:00,2024-01-31 00:00:00,PAUSA (VL) - ,"Datorita precipitatiilor din ultima perioada, pe DN 7CC (Centura ocolitoare a orasului Calimanesti ) , din cauza unei alunecari de teren care a antrenat cantitati insemnate de material aluvionar (pietre, bolovani si arbori).","Circulatia rutiera se desfasoara alternativ pe 1/2 cale, cu restrictionare pe sensul de mers Sibiu - Rm. Valcea. Circulatia rutiera este dirijata cu ajutorul semafoarelor si semnalizata cu balize, indicatoare si lampi de iluminare intermitenta.",DN7CC,"['3', '150', '3', '150']"
