NR. CRT.,Indicativ drum,De la km,Pana la km,De la data,Pana la data,Intre localitatile,Cauza,Masuri de remediere,viz_name,map_zoom
1.1,A1,237+432,279+560,2023-10-07 07:00:00,2023-10-10 22:00:00,TALMACIU (SB) - SEBES (AB),"Trafic rutier desfasurat cu dificultate datorita unui transport agabaritic(camion cu masa 94,06 T) pe ruta  BORS 2 PTF -  tranzitarea pe sectorul de drum a DRDP Brasov pe : A1-SEBES -SIBIU - DN 7/DN 1- TALMACIU - DN 7 - LAZARET - DN 7 -  CENTURA CALIMANESTI.","Etapele de desfasurare ale transportului sunt stabilite de Politia Rutiera,care asigura insotirea vehiculelor. Transportul va fi insotit de 2 vehicule si 2 agenti de insotire specializati, fiecare.",A1,"['237', '432', '279', '560']"
1.2,DN67B,119+236,119+236,2023-09-07 19:10:00,2023-10-31 00:00:00,DRAGASANI (VL) - POGANU (OT),"Podul peste raul Olt nu prezinta siguranta pentru autovehiculele cu MTMA>7,5 TO.","Circulatia rutiera se desfasoara pe 1/2 cale, dirijata prin semafoare. Ruta ocolitoare pentru autovehiculele cu MTMA > 7,5 TO - DN 64-DJ678C-DJ678-DN 67B.",DN67B,"['119', '236', '119', '236']"
1.3,DN71,67+300,67+900,2023-10-08 10:00:00,2023-10-08 15:00:00,PUCIOASA (DB) - ,Circulatia va fi inchisa pentru desfasurarea competitiei ciclism Bikexpert Alpine Challenge editia a X-a.In intervalul orar 12:30-14:30 pe DN71 la km 74 traversare participanti eveniment,Traficul rutier se va desfasura pe Soseaua de Centura a orasului Pucioasa,DN71,"['67', '300', '67', '900']"
1.4,DN71,74+800,74+900,2023-10-08 10:30:00,2023-10-08 11:30:00,FIENI (DB) - ,Circulatia va fi restrictionata pentru desfasurarea competitiei ciclism Bikexpert Alpine Challenge editia a X-a,,DN71,"['74', '800', '74', '900']"
1.5,DN7CC,3+150,3+150,2023-06-25 16:00:00,2023-10-31 00:00:00,PAUSA (VL) - ,"Datorita precipitatiilor din ultima perioada, pe DN 7CC (Centura ocolitoare a orasului Calimanesti ) , din cauza unei alunecari de teren care a antrenat cantitati insemnate de material aluvionar (pietre, bolovani si arbori).","Circulatia rutiera se desfasoara alternativ pe 1/2 cale, cu restrictionare pe sensul de mers Sibiu - Rm. Valcea. Circulatia rutiera este dirijata cu ajutorul semafoarelor si semnalizata cu balize, indicatoare si lampi de iluminare intermitenta.",DN7CC,"['3', '150', '3', '150']"
