NR. CRT.,Indicativ drum,De la km,Pana la km,De la data,Pana la data,Intre localitatile,Cauza,Masuri de remediere,viz_name,map_zoom
1.1,A3Ms,36+105,36+205,2024-03-29 08:08:00,2024-03-29 17:00:00,IERNUT (MS) - CHETANI (MS),"Montare bucle inductive in asfalt, se va restrictiona pe rand cate o banda de circulatie de pe calea 1(spre Turda).",Se circula ingreunat pe banda libera de pe calea 1(spre Turda).,A3Ms,"['36', '105', '36', '205']"
1.2,A3Ms,40+745,40+845,2024-03-29 08:30:00,2024-03-29 12:00:00,CHETANI (MS) - TURDA (CJ),"Se executa lucrari de mascare instalatii electrice, pe Pasajul peste Autostrada .Restrictionata banda 2 de pe calea 1. (sens Iernut - Turda)",Se circula ingreunat pe banda 1 de pe calea 1(sens Iernut -Turda).,A3Ms,"['40', '745', '40', '845']"
1.3,DN1,146+000,146+050,2024-03-29 05:20:00,2024-03-29 19:30:00,PREDEAL (BV) - TIMISU DE SUS (BV),"Tir defect pe sensul de mers catre Bucuresti, o macara aseaza marfa cazuta in remorca .","Circulatia va fi restrictionata pe ambele sensuri pana la ora 9,00 .",DN1,"['146', '0', '146', '50']"
1.4,DN17,197+250,197+250,2024-03-29 07:07:00,2024-03-29 09:00:00, - ,"Accident rutier pe DN 17, pe raza localitatii Prisaca Dornei, jud. Suceava. Un microbuz cu 6 persoane s-a rasturnat pe. Traficul rutier este oprit pe ambele sensuri. La locul accidentului se afla Politia rutiera.",Se deplaseaza echipaj de la SDN Campulung Moldovenesc.,DN17,"['197', '250', '197', '250']"
1.5,DN67B,119+236,119+236,2024-01-01 00:00:00,2024-03-31 17:00:00,DRAGASANI (VL) - POGANU (OT),"Podul peste raul Olt nu prezinta siguranta pentru autovehiculele cu MTMA > 7,5 TO .","Circulati a rutiera se desfasoara pe1/2 cale , dirijata prin semafoare. Ruta ocolitoare pentru autovehiculele cu MTMA > 7,5 TO - DN 64 - DJ 678C - DJ 678 - DN 67B.",DN67B,"['119', '236', '119', '236']"
1.6,DN7CC,3+150,3+150,2023-06-25 16:00:00,2024-03-31 17:00:00,PAUSA (VL) - ,"Datorita precipitatiilor din ultima perioada, pe DN 7CC (Centura ocolitoare a orasului Calimanesti ) , din cauza unei alunecari de teren care a antrenat cantitati insemnate de material aluvionar (pietre, bolovani si arbori).","Circulatia rutiera se desfasoara alternativ pe 1/2 cale, cu restrictionare pe sensul de mers Sibiu - Rm. Valcea. Circulatia rutiera este dirijata cu ajutorul semafoarelor si semnalizata cu balize, indicatoare si lampi de iluminare intermitenta.",DN7CC,"['3', '150', '3', '150']"
