NR. CRT.,Indicativ drum,De la km,Pana la km,De la data,Pana la data,Intre localitatile,Cauza,Masuri de remediere,viz_name,map_zoom
1.1,A1,242+000,242+100,2024-02-08 07:28:00,2024-02-08 11:30:00,SIBIU (SB) - SIBIU (SB),Tamponare un autoturism intra in parapetul median si ramane in banda 2 a caii 2. Politia si echipa CIC Boita la fata locului pentru semnalizare si degajare parte carosabila.,Se circula ingreunat pe banda 1 a caii 2.,A1,"['242', '0', '242', '100']"
1.2,DN10,95+000,98+000,2024-02-08 08:00:00,2024-02-08 15:59:00,CRASNA (CV) - CRASNA (CV),Se lucreaza la taieri de arbori.,"Circulatia se va restrictiona cand va fi cazul, in reprize de 5 - 10 minute si va fi dirijata cu piloti de trafic.",DN10,"['95', '0', '98', '0']"
1.3,DN67B,119+236,119+236,2024-01-01 00:00:00,2024-02-29 23:59:00,DRAGASANI (VL) - POGANU (OT),"Podul peste raul Olt nu prezinta siguranta pentru autovehiculele cu MTMA > 7,5 TO .","Circulati a rutiera se desfasoara pe1/2 cale , dirijata prin semafoare. Ruta ocolitoare pentru autovehiculele cu MTMA > 7,5 TO - DN 64 - DJ 678C - DJ 678 - DN 67B.",DN67B,"['119', '236', '119', '236']"
1.4,DN7,163+600,164+200,2024-02-08 08:00:00,2024-02-08 16:00:00,BLIDARI (VL) - ,Se lucreaza la taiere arbori.,Circulatia rutiera se inchide/ deschide in reprize de max.20 de minute dirijata prin piloti de circulatie.,DN7,"['163', '600', '164', '200']"
1.5,DN7CC,3+150,3+150,2023-06-25 16:00:00,2024-02-29 17:00:00,PAUSA (VL) - ,"Datorita precipitatiilor din ultima perioada, pe DN 7CC (Centura ocolitoare a orasului Calimanesti ) , din cauza unei alunecari de teren care a antrenat cantitati insemnate de material aluvionar (pietre, bolovani si arbori).","Circulatia rutiera se desfasoara alternativ pe 1/2 cale, cu restrictionare pe sensul de mers Sibiu - Rm. Valcea. Circulatia rutiera este dirijata cu ajutorul semafoarelor si semnalizata cu balize, indicatoare si lampi de iluminare intermitenta.",DN7CC,"['3', '150', '3', '150']"
