NR. CRT.,Indicativ drum,De la km,Pana la km,De la data,Pana la data,Intre localitatile,Cauza,Masuri de remediere,viz_name,map_zoom
1.1,A3Ms,35+500,36+000,2023-10-30 09:42:00,2023-10-30 16:00:00,CHETANI (MS) - CHETANI (MS),Inlocuire parapet deteriorat.Restrictie mobila in nodul rutier de la Chetani.,Se circula ingreunat in nodul rutier Chetani.,A3Ms,"['35', '500', '36', '0']"
1.2,A3Ms,18+500,36+400,2023-10-30 12:02:00,2023-10-30 17:00:00,CHETANI (MS) - IERNUT (MS),"Se lucreaza la refacere  marcaje rutiere, banda 1 si banda 2 de pe calea 2 (sens Chetani-Targu Mures) sunt restrictionate in mod alternativ. Restrictie mobila.",Se circula ingreunat si alternativ pe banda 1 si banda 2 de pe calea 2(sens Chetani-Tg Mures).,A3Ms,"['18', '500', '36', '400']"
1.3,DN11,5+100,5+900,2023-10-30 08:30:00,2023-10-30 18:00:00,BRASOV (BV) - BRASOV (BV),Circulatie cu restrictii pentru toate categoriile de vehicule in vederea executarii lucrarilor de asternere covor in sensul giratoriu de sub pasaj Ocolitoarea Brasov.,Ca ruta ocolitoare se recomanda : Varianta Brasov -Tarlungeni (DJ 103A) - prejmer - Lunca calnicului - (DJ 112D)  DN 11,DN11,"['5', '100', '5', '900']"
1.4,DN67B,119+236,119+236,2023-09-07 19:10:00,2023-10-31 00:00:00,DRAGASANI (VL) - POGANU (OT),"Podul peste raul Olt nu prezinta siguranta pentru autovehiculele cu MTMA > 7,5 TO .","Circulatia rutiera se desfasoara pe 1/2 cale , dirijata prin semafoare . Ruta ocolitoare pentru autovehiculele cu MTMA > 7,5 TO - DN 64 - DJ 678C - DJ 678 - DN 67B .",DN67B,"['119', '236', '119', '236']"
1.5,DN7CC,3+150,3+150,2023-06-25 16:00:00,2023-10-31 00:00:00,PAUSA (VL) - ,"Datorita precipitatiilor din ultima perioada, pe DN 7CC (Centura ocolitoare a orasului Calimanesti ) , din cauza unei alunecari de teren care a antrenat cantitati insemnate de material aluvionar (pietre, bolovani si arbori).","Circulatia rutiera se desfasoara alternativ pe 1/2 cale, cu restrictionare pe sensul de mers Sibiu - Rm. Valcea. Circulatia rutiera este dirijata cu ajutorul semafoarelor si semnalizata cu balize, indicatoare si lampi de iluminare intermitenta.",DN7CC,"['3', '150', '3', '150']"
