NR. CRT.,Indicativ drum,De la km,Pana la km,De la data,Pana la data,Intre localitatile,Cauza,Masuri de remediere,viz_name,map_zoom
1.1,DEx12,50+150,57+720,2023-12-19 12:00:00,2024-01-19 12:00:00,SLATINA (OT) - ,Inchiderea circulatiei este necesara pentru a se putea executa lucrarile de racordare a tronsonului 2 cu tronsonul 3 din cadrul DEX 12 Craiova - Pitesti.Restictia va dura pana la finalizarea lucrarilor.,Circulatia rutiera va fi deviata pe DN 65 pentru toate categoriile de autovehicule.,DEx12,"['50', '150', '57', '720']"
1.2,DN15A,6+150,6+250,2023-12-22 07:15:00,2023-12-22 10:30:00,SANTU (MS) - SANTU (MS),"Un autotren a ramas imobilizat pe partea carosabila, dupa ce conducatorul a incercat sa efectueze manevra de intoarcere.",Traficul rutier este oprit pe ambele sensuri pana va fi extras tirul de catre o macara de mare tonaj.,DN15A,"['6', '150', '6', '250']"
1.3,DN19,14+000,14+000,2023-12-22 07:20:00,2023-12-22 20:30:00,BIHARIA (BH) - BIHARIA (BH),"Coliziune intre un autoturism si un biciclist. Se circula alternativ, incepand cu ora 08:00.","Prezenta la fata locului: politia, ambulanta",DN19,"['14', '0', '14', '0']"
1.4,DN67B,119+236,119+236,2023-09-07 19:10:00,2023-12-31 00:00:00,DRAGASANI (VL) - POGANU (OT),"Podul peste raul Olt nu prezinta siguranta pentru autovehiculele cu MTMA > 7,5 TO .","Circulatia rutiera se desfasoara pe 1/2 cale , dirijata prin semafoare . Ruta ocolitoare pentru autovehiculele cu MTMA > 7,5 TO - DN 64 - DJ 678C - DJ 678 - DN 67B .",DN67B,"['119', '236', '119', '236']"
1.5,DN7CC,3+150,3+150,2023-06-25 16:00:00,2023-12-31 00:00:00,PAUSA (VL) - ,"Datorita precipitatiilor din ultima perioada, pe DN 7CC (Centura ocolitoare a orasului Calimanesti ) , din cauza unei alunecari de teren care a antrenat cantitati insemnate de material aluvionar (pietre, bolovani si arbori).","Circulatia rutiera se desfasoara alternativ pe 1/2 cale, cu restrictionare pe sensul de mers Sibiu - Rm. Valcea. Circulatia rutiera este dirijata cu ajutorul semafoarelor si semnalizata cu balize, indicatoare si lampi de iluminare intermitenta.",DN7CC,"['3', '150', '3', '150']"
