NR. CRT.,Indicativ drum,De la km,Pana la km,De la data,Pana la data,Intre localitatile,Cauza,Masuri de remediere,viz_name,map_zoom
1.1,A6,4+500,8+600,2024-01-16 09:45:00,2024-01-16 16:30:00,TIPARI (TM) - TIPARI (TM),"Eveniment rutier-Lucrari pe A6 km 4+500-8+600 calea 1  Tipari - Reparatii gropi cu mixtura asfaltica,banda unu si cea de urgenta sunt  restrictionate,se circula pe banda doi,se estimeaza reluarea normala a circulatiei in jurul orei 16:30",,A6,"['4', '500', '8', '600']"
1.2,DN13E,41+000,43+000,2024-01-16 12:06:00,2024-01-16 14:59:00,RECI (CV) - RECI (CV),"Trafic ingreunat , din cauza protestelor transportatorilor.",Se circula ingreunat,DN13E,"['41', '0', '43', '0']"
1.3,DN2,471+100,482+230,2024-01-16 11:00:00,2024-01-16 20:00:00,BALCAUTI (SV) - SIRET (SV),Trafic rutier ingreunat din cauza blocarii vamii Siret de catre fermierii romani.,,DN2,"['471', '100', '482', '230']"
1.4,DN67B,119+236,119+236,2024-01-01 00:00:00,2024-01-31 23:59:00,DRAGASANI (VL) - POGANU (OT),"Podul peste raul Olt nu prezinta siguranta pentru autovehiculele cu MTMA > 7,5 TO .","Circulati a rutiera se desfasoara pe1/2 cale , dirijata prin semafoare. Ruta ocolitoare pentru autovehiculele cu MTMA > 7,5 TO - DN 64 - DJ 678C - DJ 678 - DN 67B.",DN67B,"['119', '236', '119', '236']"
1.5,DN7,164+400,164+400,2024-01-16 12:30:00,2024-01-16 15:30:00,POPESTI (GOLESTI) (VL) - ,"A izbucnit un incendiu la nivelul unui autocamion, ce transporta mase plastice ce se deplasa pe sensul de mers Pitesti - Rm. Valcea, nu sunt victime. Partea carosabila curata si partial umeda.","Circulatia se desfasoara pe 1/2 cale. La fata locului se afla Pompierii, Politia si o echipa de la Drumuri.",DN7,"['164', '400', '164', '400']"
1.6,DN7CC,3+150,3+150,2023-06-25 16:00:00,2024-01-31 00:00:00,PAUSA (VL) - ,"Datorita precipitatiilor din ultima perioada, pe DN 7CC (Centura ocolitoare a orasului Calimanesti ) , din cauza unei alunecari de teren care a antrenat cantitati insemnate de material aluvionar (pietre, bolovani si arbori).","Circulatia rutiera se desfasoara alternativ pe 1/2 cale, cu restrictionare pe sensul de mers Sibiu - Rm. Valcea. Circulatia rutiera este dirijata cu ajutorul semafoarelor si semnalizata cu balize, indicatoare si lampi de iluminare intermitenta.",DN7CC,"['3', '150', '3', '150']"
