NR. CRT.,Indicativ drum,De la km,Pana la km,De la data,Pana la data,Intre localitatile,Cauza,Masuri de remediere,viz_name,map_zoom
1.1,DN1,173+375,176+270,2023-10-20 09:00:00,2023-10-22 16:00:00,GHIMBAV (BV) - CODLEA (BV),Lucrari de straturi bituminoase foarte subtiri,Trafic restrictionat pe o banda,DN1,"['173', '375', '176', '270']"
1.2,DN12,14+900,14+950,2023-10-21 21:12:00,2023-10-21 23:59:00,SFANTU GHEORGHE (CV) - BODOC (CV),Accident produs intre un autoturism si o duba soldat cu victime.,"Echipaje de la Smurd, politie , salvare si de la drumuri la fata locului. Trafic blocat.",DN12,"['14', '900', '14', '950']"
1.3,DN67B,119+236,119+236,2023-09-07 19:10:00,2023-10-31 00:00:00,DRAGASANI (VL) - POGANU (OT),"Podul peste raul Olt nu prezinta siguranta pentru autovehiculele cu MTMA > 7,5 TO .","Circulatia rutiera se desfasoara pe 1/2 cale , dirijata prin semafoare . Ruta ocolitoare pentru autovehiculele cu MTMA > 7,5 TO - DN 64 - DJ 678C - DJ 678 - DN 67B .",DN67B,"['119', '236', '119', '236']"
1.4,DN7CC,3+150,3+150,2023-06-25 16:00:00,2023-10-31 00:00:00,PAUSA (VL) - ,"Datorita precipitatiilor din ultima perioada, pe DN 7CC (Centura ocolitoare a orasului Calimanesti ) , din cauza unei alunecari de teren care a antrenat cantitati insemnate de material aluvionar (pietre, bolovani si arbori).","Circulatia rutiera se desfasoara alternativ pe 1/2 cale, cu restrictionare pe sensul de mers Sibiu - Rm. Valcea. Circulatia rutiera este dirijata cu ajutorul semafoarelor si semnalizata cu balize, indicatoare si lampi de iluminare intermitenta.",DN7CC,"['3', '150', '3', '150']"
1.5,DNCB,29+700,30+220,2023-10-21 22:00:00,2023-10-22 06:00:00, - ,"Lucrari de ,,Inlocuire a stratului de uzura in perioada de garantie.,, Inchiderea circulatiei pe rampa de urcare in sensul giratoriu suspendat dinspre Glina si pe banda 2 a giratoriului suspendat.","Vor fi afectate sensurile de mers dinspre DN CB/Glina spre Bucuresti si spre Oltenita, circulatia se va desfasura spre sensul giratoriu de la Nodul rutier Berceni, pentru intoarcere catre Bucuresti si Oltenita.",DNCB,"['29', '700', '30', '220']"
