NR. CRT.,Indicativ drum,De la km,Pana la km,De la data,Pana la data,Intre localitatile,Cauza,Masuri de remediere,viz_name,map_zoom
1.1,A1,14+000,15+500,2023-10-03 08:00:00,2023-10-03 18:00:00, - ,Se executa lucrari de reparatii la partea carosabila. Banda 1 Calea 2 (Pitesti-Bucuresti) este blocata.,Circulatia se desfasoara pe banda 2.,A1,"['14', '0', '15', '500']"
1.2,A1,109+000,109+400,2023-10-03 08:28:00,2023-10-03 15:00:00, - ,Lucrari reparatii la partea carosabila. Banda 2 calea 1 (Bucuresti-Pitesti) blocata.,,A1,"['109', '0', '109', '400']"
1.3,A3,67+000,67+000,2023-10-03 08:00:00,2023-10-03 18:00:00,BARCANESTI (PH) - ,"Se executa lucrari de reparatii la partea carosabila. Pe calea 1 si calea 2, banda 1 este blocata.",,A3,"['67', '0', '67', '0']"
1.4,DN2,420+700,420+700,2023-10-03 08:44:00,2023-10-03 11:00:00,BUNESTI (SV) - BUNESTI (SV),"Accident DN2 km 420+700 stg, loc Bunesti, jud. SV.  Se circula pe un sens dirijat de politie.",,DN2,"['420', '700', '420', '700']"
1.5,DN67B,119+236,119+236,2023-09-07 19:10:00,2023-10-31 00:00:00,DRAGASANI (VL) - POGANU (OT),"Podul peste raul Olt nu prezinta siguranta pentru autovehiculele cu MTMA>7,5 TO.","Circulatia rutiera se desfasoara pe 1/2 cale, dirijata prin semafoare. Ruta ocolitoare pentru autovehiculele cu MTMA > 7,5 TO - DN 64-DJ678C-DJ678-DN 67B.",DN67B,"['119', '236', '119', '236']"
1.6,DN7CC,3+150,3+150,2023-06-25 16:00:00,2023-10-31 00:00:00,PAUSA (VL) - ,"Datorita precipitatiilor din ultima perioada, pe DN 7CC (Centura ocolitoare a orasului Calimanesti ) , din cauza unei alunecari de teren care a antrenat cantitati insemnate de material aluvionar (pietre, bolovani si arbori).","Circulatia rutiera se desfasoara alternativ pe 1/2 cale, cu restrictionare pe sensul de mers Sibiu - Rm. Valcea. Circulatia rutiera este dirijata cu ajutorul semafoarelor si semnalizata cu balize, indicatoare si lampi de iluminare intermitenta.",DN7CC,"['3', '150', '3', '150']"
