NR. CRT.,Indicativ drum,De la km,Pana la km,De la data,Pana la data,Intre localitatile,Tip lucrare,Variante de ocolire,viz_name,map_zoom
6.1,A2,143+125,148+315,2023-11-06 12:00:00,2024-03-06 23:59:00, - ,Lucrari reabilitare pod peste Bratul Borcea.,Circulatia autovehiculelor se desfasoara cu restrictie de viteza la 60 km/h.Vor circula doar vehiculele rutiere cu masa totala maxima admisa (MTMA) <50 T.,A2,"['143', '125', '148', '315']"
6.2,A2,11+700,15+500,2024-02-12 23:00:00,2024-02-23 04:00:00,BUCURESTI (B) - BUCURESTI (B),"In zilele de Luni,Marti,Miercuri si Joi, intre orele 23:00-04:00 se vor efectua lucrari la tablierul metalic al pasajului de peste autostrada A2, la km 13+300.","1.Bucuresti - Constanta  : Bld. Theodor Pallady - A2 - nod rutier km 12+000 - Centura Bucuresti (DNCB) - DN 3,Fundulea - A A2 - Constanta.2. Constanta - Bucuresti : A A2 - nod rutier km 15+000 - DJ 301 - Cerica - Centura Bucuresti (DNCB).",A2,"['11', '700', '15', '500']"
6.3,DN22,107+560,108+915,2023-09-25 09:00:00,2024-03-31 23:59:00,JIJILA (TL) - JIJILA (TL),"Realizare lucrari la sensul giratoriu nr.5 (drum principal- km 18+709) la obiectiv Proiectare si executie pod suspendat peste Dunare, in zona Tulcea.",Circulatie alternanta dirijata cu semafoare la lucrari pe maxim 1/2 din cale.,DN22,"['107', '560', '108', '915']"
6.4,DN25,48+028,48+028,2023-09-12 07:00:00,2024-12-31 23:59:00,PISCU (GL) - PISCU (GL),"Aviz restrictie tonaj de 7,5 tone nr: DRDP: 22345/11.09.2023, in baza Expertizei Tehnice nr 224/2021.","Circulatia se va desfasura astfel:-Ruta 1 ocolitoare propusa:>   Autovehiculele, cu greutate mai mica sau egala cu 30 t, de pe DN2B din Municipiul Braila care doresc sa ajunga in Municipiul Tecuci vor urma ruta DN23 Focsani  DN2 Tisita  DN24 Tecuci. (Cu mentiunea ca pe DN 23 este in vigoare o restrictie de tonaj de 30 de tone)>   Ruta ocolitoare pentru autovehicule cu greutate mai mica sau egala cu 40 t: GALATI  SENDRENI INT DN25  DN2B  BALDOVINESTI  INTERSECTIE DN2B/SBR2  INTERSECTIE DN2B/DN23  GULIANCA  MAICANESTI  CIORASTI  MARTINESTI  TATARANU  INTERSECTIE DN2/DN23/DN23A/DJ204D  TISITA  INTERSECTIE DN24/V.TEC  TECUCI -      Ruta 2 ocolitoare propusa:>   Autovehiculele, cu greutate mai mica sau egala cu 30 t, de pe DJ255 care vin dinspre localitatea Izvoarele care doresc sa ajunga in Municipiul Tecuci vor urma ruta DN25 Sendreni  DN2B Braila  DN23 Focsani  DN2 Tisita  DN24 Tecuci. (Cu mentiunea ca pe DN 23 este in vigoare o restrictie de tonaj de 30 de tone)>    Ruta ocolitoare pentru autovehicule cu greutate mai mica sau egala cu 40 t: INDEPENDENTA  SENDRENI INT DN25  DN2B  BALDOVINESTI  INTERSECTIE DN2B/SBR2  INTERSECTIE DN2B/DN23  GULIANCA  MAICANESTI  CIORASTI  MARTINESTI  TATARANU  INTERSECTIE DN2/DN23/DN23A/DJ204D  TISITA  INTERSECTIE DN24/V.TEC - TECUCI -Ruta 3 ocolitoare propusa:>  Autovehiculele, cu greutate mai mica sau egala cu 30 t, de pe DJ254 care doresc sa ajunga in Municipiul Galati sau Braila vor urma ruta DN25 Tecuci  DN24 Tisita  DN2 Focsani  DN23 Braila  DN23 Sendreni. (Cu mentiunea ca pe DN 23 este in vigoare o restrictie de tonaj de 30 de tone)>   Ruta ocolitoare pentru autovehicule cu greutate mai mica sau egala cu 40 t, incepe de la DJ 252: LESPEZI  ADJUD  TISITA  INTERSECTIA STRADA/DN2  INTERSECTIE DN2/DN23/DN23A/DJ204D  TATARANU  MARTINESTI  CIORASTI  MAICANESTI  GULIANCA - INTERSECTIE DN2B/DN23  CAZASU  BRAILA>  Ruta ocolitoare pentru autovehicule cu greutate mai mica sau egala cu 40 t, incepe de la DJ 254: IVESTI  INTERSECTIE VO24F/DN25  TECUCI  INTERSECTIA DN24/V.TEC.  TISITA  INTERSECTIA STRADA/DN2 - INTERSECTIE DN2/DN23/DN23A/DJ204D  TATARANU  MARTINESTI  CIORASTI  MAICANESTI  GULIANCA - INTERSECTIE DN2B/DN23  CAZASU  BRAILA-Ruta 4 ocolitoare propusa:>     Autovehiculele, cu greutate mai mica sau egala cu 30 t, de pe DJ252 care doresc sa ajunga in Municipiul Galati sau Braila  vor urma ruta DN25 Tecuci  DN24 Tisita  DN2 Focsani  DN23 Braila  DN23 Sendreni  - DN2B Galati. (Cu mentiunea ca pe DN 23 este in vigoare o restrictie de tonaj de 30 de tone)>  Ruta ocolitoare pentru autovehicule cu greutate mai mica sau egala cu 40 t,: INTERSECTIA V.TEC/DN24  INTERSECTIA DN24/V.TEC - TISITA  INTERSECTIA STRADA/DN2 - INTERSECTIE DN2/DN23/DN23A/DJ204D  TATARANU  MARTINESTI  CIORASTI  MAICANESTI  GULIANCA - INTERSECTIE DN2B/DN23  INTERSECTIA DN2B/SBR2  BALDOVINESTI  SENDRENI INTERSECTIE DN25/DN2B - GALATI-Ruta 5 ocolitoare propusa:>     Autovehiculele, cu greutate mai mica sau egala cu 30 t, de pe DN24 care doresc sa ajunga in Municipiul Galati sau Braila  vor urma ruta  DN24 Tisita  DN2 Focsani  DN23 Braila  DN23 Sendreni  DN2B Galati. (Cu mentiunea ca pe DN 23 este in vigoare o restrictie de tonaj de 30 de tone)>  Ruta ocolitoare pentru autovehicule cu greutate mai mica sau egala cu 40 t,: - INTERSECTIE DN2/DN23/DN23A/DJ204D  TATARANU  MARTINESTI  CIORASTI  MAICANESTI  GULIANCA - INTERSECTIE DN2B/DN23  INTERSECTIA DN2B/SBR2  BALDOVINESTI  SENDRENI INTERSECTIE DN25/DN2B - GALATI-Ruta 6 ocolitoare propusa:Autovehiculele de pe DN23 care doresc sa ajunga in Municipiul Galati vor urma ruta: DN23 Braila DN2B Sendreni - Galati. (Cu mentiunea ca pe DN 23 este in vigoare o restrictie de tonaj de 30 de tone)",DN25,"['48', '28', '48', '28']"
6.5,DN28B,0+000,76+758,2023-03-31 07:00:00,2024-09-30 20:00:00,TARGU FRUMOS (IS) - BOTOSANI (BT),Modernizare DN 28 B Targu Frumos - Botosani km 0+000 - km 76+758,,DN28B,"['0', '0', '76', '758']"
6.6,DN57,62+000,65+800,2023-06-09 09:00:00,2024-11-03 12:00:00,COZLA (CS) - COZLA (CS),Consolidare versant.,Varianta de serviciu locala.Circulatie rutiera este dirijata cu semafoare pe 1/2 cale.,DN57,"['62', '0', '65', '800']"
6.7,DN67B,4+000,7+000,2024-02-05 08:00:00,2024-02-16 16:00:00,TARGU CARBUNESTI (GJ) - ,Se executa lucrari alimentatre cu apa.,"Circulatia rutiera se desfasoara ingreunat, pe 1/2 cale, semnalizare rutiera specifica.",DN67B,"['4', '0', '7', '0']"
6.8,DN6B,43+000,45+000,2024-02-05 08:00:00,2024-02-16 16:00:00,STOINA (GJ) - ,Se executa lucrari alimentatre cu apa.,"Circulatia rutiera se desfasoara ingreunat, pe 1/2 cale, semnalizare rutiera specifica.",DN6B,"['43', '0', '45', '0']"
