NR. CRT.,Indicativ drum,De la km,Pana la km,De la data,Pana la data,Intre localitatile,Tip lucrare,Variante de ocolire,viz_name,map_zoom
6.1,A1,529+700,529+700,2024-07-10 18:30:00,2024-07-20 15:00:00,ARAD (AR) - ,Lucrari - reparatii la rosturile de dilatatie (Calea 2).,"Se circula pe banda 2.Banda 1 si banda de urgenta - inchise.Se estimeaza incheierea lucrarilor si reluarea circulatiei normale, la data de 20.07.2024, ora 15:00.",A1,"['529', '700', '529', '700']"
6.2,A1,509+236,509+236,2024-07-05 09:50:00,2024-07-25 17:00:00,GIARMATA (TM) - ,Lucrari - reparatii rosturi de dilatatie (Calea 1).,"Se circula pe banda 2.Banda 1 si banda de urgenta - inchise.Se estimeaza incheierea lucrarilor si reluarea circulatiei normale, la data de 25.07.2024, ora 17:00.",A1,"['509', '236', '509', '236']"
6.3,A1,392+000,392+000,2024-07-03 16:30:00,2024-07-20 16:00:00,ILIA (HD) - ILIA (HD),"Eveniment rutier-Lucrari pe A1 km 392 calea 2 Ilia - Reparatii la rosturi de dilatatie,banda de urgenta si banda unu se circula, banda doi este restrictionata,se estimeaza reluarea normala a circulatiei in data de 12.07.2024 ora 16:00",,A1,"['392', '0', '392', '0']"
6.4,A1,392+270,392+270,2024-06-22 16:30:00,2024-07-20 16:00:00,ILIA (HD) - ,Pe calea 1 se executa lucrari de reparatii la rosturile de dilatatie,Pe Calea 1 se circula pe Banda 2. Banda 1 si Banda de Urgenta sunt restrictionate pana la finalizarea lucrarilor,A1,"['392', '270', '392', '270']"
6.5,A1,506+436,506+436,2024-06-21 10:00:00,2024-07-16 17:00:00,GIARMATA (TM) - GIARMATA (TM),Lucrari - reparatii rosturi de dilatatie (Calea 2).,"Banda 2 - inchisa.Banda 1 si banda de urgenta - se circulaSe estimeaza reluarea circulatiei normale si incheierea lucrarilor, la data de 16.07.2024, ora 17:00.",A1,"['506', '436', '506', '436']"
6.6,A2,143+125,148+315,2023-11-06 12:00:00,2024-12-01 23:59:00, - ,Lucrari reabilitare pod peste Bratul Borcea.,Circulatia autovehiculelor se desfasoara cu restrictie de viteza la 60 km/h.Vor circula doar vehiculele rutiere cu masa totala maxima admisa (MTMA) <50 T.,A2,"['143', '125', '148', '315']"
6.7,A6,3+700,4+300,2024-07-08 07:30:00,2024-07-19 15:00:00,LUGOJ (TM) - LUGOJ (TM),Lucrari de amenajare taluz si transport pamant. Calea 1.,"Circulatia se desfasoara ingreunat pe Banda 2, respactiv Banda 1 si Banda de Urgenta fiind restrictionate pa in data de 12.07.2024 ora 15:00.",A6,"['3', '700', '4', '300']"
6.8,DN1,194+573,194+573,2024-07-08 08:00:00,2024-07-12 16:00:00,VLADENI (BV) - VLADENI (BV),Lucrari de reparatii la pajajul cf,Trafic dirijat cu semafor,DN1,"['194', '573', '194', '573']"
6.9,DN15,250+625,250+655,2024-07-01 08:00:00,2024-07-15 16:00:00,CHIRITENI (NT) - CHIRITENI (NT),"Lucrari de reparatii si inlocuire dispozitive de acoperire a rosturilor de dilatatie la poduri,pasaje,viaducte de pe raza DRDP Iasi.","Se circula pe 1/2 din carosabil,alternativ,semaforizat.",DN15,"['250', '625', '250', '655']"
6.1,DN1A,12+252,64+400,2024-06-15 08:00:00,2024-12-31 23:59:00,BUCURESTI (B) - PLOIESTI (PH),"Realizarea lucrarilor de largire la 4 benzi.Restrictionarea traficului pe DN 1A , pe sectorul cuprims intre km 12+252 (Centura Bucuresti) - km 64+400 (Centura Ploiesti Vest), pentru autovehiculele cu MTMA mai mare de 7,5 tone. Lucrarea este semnalizata conform normelor metodologice in vigoare.","Rutele alternative, pentru relatia de deplasare Bucuresti - Ploiesti si retur:Traficul rutier va fi deviat pe DN CB (Centura Bucuresti)  - Autostrada A3 (Bucuresti - Ploiesti) - DN CPV (Centura Ploiesti Vest).",DN1A,"['12', '252', '64', '400']"
6.11,DN22,186+500,227+500,2024-03-29 11:06:00,2024-10-31 23:59:00,BAIA (TL) - CATALOI (TL),Lucrari de intretinere periodica drumuri - Straturi bituminoase foarte subtiri la rece.,"Circulatie alternanta, dirijata prin indicatoare la lucrari ce ocupa 1/2 din cale.",DN22,"['186', '500', '227', '500']"
6.12,DN22B,11+645,13+460,2024-05-17 14:46:00,2024-12-31 23:59:00,VADENI (BR) - GALATI (GL),"Intretinere poduri, pasaje, podete, tuneluri intretinere ziduri de sprijin si prevenirea efectelor inundatiilor.","Ciculatia se va desfasura 1/2 cale, alternativ. Dirijarea se va realiza cu piloti de circulatie dotati cu palete de semnalizare cu fete duble rosu-verde, statii de emisie-receptie si echipament de protectie de culoare portocalie.",DN22B,"['11', '645', '13', '460']"
6.13,DN24,6+700,17+000,2024-05-17 14:57:00,2024-12-31 23:59:00,COSMESTI (GL) - TECUCI (GL),"Intretinere poduri, pasaje, podete, tuneluri intretinere ziduri de sprijin si prevenirea efectelor inundatiilor.","Ciculatia se va desfasura 1/2 cale, alternativ. Dirijarea se va realiza cu piloti de circulatie dotati cu palete de semnalizare cu fete duble rosu-verde, statii de emisie-receptie si echipament de protectie de culoare portocalie.",DN24,"['6', '700', '17', '0']"
6.14,DN24,23+450,51+000,2024-05-17 14:59:00,2024-12-31 23:59:00,TECUCI (GL) - PRIPONESTI (GL),"Intretinere poduri, pasaje, podete, tuneluri intretinere ziduri de sprijin si prevenirea efectelor inundatiilor.","Ciculatia se va desfasura 1/2 cale, alternativ. Dirijarea se va realiza cu piloti de circulatie dotati cu palete de semnalizare cu fete duble rosu-verde, statii de emisie-receptie si echipament de protectie de culoare portocalie.",DN24,"['23', '450', '51', '0']"
6.15,DN24D,9+140,84+911,2024-05-17 14:43:00,2024-12-31 23:59:00,BALABANESTI (GL) - TULUCESTI (GL),"Intretinere poduri, pasaje, podete, tuneluri intretinere ziduri de sprijin si prevenirea efectelor inundatiilor.","Ciculatia se va desfasura 1/2 cale, alternativ. Dirijarea se va realiza cu piloti de circulatie dotati cu palete de semnalizare cu fete duble rosu-verde, statii de emisie-receptie si echipament de protectie de culoare portocalie.",DN24D,"['9', '140', '84', '911']"
6.16,DN25,48+028,48+028,2024-02-16 00:00:00,2024-12-31 23:59:00,PISCU (GL) - PISCU (GL),"RESTRICTIE TONAJ pentru autovehiculele cu masa totala autorizata >30t / Traversarea pasajului peste calea ferata de catre autovehiculele cu masa totala autorizata care nu depaseste 30t se va face pe un singur fir, alternativ, dirijat prin semaforizare.","Circulatia se va desfasura astfel:-Ruta 1 ocolitoare propusa:> Ruta ocolitoare pentru autovehicule cu greutate mai mica sau egala cu 40 t: GALATI SENDRENI INT DN25 DN2B BALDOVINESTI INTERSECTIE DN2B/SBR2 INTERSECTIE DN2B/DN23 GULIANCA MAICANESTI CIORASTI MARTINESTI TATARANU INTERSECTIE DN2/DN23/DN23A/DJ204D TISITA INTERSECTIE DN24/V.TEC TECUCI- Ruta 2 ocolitoare propusa:> Ruta ocolitoare pentru autovehicule cu greutate mai mica sau egala cu 40 t: INDEPENDENTA SENDRENI INT DN25 DN2B BALDOVINESTI INTERSECTIE DN2B/SBR2 INTERSECTIE DN2B/DN23 GULIANCA MAICANESTI CIORASTI MARTINESTI TATARANU INTERSECTIE DN2/DN23/DN23A/DJ204D TISITA INTERSECTIE DN24/V.TEC - TECUCI-Ruta 3 ocolitoare propusa:> Ruta ocolitoare pentru autovehicule cu greutate mai mica sau egala cu 40 t, incepe de la DJ 252: LESPEZI ADJUD TISITA INTERSECTIA STRADA/DN2 INTERSECTIE DN2/DN23/DN23A/DJ204D TATARANU MARTINESTI CIORASTI MAICANESTI GULIANCA - INTERSECTIE DN2B/DN23 CAZASU BRAILA> Ruta ocolitoare pentru autovehicule cu greutate mai mica sau egala cu 40 t, incepe de la DJ 254: IVESTI INTERSECTIE VO24F/DN25 TECUCI INTERSECTIA DN24/V.TEC. TISITA INTERSECTIA STRADA/DN2 - INTERSECTIE DN2/DN23/DN23A/DJ204D TATARANU MARTINESTI CIORASTI MAICANESTI GULIANCA - INTERSECTIE DN2B/DN23 CAZASU BRAILA-Ruta 4 ocolitoare propusa:> Ruta ocolitoare pentru autovehicule cu greutate mai mica sau egala cu 40 t,: INTERSECTIA V.TEC/DN24 INTERSECTIA DN24/V.TEC - TISITA INTERSECTIA STRADA/DN2 - INTERSECTIE DN2/DN23/DN23A/DJ204D TATARANU MARTINESTI CIORASTI MAICANESTI GULIANCA - INTERSECTIE DN2B/DN23 INTERSECTIA DN2B/SBR2 BALDOVINESTI SENDRENI INTERSECTIE DN25/DN2B - GALATI-Ruta 5 ocolitoare propusa:> Ruta ocolitoare pentru autovehicule cu greutate mai mica sau egala cu 40 t,: - INTERSECTIE DN2/DN23/DN23A/DJ204D TATARANU MARTINESTI CIORASTI MAICANESTI GULIANCA - INTERSECTIE DN2B/DN23 INTERSECTIA DN2B/SBR2 BALDOVINESTI SENDRENI INTERSECTIE DN25/DN2B - GALATI-Ruta 6 ocolitoare propusa:Autovehiculele de pe DN23 care doresc sa ajunga in Municipiul Galati vor urma ruta: DN23 Braila DN2B Sendreni - Galati. (Cu mentiunea ca pe DN 23 este in vigoare o restrictie de tonaj de 30 de tone)",DN25,"['48', '28', '48', '28']"
6.17,DN25,3+920,68+197,2024-05-17 15:00:00,2024-12-31 23:59:00,DRAGANESTI (GL) - SENDRENI (GL),"Intretinere poduri, pasaje, podete, tuneluri intretinere ziduri de sprijin si prevenirea efectelor inundatiilor.","Ciculatia se va desfasura 1/2 cale, alternativ. Dirijarea se va realiza cu piloti de circulatie dotati cu palete de semnalizare cu fete duble rosu-verde, statii de emisie-receptie si echipament de protectie de culoare portocalie.",DN25,"['3', '920', '68', '197']"
6.18,DN25A,0+000,7+340,2024-05-17 15:12:00,2024-12-31 23:59:00,NANESTI (NANESTI) (VN) - LIESTI (LIESTI) (GL),"Intretinere poduri, pasaje, podete, tuneluri intretinere ziduri de sprijin si prevenirea efectelor inundatiilor.","Ciculatia se va desfasura 1/2 cale, alternativ. Dirijarea se va realiza cu piloti de circulatie dotati cu palete de semnalizare cu fete duble rosu-verde, statii de emisie-receptie si echipament de protectie de culoare portocalie.",DN25A,"['0', '0', '7', '340']"
6.19,DN26,4+910,81+138,2024-05-17 14:50:00,2024-12-31 23:59:00,GALATI (GL) - CAVADINESTI (GL),"Intretinere poduri, pasaje, podete, tuneluri intretinere ziduri de sprijin si prevenirea efectelor inundatiilor.","Ciculatia se va desfasura 1/2 cale, alternativ. Dirijarea se va realiza cu piloti de circulatie dotati cu palete de semnalizare cu fete duble rosu-verde, statii de emisie-receptie si echipament de protectie de culoare portocalie.",DN26,"['4', '910', '81', '138']"
6.2,DN26A,0+000,0+575,2024-05-17 14:42:00,2024-12-31 23:59:00,OANCEA (GL) - OANCEA (GL),"Intretinere poduri, pasaje, podete, tuneluri intretinere ziduri de sprijin si prevenirea efectelor inundatiilor.","Ciculatia se va desfasura 1/2 cale, alternativ. Dirijarea se va realiza cu piloti de circulatie dotati cu palete de semnalizare cu fete duble rosu-verde, statii de emisie-receptie si echipament de protectie de culoare portocalie.",DN26A,"['0', '0', '0', '575']"
6.21,DN28B,0+000,76+758,2023-03-31 07:00:00,2024-09-30 20:00:00,TARGU FRUMOS (IS) - BOTOSANI (BT),Modernizare DN 28 B Targu Frumos - Botosani km 0+000 - km 76+758,,DN28B,"['0', '0', '76', '758']"
6.22,DN2A,113+754,113+754,2024-06-10 12:00:00,2024-09-30 17:00:00,GIURGENI (IL) - ,Reparatii de inlocuire dispozitive de acoperire a rosturilor de dilatatie la Pod Giurgeni,"Se circula pe partea dreapta a drumului, in ambele directii, pe o banda de circulatie pentru fiecare sens de mers.Se instituie restrictie de viteza de 40 km/h.",DN2A,"['113', '754', '113', '754']"
6.23,DN2B,141+700,149+966,2024-05-17 14:56:00,2024-12-31 23:59:00,GALATI (GL) - GALATI (GL),"Intretinere poduri, pasaje, podete, tuneluri intretinere ziduri de sprijin si prevenirea efectelor inundatiilor.","Ciculatia se va desfasura 1/2 cale, alternativ. Dirijarea se va realiza cu piloti de circulatie dotati cu palete de semnalizare cu fete duble rosu-verde, statii de emisie-receptie si echipament de protectie de culoare portocalie.",DN2B,"['141', '700', '149', '966']"
6.24,DN2B,125+571,127+101,2024-05-17 14:53:00,2024-12-31 23:59:00,SENDRENI (GL) - SENDRENI (GL),"Intretinere poduri, pasaje, podete, tuneluri intretinere ziduri de sprijin si prevenirea efectelor inundatiilor.","Ciculatia se va desfasura 1/2 cale, alternativ. Dirijarea se va realiza cu piloti de circulatie dotati cu palete de semnalizare cu fete duble rosu-verde, statii de emisie-receptie si echipament de protectie de culoare portocalie.",DN2B,"['125', '571', '127', '101']"
6.25,DN39,26+793,27+116,2024-04-15 08:08:00,2024-07-31 23:59:00,COSTINESTI (CT) - COSTINESTI (CT),"Amenajare intersectie intre drumul DN39 (E87), km 26+940 si drumul comunal DC6 ( intrare Costinesti), comuna Costinesti. Circulatia rutiera se desfasoara cu limita de viteza la 30 km/h",,DN39,"['26', '793', '27', '116']"
6.26,DN52,1+350,52+650,2023-06-07 10:00:00,2024-11-30 23:59:00,ALEXANDRIA (TR) - TURNU MAGURELE (TR),Lucrare modernizare drum. Se lucreaza alternativ pe acest sector de drum. Lucrarea este semnalizata conform normelor metodologice in vigoare.,Se circula alternativ cu semafoare.,DN52,"['1', '350', '52', '650']"
6.27,DN57,62+000,65+800,2023-06-09 09:00:00,2024-11-03 12:00:00,COZLA (CS) - COZLA (CS),Consolidare versant.,Varianta de serviciu locala.Circulatie rutiera este dirijata cu semafoare pe 1/2 cale.,DN57,"['62', '0', '65', '800']"
6.28,DN65F,4+000,4+000,2024-04-15 00:00:00,2024-07-15 12:00:00,CRAIOVA (DJ) - ,"Incepand de luni dupa-amiaza, 15.04.2024, pentru executia nodului rutier al DEx 12, Craiova-Pitesti, cu DN 65F, Centura Nord Craiova, se vor impune mai multe restrictiidecirculatie.","Pe Centura Nord circulatia rutiera se va desfasura in regim de drum in aliniament, se va desfiinta sensul giratoriu, cu restrictionarea vitezei de deplasare la maxim 30 Km/h.-esirea de pe strada Teilor in Centura se va face obligatoriu la dreapta si intoarcerea pe sensul spreIsalnita se va efectua in prima intersectie cu sens giratoriu, la fel, si accesul de pe sensul dinspre Bals, pe strada Teilor, se va face dupa intoarcerea in primul sens giratoriu de pe sensul Bals-Isalnita,Antreprenorul a instalat schema complet de semnalizare rutiera pentru dirijarea traficului in zonadelucrari.",DN65F,"['4', '0', '4', '0']"
6.29,DN67,45+000,52+850,2024-07-08 08:00:00,2024-07-15 18:00:00,MOTRU (GJ) - ROSIUTA (GJ),Lucrari intretinere periodica drumuri - covor asfaltic.,"Circulatie ingreunata pe 1/2 cale, semnalizare rutiera specifica.",DN67,"['45', '0', '52', '850']"
6.3,DN67B,10+000,14+000,2024-07-08 08:00:00,2024-07-15 16:00:00,CARBUNESTI-SAT (GJ) - ,Se executa lucrari alimentare cu apa.,"Circulatia rutiera se desfasoara ingreunat pe 1/2 cale, semnalizare rutiera specifica.",DN67B,"['10', '0', '14', '0']"
6.31,DN68A,42+600,44+600,2024-06-25 08:00:00,2024-07-25 12:00:00,MARGINA (TM) - COSAVA (TM),Se vor executa lucrari de tasare locala pe timp de zi si noapte.,"Circulatia rutiera se va desfasura ingreunat pe jumatate de cale.Perioada: 25.06.2024, ora 08:00 - 25.07.2024, ora 12:00.Circulatia rutiera este dirijata prin semafoare.",DN68A,"['42', '600', '44', '600']"
6.32,DN6B,43+000,45+000,2024-07-08 08:00:00,2024-07-15 16:00:00,STOINA (GJ) - ,Se executa lucrari alimentare cu apa.,"Circulatia rutiera se desfasoara ingreunat pe 1/2 cale, semnalizare rutiera specifica.",DN6B,"['43', '0', '45', '0']"
6.33,DN6B,37+550,49+700,2024-07-08 08:00:00,2024-07-15 16:00:00,CRUSET (GJ) - STOINA (GJ),Se executa lucrari de reparatii podet.,"Circulatia se desfasoara pe 1/2 cale, semnalizata corespunzator.",DN6B,"['37', '550', '49', '700']"
6.34,DN73,92+500,93+000,2024-06-17 08:00:00,2024-07-15 16:00:00,FUNDATA (BV) - FUNDATA (BV),Lucrari de consolidare corp drum,Trafic dirijat cu semafor/piloti de dirijare,DN73,"['92', '500', '93', '0']"
6.35,DN73,94+900,95+400,2024-06-17 10:10:00,2024-07-15 16:00:00,DRUMUL CARULUI (BV) - FUNDATA (BV),Lucrari de consolidare corp drum,Trafic dirijat cu semafor/piloti de dirijare,DN73,"['94', '900', '95', '400']"
6.36,DN73,98+040,98+540,2024-06-17 08:00:00,2024-07-15 16:00:00,DRUMUL CARULUI (BV) - DRUMUL CARULUI (BV),Lucrari de consolidare corp drum,Trafic dirijat cu semafor/piloti de dirijare,DN73,"['98', '40', '98', '540']"
6.37,DN73,111+200,126+000,2024-06-17 08:00:00,2024-07-15 16:00:00,CRISTIAN (BV) - TOHANU NOU (BV),Lucrari de reparatii la partea carosabila.,Trafic dirijat cu semafor/piloti de dirijare,DN73,"['111', '200', '126', '0']"
6.38,DN73A,49+000,50+000,2024-06-17 08:00:00,2024-07-15 16:00:00,POIANA MARULUI (BV) - SINCA NOUA (BV),Lucrari de alimentare apa si canalizare,Trafic dirijat cu semafor,DN73A,"['49', '0', '50', '0']"
6.39,DN73F,0+000,8+450,2024-06-17 08:00:00,2024-07-15 16:00:00,MOIECIU DE JOS (BV) - MOIECIU DE SUS (BV),Reabilitare parte carosabila,Trafic dirijat cu semafor,DN73F,"['0', '0', '8', '450']"
6.4,VO_TEC,0+000,5+020,2024-05-17 15:13:00,2024-12-31 23:59:00,TECUCI (GL) - MUNTENI (GL),"Intretinere poduri, pasaje, podete, tuneluri intretinere ziduri de sprijin si prevenirea efectelor inundatiilor.","Ciculatia se va desfasura 1/2 cale, alternativ. Dirijarea se va realiza cu piloti de circulatie dotati cu palete de semnalizare cu fete duble rosu-verde, statii de emisie-receptie si echipament de protectie de culoare portocalie.",VO_TEC,"['0', '0', '5', '20']"
