NR. CRT.,Indicativ drum,De la km,Pana la km,De la data,Pana la data,Intre localitatile,Tip lucrare,Variante de ocolire,viz_name,map_zoom
6.1,A10,66+000,66+500,2023-09-18 08:00:00,2023-09-30 18:00:00, - ,Lucrari de montaj parapet metalic si consolidare taluz. Este blocata banda de urgenta.,Se circula pe banda 1 si banda 2 cu semnalizare corespunzatoare.,A10,"['66', '0', '66', '500']"
6.2,A10,16+200,16+400,2023-06-16 16:35:00,2023-12-31 23:59:00,SANTIMBRU (AB) - SANTIMBRU (AB),"TALUZARE , SE INCHIDE BANDA 1 DE CIRCULATIE PE O PERIOADA NEDERMINATA< RESPECTIV PANA LA FINALIZAREA LUCRARILOR EFECTUATE DE CATRE CONSTRUCTOR>",SE CIRCULA DOAR PE BANDA NR. 2 DE CIRCULATIE CU SEMNALIZARILE CORESPUNZATOARE.,A10,"['16', '200', '16', '400']"
6.3,A2,160+300,160+300,2023-09-26 08:00:00,2023-10-10 23:59:00, - ,Inlocuirea rosturilor de dilatatie pe Pasajul Cernavoda,"Se vor executa lucrari de inlocuire rosturi de dilatatie pe banda de urgenta si banda 1, calea 1, circulatia desfasurandu-se pe banda 2.",A2,"['160', '300', '160', '300']"
6.4,A2,156+715,160+319,2023-04-13 08:00:00,2023-09-30 23:59:00,CERNAVODA (CT) - CERNAVODA (CT),Lucrari de reabilitare,Circulatia autovehiculelor se desfasoara cu restrictie de viteza  la 100 km/h.,A2,"['156', '715', '160', '319']"
6.5,A2,143+125,148+315,2023-09-19 13:00:00,2023-12-31 23:59:00, - ,Lucrari reabilitare pod peste Bratul Borcea.,"Pe perioada lucrarilor, Calea II de circulatie, sensul Constanta- Bucuresti, intre km 143+125 si km 148+315, va fi inchisa traficului, circulatia fiind deviata pe Calea I (Bucuresti - Constanta), unde se va desfasura in ambele sensuri.",A2,"['143', '125', '148', '315']"
6.6,A3Cj,45+000,61+000,2023-09-26 10:00:00,2023-10-30 18:00:00, - ,"Lucrari de reparatii colmatari fisuri si crapaturi transversale si longitudinale pe banda 1. Lucrarile se vor desfasura numai in zilele marti , miercuri si joi.",Circulatia se desfasoara pe banda 2 cu semnalizare corespunzatoare.,A3Cj,"['45', '0', '61', '0']"
6.7,A3Cj,1+900,1+900,2023-09-23 11:30:00,2023-09-30 18:00:00, - ,"Lucrari de raparatii rost dilatatie pod pe breteaua A , sens Gilau - Turda si Turda - Cluj. Este blocata o banda.",Se circula pe o banda cu semnalizare corespunzatoare.,A3Cj,"['1', '900', '1', '900']"
6.8,A3Cj,55+061,55+150,2023-09-21 12:00:00,2023-09-30 18:00:00, - ,Lucrari reparatii rost dilatatie la pod. Este blocata banda de urgenta si banda 1 in intervalul orar 08:00 - 18.00.,Se circula pe banda 2 cu semnalizare ocrespunzatoare.,A3Cj,"['55', '61', '55', '150']"
6.9,DN1,88+960,89+700,2023-09-13 12:00:00,2023-11-15 16:00:00,BANESTI (PH) - ,Lucrari peste raul Doftana,"- sensul de deplasare Brasov-Bucuresti se va inchide pe sectorul cuprins intre km 88+960 km 89+700, traficul desfasurandu-se deviat, in ambele directii, pe benzile destinate sensului Bucuresti-Brasov.",DN1,"['88', '960', '89', '700']"
6.1,DN1,577+950,578+050,2023-07-14 14:24:00,2023-10-15 12:00:00,TOPA DE CRIS (BH) - TOPA DE CRIS (BH),Amenajare intersectie DN1 km 577+950,"Se circula in conditii normale , lucrarile se desfasoara in zona drumului.",DN1,"['577', '950', '578', '50']"
6.11,DN10,8+867,26+450,2022-12-13 00:00:00,2023-11-10 23:59:00, - ,Aviz restrictie circulatie nr: DRDP: 6640/20.12.2022,Instituire restrictii PROTEHNIC INSTAL- DN 10  KM 8+867 - 26+450,DN10,"['8', '867', '26', '450']"
6.12,DN10,39+682,50+875,2023-01-23 00:00:00,2023-12-31 23:59:00, - ,Aviz restrictie circulatie nr: DRDP: 1782/26.01.2023,"Proiectul regional de dezvolatare a infrastructurii de apa si apa uzata din jud. Buzau in perioada 2014-2020 - U .A.T. Cislau, Patarlagele - aductiune, subtraversari.",DN10,"['39', '682', '50', '875']"
6.13,DN10,2+100,94+800,2023-05-02 00:00:00,2023-12-31 23:59:00, - ,Aviz restrictie circulatie nr: DRDP: 9555/04.05.2023,"Executia lucrarilor de intretinere curenta, in regie proprie, pe drumurile national/europene din administrarea S.D.N. Buzau",DN10,"['2', '100', '94', '800']"
6.14,DN11A,24+000,33+520,2023-09-14 07:00:00,2023-10-15 19:00:00,COTOFANESTI (BC) - ADJUD (VN),Lucrari de asternere covor asfaltic.,Se circula ingreunat alternativ pe 1/2 din cale dirijat de piloti ai firmei constructoare/semaforizat in unele zone.,DN11A,"['24', '0', '33', '520']"
6.15,DN11A,6+700,24+000,2023-07-10 07:00:00,2023-10-30 23:59:00,RADEANA (BC) - CORNATEL (BC),Executie covor asfaltic.,Circulatia rutiera se va desfasura alternativ dirijata de piloti ai firmei constructoare si semaforizat cand este cazul.,DN11A,"['6', '700', '24', '0']"
6.16,DN12A,101+335,101+400,2023-09-18 07:00:00,2023-09-30 18:00:00,TARGU OCNA (BC) - TARGU OCNA (BC),Inlocuirea dispozitivelor de acoperire a rosturilor de dilatatie.,Se circula semaforizat pe 1/2 din carosabil.,DN12A,"['101', '335', '101', '400']"
6.17,DN15,258+510,258+604,2023-08-10 07:00:00,2023-09-30 19:00:00,CHIRITENI (NT) - CHIRITENI (NT),Inlocuire dispozitive de acoperire a rosturilor de dilatatie a podului.,Se circula pe 1/2 din cale alternativ dirijat de piloti ai firmei constructoare.,DN15,"['258', '510', '258', '604']"
6.18,DN15B,21+800,21+881,2023-08-10 07:00:00,2023-09-30 19:00:00,DOLHESTI (NT) - DOLHESTI (NT),Inlocuire dispozitive de acoperire a rosturilor de dilatatie a podului.,Se circula pe 1/2 din cale alternativ dirijat de piloti ai firmei constructoare.,DN15B,"['21', '800', '21', '881']"
6.19,DN15D,82+325,90+250,2023-08-21 11:00:00,2023-10-01 12:00:00,DUMESTI (VS) - TODIRESTI (VS),Lucrari de intretinere periodica multianuala - Covoare asfaltice executate la cald.Se circula alternativ pe o banda in zona sectorului de lucru.,Se circula alternativ pe o banda in zona sectorului de lucru.,DN15D,"['82', '325', '90', '250']"
6.2,DN17,116+000,121+370,2023-02-06 08:00:00,2023-12-08 23:59:00,TESNA (POIANA STAMPEI) (SV) - ,Lucrari de intretinere periodica multianuala - Covoare asfaltice executate la cald.,Se circula alternativ pe o banda in zona sectorului de lucru.,DN17,"['116', '0', '121', '370']"
6.21,DN17C,63+300,63+700,2023-08-30 09:00:00,2023-09-30 17:00:00,ROMULI (BN) - ROMULI (BN),Consolidare corp drum.,Se circula anternativ semaforizat in zona sectorului de lucru.,DN17C,"['63', '300', '63', '700']"
6.22,DN17D,71+652,86+000,2023-07-11 12:00:00,2024-03-11 12:00:00,RODNA (BN) - VALEA MARE (SANT) (BN),Raforsare sitem rutier a sectorului de drum DN17D km 71+652 - 86+000,Se circula alternativ dirijat pe o banza in zona sectorului de lucru,DN17D,"['71', '652', '86', '0']"
6.23,DN18,123+960,124+060,2023-07-14 14:36:00,2023-10-08 23:00:00,VISEU DE SUS (MM) - VISEU DE SUS (MM),Reparatii dispozitive de acoperire a rosturilor de dilatatie la poduri.,Se circula alternativ semaforizat in zona sectorul de lucru.,DN18,"['123', '960', '124', '60']"
6.24,DN19B,20+500,29+600,2023-07-07 17:01:00,2023-12-31 23:59:00,TAUTEU (BH) - ABRAM (BH),Consolidare corp drum.,,DN19B,"['20', '500', '29', '600']"
6.25,DN1C,128+753,147+338,2023-08-25 08:00:00,2023-10-24 08:00:00, - ,Lucrari de intretinere periodica pe timp de vara - Straturi bituminoase foarte subtiri executate la rece,Se circula alternativ dirijat pe o banda in zona sectorului de lucru.,DN1C,"['128', '753', '147', '338']"
6.26,DN2,57+500,68+000,2023-08-01 13:27:00,2023-10-31 23:59:00,CIOCARLIA (IL) - URZICENI (IL),Se lucreaza la asternere covor asfaltic.,"Se va circula pe 1/2 din cale,  cu restrictie de viteza de 40 km/h",DN2,"['57', '500', '68', '0']"
6.27,DN2,476+000,479+269,2023-09-14 07:00:00,2023-10-15 19:00:00,BALCAUTI (SV) - SIRET (SV),Lucrari de asternere covor asfaltic.,Se circula ingreunat alternativ pe 1/2 din cale dirijat de piloti ai firmei constructoare/semaforizat in unele zone.,DN2,"['476', '0', '479', '269']"
6.28,DN2,441+500,458+800,2023-09-14 07:00:00,2023-10-15 19:00:00,SUCEAVA (SV) - ROMANESTI (GRANICESTI) (SV),Lucrari de asternere covor asfaltic.,Se circula ingreunat alternativ pe 1/2 din cale dirijat de piloti ai firmei constructoare/semaforizat in unele zone.,DN2,"['441', '500', '458', '800']"
6.29,DN22,107+560,108+915,2023-09-25 09:00:00,2023-10-31 23:59:00,JIJILA (TL) - JIJILA (TL),"Realizare lucrari la sensul giratoriu nr.5 (drum principal- km 18+709) la obiectiv Proiectare si executie pod suspendat peste Dunare, in zona Tulcea.",Circulatie alternanta dirijata cu semafoare la lucrari pe maxim 1/2 din cale.,DN22,"['107', '560', '108', '915']"
6.3,DN22,212+045,212+495,2023-07-08 16:30:00,2023-10-05 08:00:00,BABADAG (TL) - ,"Apararea impotriva inundatiilor a localitatii Babadag, judetul Tulcea. Refacere 5 poduri pe DN 22 km 210+291, km 211+812, km 212+045, km 212+495, km 213+600","Masuri de restrictie a traficului  pentru toate categoriile de autovehicule, cu exceptia riveranilor ce detin autovehicule cu MTMA < de 3.5 t, traficul se va desfasura deviat astfel:  DN 22 km 213+600-Sensul de deplasare Tulcea- Constanta se va desfasura deviat pe DN22A, ( ruta Cataloi - Nalbant - Nicolae Balcescu) si pe DN22D, ruta Ciucurova - Slava Rusa - Caugagia - DN22, km 186+900Pana la finalizarea podurilor de la km 212+045 si km 212+495, circulatia riveranilor din orasul Babadag, cu autovehicule cu MTMA mai mic sau egal cu 3,5 tone, se va desfasura astfel:- pe sensul de deplasare dinspre Tulcea spre Constanta, traficul se deviaza din DN 22 (km 213+560) pe str. Dragos Voda - DN 22 (km 214+250) loc Babadag- pe sensul de deplasare dinspre Constanta spre Tulcea, circulatia se va desfasura pe ruta DN 22 (km 214+640) loc. Babadag - str. Fat Frumos - DN 22 (km 213+230) loc BabadagCirculatia autovehiculelor destinate transportului public de persoane cu MTMA > 3.5 t se va desfasura pe ruta urmatoare: DN 22 - Str Stejarului - Str. Garii - Str. Ciurcovei - drum agricol -DJ 223 A - DN 22 si retur.Circulatia pietonala pentru ocolirea podului aflat in executie, DN22, km 213+600, va fi permisa pe tronsonul DN22- Str. Republicii- Str. Fat Frumos- DN 22.",DN22,"['212', '45', '212', '495']"
6.31,DN25,48+028,48+028,2023-09-12 07:00:00,2024-12-31 23:59:00,PISCU (GL) - PISCU (GL),"Aviz restrictie tonaj de 7,5 tone nr: DRDP: 22345/11.09.2023, in baza Expertizei Tehnice nr 224/2021.",Circulatia se va desfasura astfel- autovehiculele de pe DN2B din Municipiul Braila si Galati care vor sa ajunga in Municipiul Tecuci vor urma ruta           DN23 Focsani -DN2 Tisita - DN24 Tecuci- autovehiculele de pe DJ255 care vin dinspre Localitatea Izvoarele si care doresc sa ajunga in Municipiul Tecuci vor urma ruta           DN25 Sendreni - DN2B Braila - DN23 Focsani - DN2 Tisita - DN24 Tecuci- autovehiculele de pe DJ 252 si DJ 254 care doresc sa ajunga in Municipiul Braila sau Galati vor urma ruta           DN25 Tecuci - DN24 Tisita - DN2 Focsani - DN23 Braila - DN23 Sendreni - DN2B Galati- autovehiculele de pe DN24 care doresc sa ajunga in Municipiul Galati sau Braila vor urma ruta          DN24 Tisita - DN2 Focsani - DN23 Braila - DN23 Sendreni - DN2B Galati- autovehiculele de pe DN23 care doresc sa ajunga in Municipiul Galati vor urma ruta                                                     DN23 Braila - DN2B Sendreni /Galati,DN25,"['48', '28', '48', '28']"
6.32,DN28B,0+000,76+758,2023-03-31 07:00:00,2023-12-29 23:59:00,TARGU FRUMOS (IS) - BOTOSANI (BT),Modernizare DN 28 B Targu Frumos - Botosani km 0+000 - km 76+758,,DN28B,"['0', '0', '76', '758']"
6.33,DN28D,7+800,13+900,2023-09-14 07:00:00,2023-09-26 19:00:00,URICANI (IS) - LUNCA CETATUII (IS),Lucrari de asternere covor asfaltic.,Se circula ingreunat alternativ pe 1/2 din cale dirijat de piloti ai firmei constructoare/semaforizat in unele zone.,DN28D,"['7', '800', '13', '900']"
6.34,DN29B,14+000,27+000,2023-09-14 07:00:00,2023-10-15 19:00:00,CERVICESTI (BT) - SAUCENITA (BT),Lucrari de asternere covor asfaltic.,Se circula ingreunat alternativ pe 1/2 din cale dirijat de piloti ai firmei constructoare/semaforizat in unele zone.,DN29B,"['14', '0', '27', '0']"
6.35,DN29D,0+000,48+150,2023-06-21 07:06:00,2023-12-31 23:59:00,BOTOSANI (BT) - STEFANESTI (BT),"Restrictii de circulatie ca urmare a lucrarilor de modernizare pe DN 29D, Botosani - Stefanesti.","Traficul rutier pe DN 29D va fi restrictionat astfel: Vehiculele rutiere cu masa totala maxima admisa (MTMA) >7.50 T (destinate marfurilor sau persoanelor) vor circula pe DN 29D si DN 24C, pe traseul Botosani - Saveni - Manoleasa - Ripiceni - Stefanesti si retur Vehiculele rutiere cu masa totala maxima admisa (MTMA)  7.50 T (destinate marfurilor sau persoanelor) vor circula pe DN 29D, iar in perioada executiei viaductelor, acestea vor circula astfel: - Pe perioada lucrarilor de executie la viaductul 1, km 5+901 - 6+473 (Stauceni): Pe sensul Botosani - Stefanesti si retur, circulatia vehiculelor rutiere cu masa totala maxima admisa (MTMA)  3.5 T ce se desfasoara intre km 5+075 -7+060, se va devia pe ruta DN 29D, km 5+075 (extravilan Stauceni) - stanga pe DJ 4 DJ 20 (L 1.5 km) (Stauceni) - dreapta pe DJ 296A (L 0.80 km) - stanga DN 29D, km 7+060 (Stauceni) Pe sensul Botosani - Stefanesti si retur,  circulatia vehiculelor cu masa totala maxima autorizata (MTMA) cuprinsa antre 3.5 si 7.5 T se va desfasura pe ruta ocolitoare DN 29D (spre Ungureni) - dreapta DJ 296A (spre Rosiori) - stanga DN 29D, km 7+060 (Stauceni) Pe sensul Botosani - Stefanesti si retur, circulatia vehiculelor cu masa totala maxima autorizata (MTMA)  7.5 T ce se desfasoara intre intre km 8+145 - 10+325, se va devia pe ruta provizorie DN 29D, km 8+145 - dreapta, pe DC 31 (L 2.6 km, loc. Tocileni) - stanga DC  31 (L 2.7 km) - dreapta DN 29D, km 10+325 (loc. Victoria).",DN29D,"['0', '0', '48', '150']"
6.36,DN2A,146+530,149+500,2023-05-10 08:00:00,2023-11-15 23:59:00,STUPINA (CT) - STUPINA (CT),Se executa lucrari de reparatii asfaltice.,Circulatia se desfasoara alternativ pe cate o banda.,DN2A,"['146', '530', '149', '500']"
6.37,DN2A,196+739,196+739,2023-09-18 09:00:00,2023-10-30 23:59:00,OVIDIU (CT) - ,Reabilitare pod pe DN 2A Ovidiu,"Circulatia rutiera este restrictionata pe un sens de mers. Pe celalalt sens de mers, circulatia se desfasoara in ambele sensuri, pe cate o banda.",DN2A,"['196', '739', '196', '739']"
6.38,DN3B,88+325,96+732,2023-03-03 14:00:00,2023-12-01 23:59:00,VLADENI (IL) - GURA IALOMITEI (IL),Reparatii sistem rutier,"Circulatia se desfasoara pe 1 banda,  alternativ, in ambele sensuri. Viteza este restrictionata la 40 km/h.",DN3B,"['88', '325', '96', '732']"
6.39,DN5,52+346,52+346,2023-09-13 17:18:00,2023-12-22 16:00:00,DAIA (GR) - ,Lucrari de intretinere la pasajul peste CF Daia,"Sensul de deplasare Bucuresti-Giurgiu se va inchide pe sectorul cuprins intre km 52+014 si km 52+730, traficul desfasurandu-se deviat, in ambele directii, pe cate o banda pe celalalt sens.",DN5,"['52', '346', '52', '346']"
6.4,DN57,62+000,65+800,2023-06-09 09:01:00,2023-09-29 23:59:00,COZLA (CS) - COZLA (CS),Consolidare versant .,Varianta de serviciu locala.Circulatie rutiera dirijata cu semafoare pe 1/2 cale.,DN57,"['62', '0', '65', '800']"
6.41,DN64,42+000,44+000,2023-09-26 08:00:00,2023-09-26 15:00:00,PLESOIU (OT) - ,Se lucreaza la montat borne HM.,"Circulatia rutiera se desfasoara ingreunat in ambele sensuri, in zona unde se monteaza borne, se asigura o latime minima de 5.50 m.",DN64,"['42', '0', '44', '0']"
6.42,DN64,24+000,28+000,2023-09-26 08:00:00,2023-09-26 15:00:00,BRANCOVENI (OT) - PIATRA-OLT (OT),Se lucreaza la montat borne HM.,"Circulatia ingreunata in zona unde se monteaza borne , se circula in ambele sensuri cu asigurarea unei latimi minime de 5,50 m .",DN64,"['24', '0', '28', '0']"
6.43,DN65,42+000,48+000,2023-09-26 07:00:00,2023-09-26 15:00:00,GANEASA (OT) - SLATINA (OT),Se lucreaza la cosit mecanic.,"Circulatia rutiera se desfasoara ingreunat, viteza mica de deplasare a utilajului.",DN65,"['42', '0', '48', '0']"
6.44,DN66,16+000,17+000,2023-09-23 08:00:00,2023-09-26 16:00:00,PLOPSORU (GJ) - ,Se lucreaza la reabilitare conducta alimentare cu apa.,"Circulatia se desfasoara ingreunat pe 1/2 cale, dirijata cu piloti de circulatie si semaforizare.",DN66,"['16', '0', '17', '0']"
6.45,DN67,149+000,167+500,2023-09-25 08:00:00,2023-09-26 18:00:00,HOREZU (VL) - PIETRARI (PIETRARI) (VL),Se lucreaza la aplicare marcaje rutiere.,Circulatia rutiera se desfasoara ingreunat pe ambele sensuri de mers .,DN67,"['149', '0', '167', '500']"
6.46,DN67B,54+000,69+000,2023-09-26 08:00:00,2023-09-26 16:00:00,GRADISTEA (VL) - ZATRENI (VL),Se lucreaza la completari acostamente.,"Circulatia se desfasoara ingreunat pe 1/2 cale, dirijata cu piloti de circulatie.",DN67B,"['54', '0', '69', '0']"
6.47,DN67B,3+000,13+000,2023-09-23 08:00:00,2023-09-26 16:00:00,TARGU CARBUNESTI (GJ) - ,Se lucreaza la canalizare si alimentare cu apa .,"Circulatia rutiera se desfasoara ingreunat pe 1/2 cale, dirijata cu piloti de circulatie si semaforizare.",DN67B,"['3', '0', '13', '0']"
6.48,DN68A,2+900,53+000,2023-09-05 10:00:00,2023-09-30 17:00:00,LUGOJ (TM) - COSEVITA (TM),"Eveniment rutier- Lucrari de intretinere curenta parte carosabila pe DN68A km 2+900-53+00  Lugoj -Cosevita,circulatia se va desfasura ingreunata pe o singura banda de circulatie,evenimentul rutier  va dura din 05.09.23-30.09.23.",,DN68A,"['2', '900', '53', '0']"
6.49,DN69,10+053,10+053,2023-03-22 08:00:00,2023-11-21 23:59:00,SANANDREI (TM) - SANANDREI (TM),Lucrari de interventie la pod.,"Circulatia rutiera se desfasoara ingreunat pe 1/2 din cale, semaforizat.",DN69,"['10', '53', '10', '53']"
6.5,DN7,159+700,174+870,2023-09-25 08:00:00,2023-09-26 18:00:00,MILCOIU (VL) - RAMNICU VALCEA (VL),Se lucreaza la aplicare marcaje rutiere.,Circulatia rutiera se desfasoara ingreunat pe ambele sensuri de mers.,DN7,"['159', '700', '174', '870']"
6.51,DN7,117+850,117+850,2023-05-14 00:00:00,2023-12-30 18:00:00, - ,Pasaj peste DN 7 si nod rutier Bascov respectiv lucrari Autostrada Curtea de Arges - Pitesti.,"Devierea circulatiei de pe calea 1 pe calea 2 si inceperea lucrarilor. Devierea va avea loc in zona cuprinsa intre km 118+520 pana la km 120+060, unde se face legatura cu drumul national DN 7, prin intersectia de tip giratoriu. Circulatia se va desfasura in ambele sensuri de deplasare prin centrul insulei, avand separatoare de sensuri realizate din parapete lestabil, marcaje rutiere de ghidare si balize directionale fara acces de intrare pe autostrada din Str.Depozitelor, astfel urmand ca autovehiculele care vor circula pe DN 7 (fosta centura) vor urma traseul conform indicatoarelor de orientare/informare (Presemnalizarea directiilor intr-o intersectie cu sens giratoriu , Presemnalizarea directiilor la o intersectie cu drumuri ) instalate pana in sensul giratoriu al intersetiei DN 7 cu DN 7C Bascov, de unde se vor intoarce pe sensul de intrare pe autostrada.Devierea circulatiei de pe calea 1 pe calea 2 va fi mentinuta pana la realizarea variantei provizorii.Pe sectorul A1 mentionat circulatia se va desfasura astfel:pe sensul de deplasare spre Bucuresti traficul se va desfasura pe banda de urgenta a caii 2, fiind asigurata o latime de 3,00 metripe sensul de deplasare catre Ramnicu Valcea traficul se va desfasura pe doua benzi, asigurandu-se o latime minima de 3,00 m pentru fiecare dintre acesteasepararea sensurilor de deplasare se va realiza cu balize unidiretionale, completate cu lampi cu lumina galbena intermitentaIntersectia DN7/Strada Serelor - Autostrada A1 - si DN 7/Strada Depozitelor va fi reconfigurata.",DN7,"['117', '850', '117', '850']"
6.52,DN7,160+000,161+000,2023-09-26 08:00:00,2023-09-26 18:00:00,MILCOIU (VL) - ,Se lucreaza la frezare si asternere mixtura asfaltica .,"Circulatia se desfasoara ingreunat pe 1/2 cale, dirijata cu piloti de circulatie.",DN7,"['160', '0', '161', '0']"
6.53,DN79,80+000,108+445,2023-09-11 08:00:00,2023-11-10 20:00:00,SALONTA (BH) - NOJORID (BH),Lucrari de intretinere periodica pe timp de vara - Straturi bituminoase foarte subtiri executate la rece.,Se circula alternativ dirijat in zona sectorului de lucru.,DN79,"['80', '0', '108', '445']"
6.54,DN7A,46+000,47+000,2023-09-25 08:00:00,2023-09-26 16:00:00,VOINEASA (VL) - VIDRA (VL),Se lucreaza la taierea arborilor  periculosi pentru siguranta circulatiei.,"Circulatia rutiera se inchide/deschide in reprize de max. 20 minute, dirijata de piloti de circulatie.",DN7A,"['46', '0', '47', '0']"
