coords,culoare,raza,name,Judet,UAT,Localitati,Km,Cauza,Masuri de remediere,lat,long,date_start,date_end,km_start,km_end,Tip Lucrari,Variante de ocolire
"[21.56928849, 44.84466772]",0,7,Circulatie ingreunata  DN57,CS;,Pojejena;,MOLDOVA NOUA (CS) - ORAVITA (CS),122+900 - 122+930,"Cedare zid de sprijin, iar circulatia rutiera se va desfasura cu restrictie de tonaj de maxim 7,5 tone.","Ruta ocolitoare:
- DN 57 Oravita - DN 57 B Iablanita - DN 6 Orsova - DN 57 Moldova Noua si retur.",21.56928849,44.84466772,04-01-2024 10:00,02-02-2024 15:00,122+900,122+930,,
"[25.99580569, 47.14375187]",0,7,Circulatie ingreunata  DN15B,NT;,Poiana Teiului;,PETRU VODA (NT) - PETRU VODA (NT),7+280,Placa carosabila de beton a cedat intre grinzile principale ale podului.,"Circulatia este deschisa pe un fir alternativ si dirijat,pentru toate categoriile de autovehicule.",25.99580569,47.14375187,01-08-2023 18:20,31-12-2024 23:00,,,,
"[22.98856251, 44.836698]",0,7,Circulatie ingreunata  DN67,GJ;,Motru;,MOTRU (GJ) -,44+560,Ploi abundente. Aparare mal + pereu protectie partea stanga afectate din cauza ploilor abundente.,"Circulatia rutiera se desfasoara ingreunat, restrictie de viteza pe pod la 30 km/h.",22.98856251,44.836698,17-06-2023 00:00,31-01-2024 23:59,,,,
"[21.73675427, 45.04825724]",0,7,Circulatie ingreunata  DN57B,CS;,Oravița;,ORAVITA (CS) - ORAVITA (CS),4+950,"In urma ploilor abundente, s-a produs o alunecare de teren.","Circulatia rutiera este ingreunata pe 1/2 cale, pana la data de 31.01.2024, ora 12:00.",21.73675427,45.04825724,04-07-2023 21:00,31-01-2024 12:00,,,,
"[27.7300639, 45.49997053]",2,7,Lucrari  DN25,GL;,Piscu;,PISCU (GL) - PISCU (GL),48+028,,,27.7300639,45.49997053,12-09-2023 07:00,31-12-2024 23:59,,,"Aviz restrictie tonaj de 7,5 tone nr: DRDP: 22345/11.09.2023, in baza Expertizei Tehnice nr 224/2021.","Circulatia se va desfasura astfel:
-Ruta 1 ocolitoare propusa:
> Autovehiculele, cu greutate mai mica sau egala cu 30 t, de pe DN2B din Municipiul Braila care doresc sa ajunga in Municipiul Tecuci vor urma ruta DN23 Focsani DN2 Tisita DN24 Tecuci. (Cu mentiunea ca pe DN 23 este in vigoare ...
<cite>*Pentru descrierea completa consultati sectiunea drumuri.</cite>"
"[24.30310059, 44.66260147]",1,10,Eveniment rutier  DN67B,OT;,Verguleasa;,DRAGASANI (VL) - POGANU (OT),119+236,"Podul peste raul Olt nu prezinta siguranta pentru autovehiculele cu MTMA > 7,5 TO .","Circulati a rutiera se desfasoara pe1/2 cale , dirijata prin semafoare. Ruta ocolitoare pentru autovehiculele cu MTMA > 7,5 TO - DN 64 - DJ 678C - DJ 678 - DN 67B.",24.30310059,44.66260147,01-01-2024 00:00,31-01-2024 23:59,,,,
