referent de specialitate,https://posturi.gov.ro/anunt/referent-de-specialitate-138/,UNIVERSITATEA DIN BUCURESTI,"Funcție contractuală, Instituții locale, Funcții de execuție","Publicat în: 6 septembrie,2024",Expiră in  20/09/2024,Bucureşti,https://posturi.gov.ro/?judet=Bucureşti,Permanent
"medic specialist, specialitatea oncologie medicală",https://posturi.gov.ro/anunt/medic-specialist-specialitatea-oncologie-medicala-7/,Spitalul Clinic Județean de Urgență Sibiu,"Funcție contractuală, Instituții județene, Funcții de execuție","Publicat în: 6 septembrie,2024",Expiră in  20/09/2024,Teleorman,https://posturi.gov.ro/?judet=Teleorman,Permanent
inspector (dispecer) SSD II,https://posturi.gov.ro/anunt/inspector-dispecer-ssd-ii-2/,SERVICIUL PUBLIC LOCAL DE TERMOFICARE BRAȘOV,"Funcție contractuală, Instituții locale, Funcții de execuție","Publicat în: 6 septembrie,2024",Expiră in  19/09/2024,Braşov,https://posturi.gov.ro/?judet=Braşov,Permanent
OCPI Ilfov,https://posturi.gov.ro/anunt/ocpi-ilfov/,OCPI Ilfov,"Funcție contractuală, Guvern și ministere, Funcții de execuție","Publicat în: 6 septembrie,2024",Expiră in  19/09/2024,Bucureşti,https://posturi.gov.ro/?judet=Bucureşti,Permanent
laborant debutant S,https://posturi.gov.ro/anunt/laborant-debutant-s-7/,Universitatea  „Alexandru Ioan Cuza” din Iasi,"Funcție contractuală, Instituții locale, Funcții de execuție","Publicat în: 6 septembrie,2024",Expiră in  19/09/2024,Iaşi,https://posturi.gov.ro/?judet=Iaşi,Permanent
Analist programator grad I S,https://posturi.gov.ro/anunt/analist-programator-grad-i-s/,Universitatea Alexandru Ioan Cuza din Iasi,"Funcție contractuală, Instituții locale, Funcții de execuție","Publicat în: 6 septembrie,2024",Expiră in  19/09/2024,Iaşi,https://posturi.gov.ro/?judet=Iaşi,Permanent
ASISTENT MEDICAL GENERALIST  LICENTIAT,https://posturi.gov.ro/anunt/asistent-medical-generalist-licentiat-2/,"Spitalul  Clinic  de  Recuperare, Cluj-Napoca, judetul Cluj","Funcție contractuală, Instituții locale, Funcții de execuție","Publicat în: 6 septembrie,2024",Expiră in  20/09/2024,Cluj,https://posturi.gov.ro/?judet=Cluj,Permanent
medic specialist medicina de familie,https://posturi.gov.ro/anunt/medic-specialist-medicina-de-familie-20/,Spitalul Municipal Prof Dr. Irinel Popescu Bailesti,"Funcție contractuală, Instituții locale, Funcții de execuție","Publicat în: 6 septembrie,2024",Expiră in  20/09/2024,Dolj,https://posturi.gov.ro/?judet=Dolj,Permanent
muncitor întreținere,https://posturi.gov.ro/anunt/muncitor-intretinere-87/,Școala Gimnazială Nr. 3 Suceava,"Funcție contractuală, Instituții locale, Funcții de execuție","Publicat în: 6 septembrie,2024",Expiră in  19/09/2024,Suceava,https://posturi.gov.ro/?judet=Suceava,Permanent
referent,https://posturi.gov.ro/anunt/referent-105/,"Direcția de Administrare a Domeniului Public și Privat și Alimentare cu Energie Termică Călimănești, județul Vâlcea","Funcție contractuală, Instituții locale, Funcții de execuție","Publicat în: 6 septembrie,2024",Expiră in  19/09/2024,Vâlcea,https://posturi.gov.ro/?judet=Vâlcea,Permanent
"Consilier juridic, Secretar PR, Inspector de specialitate, Expert",https://posturi.gov.ro/anunt/consilier-juridic-secretar-pr-inspector-de-specialitate-expert/,Filarmonica Banatul Timisoara,"Funcție contractuală, Instituții locale, Funcții de execuție","Publicat în: 6 septembrie,2024",Expiră in  20/09/2024,Timiş,https://posturi.gov.ro/?judet=Timiş,Permanent
Ingrijitor I M (ingrijitor curățenie),https://posturi.gov.ro/anunt/ingrijitor-i-m-ingrijitor-curatenie/,Școala Profesională Specială ”Sfânta Maria” Bistrița,"Funcție contractuală, Instituții locale, Funcții de execuție","Publicat în: 6 septembrie,2024",Expiră in  19/09/2024,Bistriţa-Năsăud,https://posturi.gov.ro/?judet=Bistriţa-Năsăud,Permanent
SEF SERVICIU IN CADRUL SERVICIULUI INTRETINERE LOCALA,https://posturi.gov.ro/anunt/sef-serviciu-in-cadrul-serviciului-intretinere-locala-2/,PRIMARIA ORAS TITU,"Funcție contractuală, Primării, Funcții de conducere","Publicat în: 6 septembrie,2024",Expiră in  19/09/2024,Dâmboviţa,https://posturi.gov.ro/?judet=Dâmboviţa,Permanent
Îngrijitoare de curățenie (26 posturi),https://posturi.gov.ro/anunt/ingrijitoare-de-curatenie-26-posturi-2/,Spitalul Clinic Județean de Urgență Sibiu,"Funcție contractuală, Instituții județene, Funcții de execuție","Publicat în: 6 septembrie,2024",Expiră in  20/09/2024,Sibiu,https://posturi.gov.ro/?judet=Sibiu,Permanent
"inspector de specialitate, grad profesional III, nivel studii S",https://posturi.gov.ro/anunt/inspector-de-specialitate-grad-profesional-iii-nivel-studii-s/,Centrul Județean de Cultură și Artă Olt,"Funcție contractuală, Instituții județene, Funcții de execuție","Publicat în: 6 septembrie,2024",Expiră in  19/09/2024,Olt,https://posturi.gov.ro/?judet=Olt,Permanent
INGRIJITOR GRADINITA,https://posturi.gov.ro/anunt/ingrijitor-gradinita-28/,SCOALA GIMNAZIALA DRAGOS VODA MOISEI,"Funcție contractuală, Instituții naționale, Funcții de execuție","Publicat în: 6 septembrie,2024",Expiră in  16/09/2024,Maramureş,https://posturi.gov.ro/?judet=Maramureş,Permanent
"Șef Centru, Asistent Social, Psiholog, Educator Specializat",https://posturi.gov.ro/anunt/sef-centru-asistent-social-psiholog-educator-specializat/,Direcția Generală de Asistență Socială și Protecția Copilului Ilfov,"Funcție contractuală, Instituții locale, Funcții de conducere,Funcții de execuție","Publicat în: 6 septembrie,2024",Expiră in  19/09/2024,Ilfov,https://posturi.gov.ro/?judet=Ilfov,Permanent
magaziner,https://posturi.gov.ro/anunt/magaziner-83/,"Liceul Tehnologic Constantin Brâncuşi, județul Cluj","Funcție contractuală, Instituții locale, Funcții de execuție","Publicat în: 6 septembrie,2024",Expiră in  19/09/2024,Cluj,https://posturi.gov.ro/?judet=Cluj,Permanent
DIRECTOR FINANCIAR CONTABIL,https://posturi.gov.ro/anunt/director-financiar-contabil-97/,"  SPITALUL CLINIC DE OBSTETRICA GINECOLOGIE DR.I.A.SBARCEA , judetul BRASOV","Funcție contractuală, Instituții locale, Funcții de conducere","Publicat în: 6 septembrie,2024",Expiră in  19/09/2024,Braşov,https://posturi.gov.ro/?judet=Braşov,Permanent
îngrijitor (Suprafete de curatenie – exterior),https://posturi.gov.ro/anunt/ingrijitor-suprafete-de-curatenie-exterior-2/,SPITALUL CLINIC JUDETEAN DE URGENTA BISTRITA,"Funcție contractuală, Instituții județene, Funcții de execuție","Publicat în: 6 septembrie,2024",Expiră in  13/09/2024,Bistriţa-Năsăud,https://posturi.gov.ro/?judet=Bistriţa-Năsăud,Temporar
îngrijitor,https://posturi.gov.ro/anunt/ingrijitor-1917/,"Colegiul Tehnic Gheorghe Asachi, Focșani, județul Vrancea","Funcție contractuală, Instituții locale, Funcții de execuție","Publicat în: 6 septembrie,2024",Expiră in  19/09/2024,Vrancea,https://posturi.gov.ro/?judet=Vrancea,Permanent
"Inginer la Serviciul EL,UCC,SCH",https://posturi.gov.ro/anunt/inginer-la-serviciul-eluccsch/,Sistemul de Gospodărire a Apelor Bacău,"Funcție contractuală, Instituții locale, Funcții de execuție","Publicat în: 6 septembrie,2024",Expiră in  20/09/2024,Bacău,https://posturi.gov.ro/?judet=Bacău,Permanent
Muncitor necalificat I,https://posturi.gov.ro/anunt/muncitor-necalificat-i-44/,Primăria oraşului Cisnădie,"Funcție contractuală, Primării, Funcții de execuție","Publicat în: 6 septembrie,2024",Expiră in  19/09/2024,Sibiu,https://posturi.gov.ro/?judet=Sibiu,Permanent
Îngrijitoare,https://posturi.gov.ro/anunt/ingrijitoare-449/,Spitalul Clinic C.F. Nr. 2 București,"Funcție contractuală, Instituții locale, Funcții de execuție","Publicat în: 6 septembrie,2024",Expiră in  20/09/2024,Bucureşti,https://posturi.gov.ro/?judet=Bucureşti,Permanent
"asistent medical de balneofizioterapie, masaj",https://posturi.gov.ro/anunt/asistent-medical-de-balneofizioterapie-masaj/,Spitalul Clinic Județean de Urgență Sibiu,"Funcție contractuală, Instituții județene, Funcții de execuție","Publicat în: 6 septembrie,2024",Expiră in  20/09/2024,Sibiu,https://posturi.gov.ro/?judet=Sibiu,Permanent
Director,https://posturi.gov.ro/anunt/director-32/,Administrația Națională ”Apele Române”,"Funcție contractuală, Instituții naționale, Funcții de conducere","Publicat în: 6 septembrie,2024",Expiră in  24/09/2024,Bucureşti,https://posturi.gov.ro/?judet=Bucureşti,Permanent
Asistent registrator principal debutant,https://posturi.gov.ro/anunt/asistent-registrator-principal-debutant-3/,OFICIUL DE CADASTRU SI PUBLICITATE IMOBILIARA CONSTANTA,"Funcție contractuală, Instituții județene, Funcții de execuție","Publicat în: 6 septembrie,2024",Expiră in  20/09/2024,Constanţa,https://posturi.gov.ro/?judet=Constanţa,Permanent
Expert implementare si accesare fonduri structurale si de coeziune europene,https://posturi.gov.ro/anunt/expert-implementare-si-accesare-fonduri-structurale-si-de-coeziune-europene/,Primaria comunei Crangu,"Funcție contractuală, Primării, Funcții de execuție","Publicat în: 6 septembrie,2024",Expiră in  18/09/2024,Teleorman,https://posturi.gov.ro/?judet=Teleorman,Temporar
Administrator patrimoniu,https://posturi.gov.ro/anunt/administrator-patrimoniu-231/,"Universitatea Națională de Arte ""George Enescu"" Iași","Funcție contractuală, Instituții naționale, Funcții de execuție","Publicat în: 6 septembrie,2024",Expiră in  19/09/2024,Iaşi,https://posturi.gov.ro/?judet=Iaşi,Permanent
Muncitor calificat IV-I/Formațiunea de cazarmare,https://posturi.gov.ro/anunt/muncitor-calificat-iv-i-formatiunea-de-cazarmare/,"Spitalul Militar de Urgenta ""Dr. Ion Jianu"" - Pitesti","Funcție contractuală, Unități militare, Funcții de execuție","Publicat în: 6 septembrie,2024",Expiră in  20/09/2024,Arges,https://posturi.gov.ro/?judet=Arges,Permanent
ASISTENTI MEDICALI,https://posturi.gov.ro/anunt/asistenti-medicali-26/,Institutul Regional de Gastroenterologie – Hepatologie “Prof. Dr. O. Fodor” Cluj Napoca ,"Funcție contractuală, Instituții regionale, Funcții de execuție","Publicat în: 6 septembrie,2024",Expiră in  27/09/2024,Cluj,https://posturi.gov.ro/?judet=Cluj,Permanent
ASISTENT MEDICAL GENERALIST PRINCIPAL SECTIA MEDICINA INTERNA,https://posturi.gov.ro/anunt/asistent-medical-generalist-principal-sectia-medicina-interna/,SPITAL ORASENESC SINAIA,"Funcție contractuală, Instituții locale, Funcții de execuție","Publicat în: 6 septembrie,2024",Expiră in  20/09/2024,Prahova,https://posturi.gov.ro/?judet=Prahova,Permanent
Sofer,https://posturi.gov.ro/anunt/sofer-250/,PALATUL COPIILOR IASI,"Funcție contractuală, Instituții județene, Funcții de execuție","Publicat în: 6 septembrie,2024",Expiră in  19/09/2024,Iaşi,https://posturi.gov.ro/?judet=Iaşi,Permanent
muncitor întreținere,https://posturi.gov.ro/anunt/muncitor-intretinere-84/,"Liceul Teoretic, Comuna Filipeștii de Pădure","Funcție contractuală, Instituții locale, Funcții de execuție","Publicat în: 6 septembrie,2024",Expiră in  20/09/2024,Prahova,https://posturi.gov.ro/?judet=Prahova,Permanent
Îngrijitor,https://posturi.gov.ro/anunt/ingrijitor-1893/,"Școala Gimnazială ”Octavian Goga” Cluj-Napoca , Cluj-Napoca,  județul Cluj","Funcție contractuală, Instituții locale, Funcții de execuție","Publicat în: 6 septembrie,2024",Expiră in  20/09/2024,Cluj,https://posturi.gov.ro/?judet=Cluj,Permanent
"consilier debutant, referent treapta I",https://posturi.gov.ro/anunt/consilier-debutant-referent-treapta-i/,OFICIUL DE CADASTRU ȘI PUBLICITATE IMOBILIARĂ  PRAHOVA,"Funcție contractuală, Instituții județene, Funcții de execuție","Publicat în: 6 septembrie,2024",Expiră in  20/09/2024,Prahova,https://posturi.gov.ro/?judet=Prahova,Permanent
muncitor  necalificat,https://posturi.gov.ro/anunt/muncitor-necalificat-220/,Spitalul Municipal Campulung Moldovenesc,"Funcție contractuală, Instituții locale, Funcții de execuție","Publicat în: 6 septembrie,2024",Expiră in  20/09/2024,Suceava,https://posturi.gov.ro/?judet=Suceava,Permanent
"Muncitor calificat M(I) (montator, reglor tehnică de calcul)",https://posturi.gov.ro/anunt/muncitor-calificat-mi-montator-reglor-tehnica-de-calcul-2/,UNIVERSITATEA NATIONAL DE EDUCATIE FIZICA SI SPORT DIN BUCURESTI,"Funcție contractuală, Instituții naționale, Funcții de execuție","Publicat în: 6 septembrie,2024",Expiră in  20/09/2024,Bucureşti,https://posturi.gov.ro/?judet=Bucureşti,Permanent
SUPRAVEGHETOR NOAPTE,https://posturi.gov.ro/anunt/supraveghetor-noapte-14/,LICEUL TEHNOLOGIC DE VEST,"Funcție contractuală, Instituții locale, Funcții de execuție","Publicat în: 6 septembrie,2024",Expiră in  24/09/2024,Timiş,https://posturi.gov.ro/?judet=Timiş,Permanent
casier,https://posturi.gov.ro/anunt/casier-96/,SCOALA NATIONALA DE STUDII POLITICE SI ADMINISTRATIVE,"Funcție contractuală, Instituții locale, Funcții de execuție","Publicat în: 6 septembrie,2024",Expiră in  20/09/2024,Bucureşti,https://posturi.gov.ro/?judet=Bucureşti,Permanent
paznic,https://posturi.gov.ro/anunt/paznic-508/,"Universitatea „1 Decembrie 1918” Alba Iulia, județul Alba","Funcție contractuală, Instituții locale, Funcții de execuție","Publicat în: 6 septembrie,2024",Expiră in  20/09/2024,Alba,https://posturi.gov.ro/?judet=Alba,Permanent
INGRIJITOARE  SI PORTAR,https://posturi.gov.ro/anunt/ingrijitoare-si-portar/,Institutul Regional de Gastroenterologie – Hepatologie “Prof. Dr. O. Fodor” Cluj Napoca ,"Funcție contractuală, Instituții regionale, Funcții de conducere","Publicat în: 6 septembrie,2024",Expiră in  20/09/2024,Cluj,https://posturi.gov.ro/?judet=Cluj,Temporar
administrator financiar grad I S,https://posturi.gov.ro/anunt/administrator-financiar-grad-i-s-10/,Universitatea  „Alexandru Ioan Cuza” din Iasi,"Funcție contractuală, Instituții locale, Funcții de execuție","Publicat în: 6 septembrie,2024",Expiră in  19/09/2024,Iaşi,https://posturi.gov.ro/?judet=Iaşi,Permanent
Artist instrumentist vioara I,https://posturi.gov.ro/anunt/artist-instrumentist-vioara-i-2/,Filarmonica Brașov,"Funcție contractuală, Instituții locale, Funcții de execuție","Publicat în: 6 septembrie,2024",Expiră in  19/09/2024,Braşov,https://posturi.gov.ro/?judet=Braşov,Permanent
Referent de specialitate debutant,https://posturi.gov.ro/anunt/referent-de-specialitate-debutant-55/,"Spitalul Clinic de Boli Infecţioase ""Sf.Parascheva"" Iaşi","Funcție contractuală, Consilii județene, Funcții de execuție","Publicat în: 6 septembrie,2024",Expiră in  20/09/2024,Iaşi,https://posturi.gov.ro/?judet=Iaşi,Permanent
Brancardier (4 posturi),https://posturi.gov.ro/anunt/brancardier-4-posturi-2/,Spitalul Clinic Județean de Urgență Sibiu,"Funcție contractuală, Instituții județene, Funcții de execuție","Publicat în: 6 septembrie,2024",Expiră in  20/09/2024,Sibiu,https://posturi.gov.ro/?judet=Sibiu,Permanent
Administrator financiar grad III S,https://posturi.gov.ro/anunt/administrator-financiar-grad-iii-s-10/,Universitatea Alexandru Ioan Cuza din Iasi,"Funcție contractuală, Instituții locale, Funcții de execuție","Publicat în: 6 septembrie,2024",Expiră in  19/09/2024,Iaşi,https://posturi.gov.ro/?judet=Iaşi,Permanent
Ingrijitor,https://posturi.gov.ro/anunt/ingrijitor-1921/,"Liceul Tehnologic Administrativ și de Servicii"" Victor Slăvescu"" Municipiul Ploiești ","Funcție contractuală, Instituții locale, Funcții de execuție","Publicat în: 6 septembrie,2024",Expiră in  13/09/2024,Prahova,https://posturi.gov.ro/?judet=Prahova,Temporar
șofer,https://posturi.gov.ro/anunt/sofer-253/,"Comuna Rădășeni, județul Suceava","Funcție contractuală, Primării, Funcții de execuție","Publicat în: 6 septembrie,2024",Expiră in  19/09/2024,Suceava,https://posturi.gov.ro/?judet=Suceava,Permanent
Administrator financiar S(I) cu 1/2 norma,https://posturi.gov.ro/anunt/administrator-financiar-si-cu-1-2-norma/,UNIVERSITATEA NATIONAL DE EDUCATIE FIZICA SI SPORT DIN BUCURESTI,"Funcție contractuală, Instituții naționale, Funcții de execuție","Publicat în: 6 septembrie,2024",Expiră in  20/09/2024,Bucureşti,https://posturi.gov.ro/?judet=Bucureşti,Permanent
asistent medical principal generalist,https://posturi.gov.ro/anunt/asistent-medical-principal-generalist-7/,Spitalul Clinic de Ortopedie Traumatologie si TBC Osteoarticular FOISOR,"Funcție contractuală, Instituții locale, Funcții de execuție","Publicat în: 6 septembrie,2024",Expiră in  19/09/2024,Bucureşti,https://posturi.gov.ro/?judet=Bucureşti,Permanent
"Administrator financiar, informatician, secretar",https://posturi.gov.ro/anunt/administrator-financiar-informatician-secretar/,Școala gimnazială nr. 1 Pantelimon,"Funcție contractuală, Instituții naționale, Funcții de execuție","Publicat în: 6 septembrie,2024",Expiră in  24/09/2024,Ilfov,https://posturi.gov.ro/?judet=Ilfov,Nespecificat
Brancardier,https://posturi.gov.ro/anunt/brancardier-53/,"Spitalul Județean de Urgență Alexandria, judetul Teleorman","Funcție contractuală, Instituții județene, Funcții de execuție","Publicat în: 6 septembrie,2024",Expiră in  20/09/2024,Teleorman,https://posturi.gov.ro/?judet=Teleorman,Permanent
REFERENT I,https://posturi.gov.ro/anunt/referent-i-11/,SERVICIUL DE AMBULANTA JUDETEAN GORJ,"Funcție contractuală, Instituții județene, Funcții de execuție","Publicat în: 6 septembrie,2024",Expiră in  20/09/2024,Gorj,https://posturi.gov.ro/?judet=Gorj,Permanent
supraveghetor de noapte,https://posturi.gov.ro/anunt/supraveghetor-de-noapte-37/,Colegiul Ortodox ”Mitropolitul Nicolae Colan” Cluj-Napoca,"Alte functii, Instituții locale, Funcții de execuție","Publicat în: 6 septembrie,2024",Expiră in  19/09/2024,Cluj,https://posturi.gov.ro/?judet=Cluj,Permanent
Analist programator debutant S,https://posturi.gov.ro/anunt/analist-programator-debutant-s-2/,Universitatea Alexandru Ioan Cuza din Iasi,"Funcție contractuală, Instituții locale, Funcții de execuție","Publicat în: 6 septembrie,2024",Expiră in  19/09/2024,Iaşi,https://posturi.gov.ro/?judet=Iaşi,Permanent
medic specialist pneumologie,https://posturi.gov.ro/anunt/medic-specialist-pneumologie-10/,Spitalul Municipal Prof Dr. Irinel Popescu Bailesti,"Funcție contractuală, Instituții locale, Funcții de execuție","Publicat în: 6 septembrie,2024",Expiră in  20/09/2024,Dolj,https://posturi.gov.ro/?judet=Dolj,Permanent
"administrator financiar, 0.5 normă",https://posturi.gov.ro/anunt/administrator-financiar-0-5-norma-7/,"Colegiul ”Emil Negruțiu”, cu sediul în Turda","Funcție contractuală, Instituții locale, Funcții de execuție","Publicat în: 6 septembrie,2024",Expiră in  19/09/2024,Cluj,https://posturi.gov.ro/?judet=Cluj,Permanent
INGRIJITOR,https://posturi.gov.ro/anunt/ingrijitor-1913/,Grădiniţa cu Program Prelungit „Bucuria Copiilor” Mediaş,"Funcție contractuală, Instituții locale, Funcții de execuție","Publicat în: 6 septembrie,2024",Expiră in  21/09/2024,Sibiu,https://posturi.gov.ro/?judet=Sibiu,Permanent
Muncitor calificat (fochist) I,https://posturi.gov.ro/anunt/muncitor-calificat-fochist-i-4/,SERVICIUL PUBLIC LOCAL DE TERMOFICARE BRAȘOV,"Funcție contractuală, Instituții locale, Funcții de execuție","Publicat în: 6 septembrie,2024",Expiră in  19/09/2024,Braşov,https://posturi.gov.ro/?judet=Braşov,Permanent
REGIZOR ARTISTIC S/II,https://posturi.gov.ro/anunt/regizor-artistic-s-ii-2/,Teatrul „Mihai Eminescu” Botoșani ,"Funcție contractuală, Instituții locale, Funcții de execuție","Publicat în: 6 septembrie,2024",Expiră in  13/09/2024,Botoşani,https://posturi.gov.ro/?judet=Botoşani,Temporar
Asistent medical principal,https://posturi.gov.ro/anunt/asistent-medical-principal-56/,"Spitalul Județean de Urgență Alexandria, judetul Teleorman","Funcție contractuală, Instituții județene, Funcții de execuție","Publicat în: 6 septembrie,2024",Expiră in  20/09/2024,Teleorman,https://posturi.gov.ro/?judet=Teleorman,Permanent
Contabil șef,https://posturi.gov.ro/anunt/contabil-sef-125/,Muzeul Satului Bănățean Timișoara,"Funcție contractuală, Instituții județene, Funcții de conducere","Publicat în: 6 septembrie,2024",Expiră in  20/09/2024,Timiş,https://posturi.gov.ro/?judet=Timiş,Permanent
administrator financiar,https://posturi.gov.ro/anunt/administrator-financiar-543/,"Liceul de Arte „Victor Brauner”, Piatra Neamț, județul Neamț","Funcție contractuală, Instituții locale, Funcții de execuție","Publicat în: 6 septembrie,2024",Expiră in  19/09/2024,Neamţ,https://posturi.gov.ro/?judet=Neamţ,Permanent
posturi contractuale de executie,https://posturi.gov.ro/anunt/posturi-contractuale-de-executie-5/,SPITALUL CLINIC PROF DR.TH.BURGHELE,"Funcție contractuală, Instituții locale, Funcții de execuție","Publicat în: 6 septembrie,2024",Expiră in  20/09/2024,Bucureşti,https://posturi.gov.ro/?judet=Bucureşti,Permanent
"muncitor calificat, treapta I (LĂCĂTUȘ)",https://posturi.gov.ro/anunt/muncitor-calificat-treapta-i-lacatus/,Direcția Generală de Poliție Locală Sector 6,"Funcție contractuală, Instituții locale, Funcții de execuție","Publicat în: 6 septembrie,2024",Expiră in  23/09/2024,Bucureşti,https://posturi.gov.ro/?judet=Bucureşti,Permanent
Auditor I (S),https://posturi.gov.ro/anunt/auditor-i-s-5/,Universitatea Tehnica de Constructii Bucuresti,"Funcție contractuală, Instituții naționale, Funcții de execuție","Publicat în: 6 septembrie,2024",Expiră in  20/09/2024,Bucureşti,https://posturi.gov.ro/?judet=Bucureşti,Permanent
îngrijitor I M,https://posturi.gov.ro/anunt/ingrijitor-i-m-93/,"Școala Gimnazială Oar, județul Satu-Mare","Funcție contractuală, Instituții locale, Funcții de execuție","Publicat în: 6 septembrie,2024",Expiră in  19/09/2024,Satu Mare,https://posturi.gov.ro/?judet=Satu Mare,Permanent
îngrijitor I M,https://posturi.gov.ro/anunt/ingrijitor-i-m-92/,"Scoala Gimnaziala Vetiș, județul Satu Mare","Funcție contractuală, Instituții locale, Funcții de execuție","Publicat în: 6 septembrie,2024",Expiră in  19/09/2024,Satu Mare,https://posturi.gov.ro/?judet=Satu Mare,Permanent
"FUNCTII DE EXECUTIE – MEDICI SPECIALISTI SI ASISTENT CERCETARE, MEDIC REZIDENT AN V CU 0.5 NORMA",https://posturi.gov.ro/anunt/functii-de-executie-medici-specialisti-si-asistent-cercetare-medic-rezident-an-v-cu-0-5-norma/,Spitalul Clinic de Urgenţă Bagdasar - Arseni BUCURESTI,"Alte functii, Instituții locale, Funcții de execuție","Publicat în: 6 septembrie,2024",Expiră in  19/09/2024,Bucureşti,https://posturi.gov.ro/?judet=Bucureşti,Nespecificat
secretar I S,https://posturi.gov.ro/anunt/secretar-i-s-25/,"Școala Primară Bara, județul Timiș","Funcție contractuală, Instituții locale, Funcții de execuție","Publicat în: 6 septembrie,2024",Expiră in  19/09/2024,Timiş,https://posturi.gov.ro/?judet=Timiş,Permanent
Muncitor calificat II,https://posturi.gov.ro/anunt/muncitor-calificat-ii-24/,Institutul de Cercetare-Dezvoltare pentru Pomicultură Pitești-Mărăcineni,"Funcție contractuală, Instituții locale, Funcții de execuție","Publicat în: 6 septembrie,2024",Expiră in  20/09/2024,Arges,https://posturi.gov.ro/?judet=Arges,Temporar
secretar,https://posturi.gov.ro/anunt/secretar-328/,Universitatea Babes-Bolyai,"Funcție contractuală, Instituții locale, Funcții de execuție","Publicat în: 6 septembrie,2024",Expiră in  13/09/2024,Cluj,https://posturi.gov.ro/?judet=Cluj,Temporar
Bucatar,https://posturi.gov.ro/anunt/bucatar-177/,ȘCOALA GIMNAZIALĂ ”Explorator teodor gheorghe negoiță” sascut,"Funcție contractuală, Instituții locale, Funcții de execuție","Publicat în: 6 septembrie,2024",Expiră in  26/09/2024,Bacău,https://posturi.gov.ro/?judet=Bacău,Temporar
GUARD,https://posturi.gov.ro/anunt/guard-68/,"PRIMARIA COMUNEI VETRISOAIA, JUDETUL VASLUI","Funcție contractuală, Primării, Funcții de execuție","Publicat în: 6 septembrie,2024",Expiră in  19/09/2024,Vaslui,https://posturi.gov.ro/?judet=Vaslui,Permanent
SEF FORMATIE IN CADRUL SERVICIULUI PUBLIC DE ALIMENTARE CU APA SI CANALIZARE,https://posturi.gov.ro/anunt/sef-formatie-in-cadrul-serviciului-public-de-alimentare-cu-apa-si-canalizare/,Primaria Horodnic de Sus,"Funcție contractuală, Primării, Funcții de execuție","Publicat în: 6 septembrie,2024",Expiră in  19/09/2024,Suceava,https://posturi.gov.ro/?judet=Suceava,Permanent
Șef partidă oboi,https://posturi.gov.ro/anunt/sef-partida-oboi/,Filarmonica Brașov,"Funcție contractuală, Instituții locale, Funcții de execuție","Publicat în: 6 septembrie,2024",Expiră in  19/09/2024,Braşov,https://posturi.gov.ro/?judet=Braşov,Permanent
Îngrijitor,https://posturi.gov.ro/anunt/ingrijitor-1918/,"Şcoala Gimnazială ,,Andrei Şaguna""","Funcție contractuală, Instituții locale, Funcții de execuție","Publicat în: 6 septembrie,2024",Expiră in  9/09/2024,Harghita,https://posturi.gov.ro/?judet=Harghita,Temporar
"1 post paznic normă întreagă, 1 post muncitor 1/2 normă",https://posturi.gov.ro/anunt/1-post-paznic-norma-intreaga-1-post-muncitor-1-2-norma/,"Liceul Tehnologic „Horea” Marghita, județul Bihor","Funcție contractuală, Instituții locale, Funcții de execuție","Publicat în: 6 septembrie,2024",Expiră in  19/09/2024,Bihor,https://posturi.gov.ro/?judet=Bihor,Permanent
"Secretar școală 0,5 normă",https://posturi.gov.ro/anunt/secretar-scoala-05-norma-4/,"ȘCOALA GIMNAZIALĂ NR.1, COM. COLIBAȘI, JUD. GIURGIU","Funcție contractuală, Instituții locale, Funcții de execuție","Publicat în: 6 septembrie,2024",Expiră in  12/09/2024,Giurgiu,https://posturi.gov.ro/?judet=Giurgiu,Permanent
