NUMAR LUCRARE,JUDEȚ,ADRESA,DATA ÎNCEPERE,DATA FINALIZARE,zona
60822,VRANCEA,"Loc: VIDRA, Sat: CALIMANLoc: VIDRA, Sat: BURCALoc: TIFESTI, Sat: TIFESTILoc: VIDRA, Sat: VOLOSCANILoc: VIDRA, Sat: SERBESTILoc: VIDRA, Sat: IRESTI",17/09/2024 09:01,,MN
60821,PRAHOVA,"Loc: COCORASTII MISLII, Sat: COCORASTII MISLIILoc: COCORASTII MISLII, Sat: COCORASTII MISLII, Satul: TIPARESTILoc: GORUNA, Sat: GORUNA",17/09/2024 09:00,17/09/2024 15:00,MN
60820,GALATI,"Loc: MUNTENI, Sat: FRUNZEASCALoc: MUNTENI, Sat: TIGANESTILoc: MUNTENI, Sat: UNGURENI",17/09/2024 08:59,,MN
60818,GALATI,"Loc: COSTACHE NEGRI, Sat: COSTACHE NEGRI",16/09/2024 21:03,,MN
60815,GALATI,"Loc: CUZA VODA, Sat: CUZA VODA,  : CUZA VODA",15/09/2024 11:00,,MN
60749,BRAILA,"Loc: RACOVITA, Sat: CORBENI",14/09/2024 06:25,,MN
