NUMAR LUCRARE,JUDEȚ,ADRESA,DATA ÎNCEPERE,DATA FINALIZARE,zona
61649,BUZAU,"Loc: BUZAU, Sat: BUZAU, Bd.: BALCESCU NICOLAE",16/10/2024 15:21,,MN
61648,PRAHOVA,"Loc: PLOIESTI, Sat: PLOIESTI, Str.: SONDELORLoc: PLOIESTI, Sat: PLOIESTI, Str.: CRAZNALoc: PLOIESTI, Sat: PLOIESTI, Str.: PENES CURCANULLoc: PLOIESTI, Sat: PLOIESTI, Str.: DIMBOVITALoc: PLOIESTI, Sat: PLOIESTI, Str.: TORCATORILoc: PLOIESTI, Sat: PLOIESTI, Str.: ALBINEILoc: PLOIESTI, Sat: PLOIESTI, Str.: DAVILA CAROL, DOCTORLoc: PLOIESTI, Sat: PLOIESTI, Str.: MARASESTILoc: PLOIESTI, Sat: PLOIESTI, Str.: DOMNISORILoc: PLOIESTI, Sat: PLOIESTI, Str.: RUDULUI",16/10/2024 15:00,,MN
61647,BUZAU,"Loc: TISAU, Sat: VALEA SALCIILOR, Satul: VALEA SALCIILOR",16/10/2024 13:30,16/10/2024 16:00,MN
61646,GALATI,"Loc: FRUMUSITA, Sat: IJDILENILoc: TULUCESTI, Sat: TATARCALoc: TULUCESTI, Sat: SIVITALoc: FRUMUSITA, Sat: FRUMUSITALoc: TULUCESTI, Sat: TULUCESTI",16/10/2024 13:59,,MN
61645,BRAILA,"Loc: BRAILA, Sat: BRAILA, Str.: DELAVRANCEA  BARBU STEFANESCULoc: BRAILA, Sat: BRAILA, Str.: VLAHUTA ALEXANDRU",16/10/2024 14:10,16/10/2024 16:00,MN
61643,PRAHOVA,"Loc: RAFOV, Sat: MOARA DOMNEASCA",16/10/2024 10:20,,MN
61640,GALATI,"Loc: CAVADINESTI, Sat: RUGINENI",16/10/2024 11:00,,MN
