NUMAR LUCRARE,JUDEȚ,ADRESA,DATA ÎNCEPERE,DATA FINALIZARE,zona
52370,PRAHOVA,"Loc: BLEJOI, Sat: PLOIESTIORILoc: BLEJOI, Sat: BLEJOILoc: BLEJOI, Sat: TANTARENI",15/01/2024 14:09,,MN
52369,BUZAU,"Loc: LUCIU, Sat: CARAGELE",15/01/2024 08:30,15/01/2024 15:00,MN
52366,BUZAU,"Loc: TINTESTI, Sat: MAXENU, Satul: MAXENU",15/01/2024 12:44,,MN
52364,BUZAU,"Loc: CALVINI, Sat: BASCENII DE SUS, Satul: BASCENII DE SUS",15/01/2024 10:53,15/01/2024 15:00,MN
52361,PRAHOVA,"Loc: BREAZA, Sat: BREAZA, Str.: STEFAN CEL MARELoc: BREAZA, Sat: BREAZA, Str.: GRIVITEI",15/01/2024 10:00,15/01/2024 15:00,MN
