NUMAR LUCRARE,JUDEȚ,ADRESA,DATA ÎNCEPERE,DATA FINALIZARE,zona
56075,PRAHOVA,"Loc: PAULESTI, Sat: COCOSESTI",15/05/2024 09:15,15/05/2024 09:45,MN
56074,BRAILA,"Loc: BRAILA, Sat: BRAILA, Str.: G-RAL GRIGORESCU EREMIA",15/05/2024 08:52,,MN
56072,BUZAU,"Loc: PARSCOV, Sat: PARSCOV",15/05/2024 08:33,15/05/2024 16:30,MN
56071,BUZAU,"Loc: RACOVITENI, Sat: RACOVITENI",15/05/2024 08:32,15/05/2024 14:00,MN
56070,DAMBOVITA,"Loc: MATASARU, Sat: MATASARU",15/05/2024 07:37,,MN
56067,GALATI,"Loc: GALATI, Sat: GALATI, Str.: RAZBOIENILoc: GALATI, Sat: GALATI, Str.: SEREI",14/05/2024 21:29,,MN
