NUMAR LUCRARE,JUDEȚ,ADRESA,DATA ÎNCEPERE,DATA FINALIZARE,zona
55645,BUZAU,"Loc: GREBANU, Sat: GREBANU",29/04/2024 15:32,29/04/2024 17:32,MN
55644,GALATI,"Loc: GALATI, Sat: GALATI, Str.: CALEA PRUTULUI",29/04/2024 14:47,,MN
55643,BUZAU,"Loc: BERCA, Sat: PACLELE",29/04/2024 14:21,29/04/2024 17:35,MN
55642,BUZAU,"Loc: BUDA, Sat: MUCESTI-DANULESTI",29/04/2024 14:00,29/04/2024 16:36,MN
55640,PRAHOVA,"Loc: BRAZI, Sat: BRAZI",29/04/2024 13:30,,MN
55637,PRAHOVA,"Loc: SIRNA, Sat: SIRNA",29/04/2024 13:30,,MN
55636,BRAILA,"Loc: BRAILA, Sat: BRAILA, Str.: PODULUI",29/04/2024 13:47,,MN
55630,PRAHOVA,"Loc: PLOPENI, Sat: PLOPENI",29/04/2024 11:00,29/04/2024 16:00,MN
55627,DAMBOVITA,"Loc: CRANGURILE, Sat: VOIA",29/04/2024 10:50,,MN
