NUMAR LUCRARE,JUDEȚ,ADRESA,DATA ÎNCEPERE,DATA FINALIZARE,zona
48728,DAMBOVITA,"Loc: TARGOVISTE, Sat: TARGOVISTE, Str.: I.AL.BRATESCU-VOINESTILoc: TARGOVISTE, Sat: TARGOVISTE, Str.: VASILE BLENDEA",12/09/2023 03:50,,MN
48727,BUZAU,"Loc: TOPLICENI, Sat: BABENILoc: TOPLICENI, Sat: DEDULESTILoc: BUDA, Sat: MUCESTI-DANULESTILoc: TOPLICENI, Sat: RADUCESTILoc: GREBANU, Sat: GREBANULoc: VALEA SALCIEI, Sat: VALEA SALCIEILoc: TOPLICENI, Sat: TOPLICENI",11/09/2023 23:04,,MN
48724,DAMBOVITA,"Loc: TITU, Sat: TITU, Str.: CUZA VODALoc: TITU, Sat: TITU, Str.: TITU TARG STEJARULUI",11/09/2023 20:52,,MN
48716,DAMBOVITA,"Loc: CREVEDIA, Sat: SAMURCASILoc: CREVEDIA, Sat: CREVEDIA",11/09/2023 14:45,,MN
48657,DAMBOVITA,"Loc: CONTESTI, Sat: BALTENI",08/09/2023 10:30,,MN
