NUMAR LUCRARE,JUDEȚ,ADRESA,DATA ÎNCEPERE,DATA FINALIZARE,zona
55184,DAMBOVITA,"Loc: POTLOGI, Sat: POTLOGI, Str.: MARGINE",16/04/2024 14:00,,MN
55182,DAMBOVITA,"Loc: TARGOVISTE, Sat: TARGOVISTE, Str.: DR. OPRESCU DUMITRULoc: TARGOVISTE, Sat: TARGOVISTE, Str.: TUDOR VLADIMIRESCU",16/04/2024 13:50,,MN
55180,GALATI,"Loc: TECUCI, Sat: TECUCI, Str.: DACIA",16/04/2024 12:50,,MN
55179,DAMBOVITA,"Loc: VARFURI, Sat: VARFURI",16/04/2024 12:45,,MN
55174,BUZAU,"Loc: SMEENI, Sat: SMEENI",16/04/2024 12:15,,MN
55157,GALATI,"Loc: BUCIUMENI, Sat: BUCIUMENI,  : BUCIUMENI",16/04/2024 09:09,,MN
55154,BUZAU,"Loc: NEHOIU, Sat: MLAJET",16/04/2024 07:02,,MN
55136,GALATI,"Loc: FOLTESTI, Sat: FOLTESTI,  : FOLTESTI",15/04/2024 13:12,,MN
