NUMAR LUCRARE,JUDEȚ,ADRESA,DATA ÎNCEPERE,DATA FINALIZARE,zona
55042,BUZAU,"Loc: RAMNICU SARAT, Sat: RAMNICU SARAT, Alee: INDUSTRIEI",11/04/2024 15:00,,MN
55038,BUZAU,"Loc: NAENI, Sat: FINTESTILoc: SAHATENI, Sat: SAHATENI",11/04/2024 13:01,,MN
55010,DAMBOVITA,"Loc: LUCIENI, Sat: RACIU",11/04/2024 08:00,11/04/2024 16:30,MN
55009,DAMBOVITA,"Loc: DRAGOMIRESTI, Sat: DRAGOMIRESTI",11/04/2024 08:00,11/04/2024 16:00,MN
55006,PRAHOVA,"Loc: PLOIESTI, Sat: PLOIESTI, Str.: CAMELIEI",11/04/2024 09:00,11/04/2024 16:00,MN
54999,GALATI,"Loc: BUCIUMENI, Sat: TECUCEL",10/04/2024 19:30,,MN
