NUMAR LUCRARE,JUDEȚ,ADRESA,DATA ÎNCEPERE,DATA FINALIZARE,zona
49451,VRANCEA,"Loc: PAULESTI, Sat: PAULESTI, Satul: PAULESTI",08/10/2023 09:09,,MN
49450,VRANCEA,"Loc: VRANCIOAIA, Sat: PLOSTINA, Satul: PLOSTINA",08/10/2023 09:08,,MN
49449,VRANCEA,"Loc: VIZANTEA-LIVEZI, Sat: VIZANTEA RAZASEASCA, Satul: VIZANTEA RAZASEASCA",08/10/2023 08:26,,MN
49448,VRANCEA,"Loc: SOVEJA, Sat: SOVEJA, Satul: SOVEJA",08/10/2023 08:23,,MN
49444,BUZAU,"Loc: BISOCA, Sat: SINDRILA, Satul: SINDRILALoc: BISOCA, Sat: BISOCA, Satul: BISOCALoc: BISOCA, Sat: PLESI, Satul: PLESI",08/10/2023 06:20,,MN
49429,BRAILA,"Loc: MAXINENI, Sat: CORBU NOU, Str.: CORBU NOU",07/10/2023 10:26,,MN
