NUMAR LUCRARE,JUDEȚ,ADRESA,DATA ÎNCEPERE,DATA FINALIZARE,zona
49188,PRAHOVA,"Loc: VALEA CALUGAREASCA, Sat: VALEA CALUGAREASCA, Str.: VALEA MANTEI",27/09/2023 21:00,,MN
49187,PRAHOVA,"Loc: NISTORESTI, Sat: NISTORESTI",27/09/2023 21:10,,MN
49186,BUZAU,"Loc: ZIDURI, Sat: LANURILE, Satul: LANURILE",27/09/2023 19:48,,MN
49182,BUZAU,"Loc: CATINA, Sat: CORBU, Satul: CORBU",27/09/2023 18:53,,MN
49173,DAMBOVITA,"Loc: LUDESTI, Sat: TELESTI",27/09/2023 13:00,,MN
49169,DAMBOVITA,"Loc: BEZDEAD, Sat: MAGURA, Str.: NISTORESTI",27/09/2023 12:20,,MN
49160,DAMBOVITA,"Loc: COJASCA, Sat: FANTANELE, Str.: BOSTAN",27/09/2023 08:40,,MN
49154,DAMBOVITA,"Loc: COJASCA, Sat: COJASCA",27/09/2023 04:59,,MN
49115,BUZAU,"Loc: BRADEANU, Sat: BRADEANU, Satul: BRADEANU",26/09/2023 14:35,,MN
