NUMAR LUCRARE,JUDEȚ,ADRESA,DATA ÎNCEPERE,DATA FINALIZARE,zona
50052,DAMBOVITA,"Loc: SOTANGA, Sat: SOTANGA, Str.: SOTANGA",26/10/2023 09:00,26/10/2023 16:00,MN
50051,BUZAU,"Loc: GHERASENI, Sat: CREMENEA",26/10/2023 09:00,26/10/2023 12:30,MN
50050,DAMBOVITA,"Loc: POTLOGI, Sat: ROMANESTI,  : ROMANESTILoc: POIANA, Sat: POIANA, Str.: POIANA",26/10/2023 09:00,26/10/2023 13:00,MN
50048,PRAHOVA,"Loc: GURA VADULUI, Sat: GURA VADULUI",26/10/2023 08:40,,MN
50047,DAMBOVITA,"Loc: COJASCA, Sat: FANTANELE, Str.: FANTANELE",26/10/2023 08:30,26/10/2023 16:00,MN
50046,PRAHOVA,"Loc: SALCIILE, Sat: SALCIILE",26/10/2023 08:30,,MN
50040,DAMBOVITA,"Loc: CORBII MARI, Sat: GROZAVESTI",25/10/2023 15:10,,MN
