NUMAR LUCRARE,JUDEȚ,ADRESA,DATA ÎNCEPERE,DATA FINALIZARE,zona
55158,GALATI,"Loc: GRIVITA, Sat: GRIVITA,  : GRIVITA",16/04/2024 09:15,16/04/2024 09:45,MN
55157,GALATI,"Loc: BUCIUMENI, Sat: BUCIUMENI,  : BUCIUMENI",16/04/2024 09:09,,MN
55156,DAMBOVITA,"Loc: DRAGOMIRESTI, Sat: MOGOSESTI",16/04/2024 09:00,16/04/2024 10:00,MN
55155,GALATI,"Loc: COROD, Sat: COROD,  : COROD",16/04/2024 07:43,,MN
55154,BUZAU,"Loc: NEHOIU, Sat: MLAJET",16/04/2024 07:02,,MN
55136,GALATI,"Loc: FOLTESTI, Sat: FOLTESTI,  : FOLTESTI",15/04/2024 13:12,,MN
