NUMAR LUCRARE,JUDEȚ,ADRESA,DATA ÎNCEPERE,DATA FINALIZARE,zona
54501,DAMBOVITA,"Loc: CONTESTI, Sat: BALTENILoc: CONTESTI, Sat: BALTENI, Str.: EROILOR",28/03/2024 17:30,,MN
54493,PRAHOVA,"Loc: PODENII NOI, Sat: PODENII NOI",28/03/2024 15:15,,MN
54490,DAMBOVITA,"Loc: LUDESTI, Sat: SCHEIU DE JOS",28/03/2024 14:55,,MN
54487,PRAHOVA,"Loc: SOTRILE, Sat: SOTRILE, Str.: PRINCIPALA",28/03/2024 14:17,,MN
54471,PRAHOVA,"Loc: BREAZA, Sat: BREAZA, Str.: FRUNZELORLoc: BREAZA, Sat: BREAZA, Str.: FRASINETULUI",28/03/2024 10:43,,MN
