NUMAR LUCRARE,JUDEȚ,ADRESA,DATA ÎNCEPERE,DATA FINALIZARE,zona
55798,PRAHOVA,"Loc: SINAIA, Sat: SINAIA",04/05/2024 21:15,,MN
55797,PRAHOVA,"Loc: ALBESTI-PALEOLOGU, Sat: CIOCENI",04/05/2024 21:00,,MN
55796,BUZAU,"Loc: CISLAU, Sat: SCARISOARA",04/05/2024 16:46,04/05/2024 22:52,MN
55794,DAMBOVITA,"Loc: BUTIMANU, Sat: BUTIMANULoc: BUTIMANU, Sat: LUCIANCALoc: BUTIMANU, Sat: UNGURENI",04/05/2024 19:55,,MN
55793,BUZAU,"Loc: ULMENI, Sat: CLONDIRU, Satul: CLONDIRU",04/05/2024 18:55,04/05/2024 22:00,MN
55792,BUZAU,"Loc: MIHAILESTI, Sat: MIHAILESTI, Satul: MIHAILESTI",04/05/2024 18:00,04/05/2024 21:36,MN
55785,DAMBOVITA,"Loc: CREVEDIA, Sat: COCANI",04/05/2024 17:30,,MN
55782,BUZAU,"Loc: PARSCOV, Sat: PARSCOV, Satul: PARSCOV",04/05/2024 17:00,04/05/2024 22:30,MN
