NUMAR LUCRARE,JUDEȚ,ADRESA,DATA ÎNCEPERE,DATA FINALIZARE,zona
48756,BUZAU,"Loc: BALTA ALBA, Sat: STAVARASTI, Satul: STAVARASTI",12/09/2023 14:03,12/09/2023 16:30,MN
48749,GALATI,"Loc: GALATI, Sat: GALATI, Str.: BLAJ",12/09/2023 10:45,,MN
48745,PRAHOVA,"Loc: PUCHENII MARI, Sat: PUCHENII MOSNENI, Str.: PUCHENII MOSNENILoc: PUCHENII MARI, Sat: PUCHENII MARI, Str.: PUCHENII MARILoc: PUCHENII MARI, Sat: PIETROSANI, Str.: PIETROSANILoc: BARCANESTI, Sat: PUSCASI, Str.: PUSCASILoc: BARCANESTI, Sat: ROMANESTI",12/09/2023 10:00,12/09/2023 16:00,MN
48730,PRAHOVA,"Loc: SINAIA, Sat: SINAIA, Str.: CALEA BUCURESTILoc: SINAIA, Sat: SINAIA, Str.: VALEA LARGALoc: SINAIA, Sat: SINAIA, Str.: CLABUCET",12/09/2023 08:00,12/09/2023 19:00,MN
48657,DAMBOVITA,"Loc: CONTESTI, Sat: BALTENI",08/09/2023 10:30,,MN
59676,BIHOR,"Loc: ORADEA, Strada: PODGORIA",12/09/2023 15:16,12/09/2023 18:19,TN
59675,CLUJ,"Loc: TURDA, Strada: TINERETULUI",12/09/2023 12:00,12/09/2023 17:00,TN
59674,CLUJ,"Loc: CLUJ-NAPOCA, Strada: VALEA SEACALoc: BACIU, Strada: PRINCIPALALoc: BACIU, Sat: POPESTI, Strada: PRINCIPALA",12/09/2023 13:45,12/09/2023 17:00,TN
59672,SATU MARE,"Loc: VIILE SATU MARE, Strada: IEPURILORLoc: VIILE SATU MARE, Strada: PRINCIPALALoc: VIILE SATU MARE, Strada: TATARESTI",12/09/2023 13:39,12/09/2023 16:39,TN
