NUMAR LUCRARE,JUDEȚ,ADRESA,DATA ÎNCEPERE,DATA FINALIZARE,zona
49605,BUZAU,"Loc: VADU PASII, Sat: FOCSANEI, Satul: FOCSANEI",11/10/2023 13:01,11/10/2023 18:00,MN
49604,DAMBOVITA,"Loc: VLADENI, Sat: VLADENI",11/10/2023 14:05,,MN
49602,BRAILA,"Loc: BRAILA, Sat: BRAILA, Str.: SOSEAUA DE CENTURALoc: BRAILA, Sat: BRAILA, Str.: MIRCEA VODA",11/10/2023 13:25,,MN
49587,DAMBOVITA,"Loc: MATASARU, Sat: POROINICA",11/10/2023 09:00,11/10/2023 16:00,MN
49429,BRAILA,"Loc: MAXINENI, Sat: CORBU NOU, Str.: CORBU NOU",07/10/2023 10:26,,MN
