NUMAR LUCRARE,JUDEȚ,ADRESA,DATA ÎNCEPERE,DATA FINALIZARE,zona
50317,BUZAU,"Loc: CISLAU, Sat: GURA BISCEI",04/11/2023 08:00,,MN
50316,BRAILA,"Loc: TRAIAN, Sat: TRAIANLoc: UNIREA, Sat: UNIREALoc: MOVILA MIRESII, Sat: MOVILA MIRESIILoc: TRAIAN, Sat: URLEASCALoc: TUDOR VLADIMIRESCU, Sat: COMANEASCA",04/11/2023 08:12,,MN
50315,GALATI,"Loc: CAVADINESTI, Sat: CAVADINESTI",04/11/2023 07:10,,MN
50314,DAMBOVITA,"Loc: ULIESTI, Sat: ULIESTI",04/11/2023 04:12,,MN
50313,DAMBOVITA,"Loc: TARTASESTI, Sat: TARTASESTI",04/11/2023 03:40,,MN
