NUMAR LUCRARE,JUDEȚ,ADRESA,DATA ÎNCEPERE,DATA FINALIZARE,zona
49174,VRANCEA,"Loc: TAMBOESTI, Sat: TAMBOESTI",27/09/2023 15:00,27/09/2023 16:30,MN
49173,DAMBOVITA,"Loc: LUDESTI, Sat: TELESTI",27/09/2023 13:00,,MN
49171,BUZAU,"Loc: PADINA, Sat: PADINA, Satul: PADINA",27/09/2023 14:22,,MN
49170,BUZAU,"Loc: BERCA, Sat: JOSENI, Satul: JOSENI",27/09/2023 14:15,27/09/2023 16:37,MN
49169,DAMBOVITA,"Loc: BEZDEAD, Sat: MAGURA, Str.: NISTORESTI",27/09/2023 12:20,,MN
49160,DAMBOVITA,"Loc: COJASCA, Sat: FANTANELE, Str.: BOSTAN",27/09/2023 08:40,,MN
49154,DAMBOVITA,"Loc: COJASCA, Sat: COJASCA",27/09/2023 04:59,,MN
49115,BUZAU,"Loc: BRADEANU, Sat: BRADEANU, Satul: BRADEANU",26/09/2023 14:35,,MN
