NUMAR LUCRARE,JUDEȚ,ADRESA,DATA ÎNCEPERE,DATA FINALIZARE,zona
50431,PRAHOVA,"Loc: BREAZA, Sat: BREAZA, Str.: CAPRIOARELORLoc: BREAZA, Sat: BREAZA, Str.: FRUNZELOR",07/11/2023 13:15,07/11/2023 15:30,MN
50428,PRAHOVA,"Loc: FILIPESTII DE TARG, Sat: BRATASANCA, Str.: PRINCIPALALoc: FILIPESTII DE TARG, Sat: BRATASANCA, Str.: NUCI",07/11/2023 09:00,07/11/2023 15:00,MN
50427,BUZAU,"Loc: SARULESTI, Sat: VALEA LARGALoc: SARULESTI, Sat: SARULESTILoc: SARULESTI, Sat: VALEA STINEILoc: VINTILA VODA, Sat: VINTILA VODA",07/11/2023 10:45,07/11/2023 16:03,MN
50426,BUZAU,"Loc: BISOCA, Sat: SARILELoc: BISOCA, Sat: BALTAGARI",07/11/2023 10:00,07/11/2023 16:00,MN
50423,BRAILA,"Loc: ZAVOAIA, Sat: ZAVOAIA",07/11/2023 09:11,07/11/2023 15:30,MN
50422,DAMBOVITA,"Loc: TATARANI, Sat: GHEBOIENI",07/11/2023 09:00,07/11/2023 15:00,MN
50356,BRAILA,"Loc: VICTORIA, Sat: VICTORIA",05/11/2023 13:01,,MN
