NUMAR LUCRARE,JUDEȚ,ADRESA,DATA ÎNCEPERE,DATA FINALIZARE,zona
49751,DAMBOVITA,"Loc: CONTESTI, Sat: MERENILoc: CORNATELU, Sat: CORNATELULoc: COBIA, Sat: CALUGARENILoc: CORNATELU, Sat: CORNI",16/10/2023 15:25,,MN
49750,DAMBOVITA,"Loc: CIOCANESTI, Sat: CIOCANESTI",16/10/2023 15:02,,MN
49749,VRANCEA,"Loc: FOCSANI, Sat: FOCSANI, Str.: PICTOR GRIGORESCULoc: FOCSANI, Sat: FOCSANI, Str.: DORNEILoc: FOCSANI, Sat: FOCSANI, Str.: PANDURI",16/10/2023 14:55,,MN
49748,PRAHOVA,"Loc: SINAIA, Sat: SINAIA, Str.: TOPORASILORLoc: SINAIA, Sat: SINAIA, Str.: PLATOU IZVORLoc: SINAIA, Sat: SINAIA, Str.: GHIOCEILOR",16/10/2023 14:20,16/10/2023 16:00,MN
49746,DAMBOVITA,"Loc: TARTASESTI, Sat: GULIA",16/10/2023 13:45,,MN
49737,PRAHOVA,"Loc: MANECIU, Sat: MANECIU PAMINTENI, Str.: PODISOR",16/10/2023 10:40,,MN
49732,PRAHOVA,"Loc: SALCIILE, Sat: SALCIILE",16/10/2023 09:20,16/10/2023 16:00,MN
49724,BRAILA,"Loc: BRAILA, Sat: BRAILA, Str.: ALDEA SANDU",16/10/2023 08:00,,MN
