NUMAR LUCRARE,JUDEȚ,ADRESA,DATA ÎNCEPERE,DATA FINALIZARE,zona
61585,DAMBOVITA,"Loc: COMISANI, Sat: LAZURI, Str.: COMISANILOR",14/10/2024 09:35,,MN
61584,DAMBOVITA,"Loc: BALENI, Sat: BALENI SARBI",14/10/2024 09:00,14/10/2024 12:30,MN
61583,DAMBOVITA,"Loc: GURA OCNITEI, Sat: SACUIENI",14/10/2024 09:00,14/10/2024 16:00,MN
61582,DAMBOVITA,"Loc: GURA OCNITEI, Sat: ADANCA",14/10/2024 09:00,14/10/2024 12:30,MN
61581,PRAHOVA,"Loc: PLOIESTI, Sat: PLOIESTI, Str.: PETROLULUI",14/10/2024 09:10,14/10/2024 10:30,MN
61578,PRAHOVA,"Loc: CEPTURA, Sat: CEPTURA-DE-SUS",14/10/2024 04:40,,MN
