NUMAR LUCRARE,JUDEȚ,ADRESA,DATA ÎNCEPERE,DATA FINALIZARE,zona
60991,PRAHOVA,"Loc: SINAIA, Sat: SINAIA, Str.: TRANDAFIRILORLoc: SINAIA, Sat: SINAIA, Str.: MIHAI HARETLoc: SINAIA, Sat: SINAIA, Str.: TISEI",24/09/2024 15:25,,MN
60985,BRAILA,"Loc: SALCIA TUDOR, Sat: OLANEASCALoc: SALCIA TUDOR, Sat: GULIANCA",24/09/2024 08:00,24/09/2024 16:30,MN
60982,GALATI,"Loc: GALATI, Sat: GALATI, Str.: BRAILEI",24/09/2024 09:55,24/09/2024 16:00,MN
60977,BUZAU,"Loc: BUZAU, Sat: BUZAU, Str.: ZEFIRULUILoc: BUZAU, Sat: BUZAU, Str.: VARGA ECATERINALoc: BUZAU, Sat: BUZAU, Str.: NUFARULUILoc: BUZAU, Sat: BUZAU, Str.: RADULESCU HELIADE ION",24/09/2024 09:00,24/09/2024 17:30,MN
60749,BRAILA,"Loc: RACOVITA, Sat: CORBENI",14/09/2024 06:25,,MN
