NUMAR LUCRARE,JUDEȚ,ADRESA,DATA ÎNCEPERE,DATA FINALIZARE,zona
61036,VRANCEA,"Loc: VANATORI, Sat: MIRCESTII NOILoc: VANATORI, Sat: PETRESTILoc: VANATORI, Sat: VANATORILoc: GAROAFA, Sat: PRECISTANU",26/09/2024 15:31,,MN
61035,GALATI,"Loc: NICORESTI, Sat: NICORESTI",26/09/2024 14:15,,MN
61033,DAMBOVITA,"Loc: RACARI, Sat: COLACU",26/09/2024 13:30,26/09/2024 17:30,MN
61031,DAMBOVITA,"Loc: CREVEDIA, Sat: SAMURCASI",26/09/2024 12:20,,MN
61027,PRAHOVA,"Loc: ARICESTII RAHTIVANI, Sat: NEDELEA, Str.: PRINCIPALALoc: ARICESTII RAHTIVANI, Sat: NEDELEA, Str.: VALEA MORII",26/09/2024 10:00,26/09/2024 16:00,MN
61025,BRAILA,"Loc: SALCIA TUDOR, Sat: CUZA VODA (SALCIA TUDOR)",26/09/2024 09:00,26/09/2024 16:00,MN
61003,BRAILA,"Loc: BRAILA, Sat: BRAILA, Str.: PANCIU",25/09/2024 09:30,,MN
