NUMAR LUCRARE,JUDEȚ,ADRESA,DATA ÎNCEPERE,DATA FINALIZARE,zona
48961,PRAHOVA,"Loc: MISLEA, Sat: MISLEA, Str.: VALEA TELEGIILoc: MISLEA, Sat: MISLEA, Str.: MISLEA SEACALoc: MISLEA, Sat: MISLEA, Str.: SCHELEILoc: MISLEA, Sat: MISLEA, Str.: CAMPINEI",21/09/2023 09:00,21/09/2023 15:00,MN
48960,VRANCEA,"Loc: DUMITRESTI, Sat: BICESTII DE JOS",21/09/2023 08:53,21/09/2023 12:00,MN
48959,GALATI,"Loc: GALATI, Sat: GALATI, Str.: DR. ALEX. CARNABELLoc: GALATI, Sat: GALATI, Str.: BASARABIEILoc: GALATI, Sat: GALATI, Str.: VULTUR",21/09/2023 08:15,,MN
55345,MURES,Loc: CEUASU DE CAMPIE,21/09/2023 09:15,,TS
55343,COVASNA,"Loc: AITA MARE, Sat: AITA MARE",21/09/2023 09:00,,TS
55342,BRASOV,"Loc: MAGURA, Strada: PRINCIPALA",21/09/2023 08:45,,TS
55340,ALBA,"Loc: SANTIMBRU, Sat: COSLARIU, Strada: ARINULUILoc: SANTIMBRU, Sat: COSLARIU, Strada: BLAJULUILoc: SANTIMBRU, Sat: COSLARIU, Strada: CIRESULUILoc: SANTIMBRU, Sat: COSLARIU, Strada: FLORILORLoc: SANTIMBRU, Sat: COSLARIU, Strada: PRINCIPALALoc: SANTIMBRU, Sat: COSLARIU, Strada: TRANDAFIRILOR",21/09/2023 08:25,,TS
