NUMAR LUCRARE,JUDEȚ,ADRESA,DATA ÎNCEPERE,DATA FINALIZARE,zona
50892,PRAHOVA,"Loc: BREAZA, Sat: BREAZA, Str.: OCINEI",21/11/2023 18:35,,MN
50884,BRAILA,"Loc: BRAILA, Sat: BRAILA, Str.: DIMITRIE CANTEMIRLoc: BRAILA, Sat: BRAILA, Str.: LUPENILoc: BRAILA, Sat: BRAILA, Str.: ASACHI GHEORGHELoc: BRAILA, Sat: BRAILA, Str.: ION VODA CEL CUMPLIT",21/11/2023 13:16,,MN
50864,BRAILA,"Loc: BRAILA, Sat: BRAILA",20/11/2023 21:25,,MN
50863,GALATI,"Loc: NICORESTI, Sat: FANTANI,  : FANTANI",20/11/2023 17:50,21/11/2023 22:20,MN
50795,BUZAU,"Loc: MANZALESTI, Sat: GURA BADICULUI",18/11/2023 21:23,,MN
50750,GALATI,"Loc: NICORESTI, Sat: MALURENILoc: BUCIUMENI, Sat: HANTESTILoc: NICORESTI, Sat: FANTANILoc: NICORESTI, Sat: COASTA LUPEI",18/11/2023 19:30,,MN
50639,DAMBOVITA,"Loc: CONTESTI, Sat: BALTENI",15/11/2023 14:07,,MN
