NUMAR LUCRARE,JUDEȚ,ADRESA,DATA ÎNCEPERE,DATA FINALIZARE,zona
62729,PRAHOVA,"Loc: COMARNIC, Sat: COMARNIC, Str.: REPUBLICII",05/12/2024 14:30,,MN
62727,BRAILA,"Loc: BRAILA, Sat: BRAILA",05/12/2024 10:50,05/12/2024 15:00,MN
62726,BUZAU,"Loc: BISOCA, Sat: SARILELoc: BISOCA, Sat: PLESILoc: BISOCA, Sat: SINDRILALoc: BISOCA, Sat: BISOCA",05/12/2024 09:31,05/12/2024 15:30,MN
62725,VRANCEA,"Loc: VINTILEASCA, Sat: BAHNELE",05/12/2024 10:10,,MN
62720,BRAILA,"Loc: ZAVOAIA, Sat: ZAVOAIA",05/12/2024 09:30,05/12/2024 15:00,MN
62719,DAMBOVITA,"Loc: DOICESTI, Sat: DOICESTI",05/12/2024 09:30,05/12/2024 15:00,MN
62716,DAMBOVITA,"Loc: FIENI, Sat: FIENI",05/12/2024 09:00,05/12/2024 15:00,MN
62715,DAMBOVITA,"Loc: GURA SUTII, Sat: GURA SUTII, Str.: PRINCIPALA",04/12/2024 06:44,,MN
