NUMAR LUCRARE,JUDEȚ,ADRESA,DATA ÎNCEPERE,DATA FINALIZARE,zona
56743,PRAHOVA,"Loc: BUCOV, Sat: BUCOVLoc: BUCOV, Sat: BUCOV",29/05/2024 20:50,29/05/2024 23:55,MN
56742,BRAILA,"Loc: CAZASU, Sat: CAZASU",29/05/2024 20:24,,MN
56740,PRAHOVA,"Loc: PLOIESTI, Sat: PLOIESTI, Sos.: PLOIESTI-TARGOVISTELoc: PLOIESTI, Sat: PLOIESTI, Str.: POLIGONULUI",29/05/2024 16:56,,MN
56726,BRAILA,"Loc: RAMNICELU, Sat: RAMNICELU, Str.: RAMNICELU",29/05/2024 12:14,,MN
56720,BRAILA,"Loc: CHISCANI, Sat: LACU SARAT",29/05/2024 10:37,,MN
