NUMAR LUCRARE,JUDEȚ,ADRESA,DATA ÎNCEPERE,DATA FINALIZARE,zona
60547,DAMBOVITA,"Loc: VISINESTI, Sat: URSEIU, Str.: VALEA TRESTIEI-ISLAZ",08/09/2024 23:00,,MN
60546,BUZAU,"Loc: BUZAU, Sat: BUZAU, Str.: RAZBOIENILoc: BUZAU, Sat: BUZAU, Str.: BUZOIANU ION, COLONELLoc: BUZAU, Sat: BUZAU, Str.: STEFU POMPILIULoc: BUZAU, Sat: BUZAU, Str.: PACIILoc: BUZAU, Sat: BUZAU, Str.: BARNUTIU SIMION",08/09/2024 23:05,,MN
60545,DAMBOVITA,"Loc: VULCANA PANDELE, Sat: VULCANA PANDELE, Str.: MUZEU",08/09/2024 18:52,,MN
60544,VRANCEA,"Loc: JARISTEA, Sat: VARSATURA, Satul: VARSATURA",08/09/2024 20:15,,MN
60540,PRAHOVA,"Loc: BABA ANA, Sat: CONDURATU",08/09/2024 13:45,,MN
