NUMAR LUCRARE,JUDEȚ,ADRESA,DATA ÎNCEPERE,DATA FINALIZARE,zona
52688,GALATI,"Loc: FOLTESTI, Sat: STOICANI,  : STOICANI",26/01/2024 06:42,,MN
52687,PRAHOVA,"Loc: BUSTENI, Sat: BUSTENI, Str.: EROU CONCIU",26/01/2024 06:40,,MN
52684,DAMBOVITA,"Loc: COJASCA, Sat: COJASCALoc: CORNESTI, Sat: BUJOREANCA",25/01/2024 20:20,,MN
52679,VRANCEA,"Loc: VIZANTEA-LIVEZI, Sat: VIZANTEA-LIVEZI, Satul: VIZANTEA-LIVEZILoc: SOVEJA, Sat: RUCARENI, Satul: RUCARENILoc: VIZANTEA-LIVEZI, Sat: PISCU RADULUI, Satul: PISCU RADULUILoc: VIZANTEA-LIVEZI, Sat: VIZANTEA MANASTIREASCA, Satul: VIZANTEA MANASTIREASCALoc: DUMBRAVENI, Sat: DRAGOSLOVENI, Satul: DRAGOSLOVENILoc: CAMPURI, Sat: CAMPURI, Satul: CAMPURILoc: RACOASA, Sat: MARASTI, Satul: MARASTI",25/01/2024 18:35,26/01/2024 10:30,MN
52675,BRAILA,"Loc: VIZIRU, Sat: VIZIRU",25/01/2024 14:30,,MN
52640,GALATI,"Loc: IVESTI, Sat: IVESTI",24/01/2024 12:51,,MN
52580,DAMBOVITA,"Loc: TATARANI, Sat: GHEBOIENI",22/01/2024 09:10,,MN
