NUMAR LUCRARE,JUDEȚ,ADRESA,DATA ÎNCEPERE,DATA FINALIZARE,zona
59770,BRAILA,"Loc: VADENI, Sat: BALDOVINESTILoc: VADENI, Sat: PIETROIULoc: SILISTEA, Sat: SILISTEALoc: VADENI, Sat: VADENI",13/08/2024 20:32,,MN
59769,GALATI,"Loc: NAMOLOASA, Sat: NAMOLOASA TIRG",13/08/2024 20:09,,MN
59768,VRANCEA,"Loc: NANESTI, Sat: NANESTI",13/08/2024 20:03,,MN
59765,VRANCEA,"Loc: NEREJU, Sat: NEREJU",13/08/2024 18:55,,MN
59763,PRAHOVA,"Loc: PUCHENII MARI, Sat: PUCHENII MARI",13/08/2024 18:00,,MN
59734,BRAILA,"Loc: VADENI, Sat: BALDOVINESTI",12/08/2024 15:50,,MN
