NUMAR LUCRARE,JUDEȚ,ADRESA,DATA ÎNCEPERE,DATA FINALIZARE,zona
56755,PRAHOVA,"Loc: VALENI, Sat: VALENII DE MUNTE, Str.: ANTON PANNLoc: VALENI, Sat: VALENII DE MUNTE, Str.: MIRISTEI",30/05/2024 09:30,30/05/2024 12:30,MN
56754,PRAHOVA,"Loc: DRAGANESTI, Sat: DRAGANESTI",30/05/2024 09:15,30/05/2024 11:00,MN
56753,DAMBOVITA,"Loc: PUCIOASA, Sat: PUCIOASA, Str.: ARDEALULUI",30/05/2024 09:05,30/05/2024 10:05,MN
56751,BRAILA,"Loc: CAZASU, Sat: CAZASU",30/05/2024 08:41,,MN
56750,BRAILA,"Loc: GEMENELE, Sat: GAVANI",30/05/2024 08:28,,MN
56749,PRAHOVA,"Loc: BUCOV, Sat: BUCOV",30/05/2024 08:19,,MN
56748,PRAHOVA,"Loc: BABA ANA, Sat: BABA ANALoc: DRAGANESTI, Sat: BARAITARULoc: FULGA, Sat: FULGALoc: CIORANII-DE-JOS, Sat: CIORANII-DE-JOSLoc: CIORANII-DE-SUS, Sat: CIORANII-DE-SUSLoc: SALCIILE, Sat: SALCIILELoc: BABA ANA, Sat: CONDURATULoc: BOLDESTI-GRADISTEA, Sat: BOLDESTI - GRADISTEA",30/05/2024 06:34,,MN
56740,PRAHOVA,"Loc: PLOIESTI, Sat: PLOIESTI, Str.: POLIGONULUILoc: PLOIESTI, Sat: PLOIESTI, Sos.: PLOIESTI-TARGOVISTE",29/05/2024 16:56,,MN
