NUMAR LUCRARE,JUDEȚ,ADRESA,DATA ÎNCEPERE,DATA FINALIZARE,zona
51433,BUZAU,"Loc: MAGURA, Sat: CIUTA",06/12/2023 14:00,06/12/2023 15:24,MN
51432,BUZAU,"Loc: MARACINENI, Sat: CAPATINESTI",06/12/2023 14:01,06/12/2023 14:37,MN
51431,PRAHOVA,"Loc: PLOIESTI, Sat: PLOIESTI, Str.: MARASESTI",06/12/2023 14:14,,MN
51429,DAMBOVITA,"Loc: PUCIOASA, Sat: PUCIOASA, Str.: LUCEAFARULUILoc: PUCIOASA, Sat: PUCIOASA, Str.: INDEPENDENTEILoc: PUCIOASA, Sat: PUCIOASA, Str.: TRANDAFIRILOR",06/12/2023 11:53,06/12/2023 15:00,MN
51428,BRAILA,"Loc: TUFESTI, Sat: TUFESTI, Str.: ION CREANGA",06/12/2023 11:00,06/12/2023 15:30,MN
51406,GALATI,"Loc: JORASTI, Sat: JORASTI",05/12/2023 10:00,,MN
51391,BUZAU,"Loc: BISOCA, Sat: LOPATAREASALoc: BISOCA, Sat: LACURILELoc: BISOCA, Sat: RECEALoc: BISOCA, Sat: SINDRILALoc: BISOCA, Sat: BISOCALoc: BISOCA, Sat: SARILE",05/12/2023 00:30,,MN
50639,DAMBOVITA,"Loc: CONTESTI, Sat: BALTENI",15/11/2023 14:07,,MN
