NUMAR LUCRARE,JUDEȚ,ADRESA,DATA ÎNCEPERE,DATA FINALIZARE,zona
49547,PRAHOVA,"Loc: COLCEAG, Sat: PAREPA RUSANI",09/10/2023 21:15,,MN
49545,DAMBOVITA,"Loc: GLODENI, Sat: GLODENI",09/10/2023 20:25,,MN
49544,DAMBOVITA,"Loc: GAESTI, Sat: GAESTI, Str.: POPA SAPCALoc: GAESTI, Sat: GAESTI, Str.: ATANASE CONSTANTINESCU",09/10/2023 19:20,,MN
49531,PRAHOVA,"Loc: ALBESTI-PALEOLOGU, Sat: ALBESTI-PALEOLOGU, Nr: ALIMLoc: BUCOV, Sat: BUCOV, Nr: ALIMLoc: VALEA CALUGAREASCA, Sat: VALEA CALUGAREASCA, Str.: VALEA POENIILoc: ALBESTI-PALEOLOGU, Sat: VADU PARULUI, Nr: ALIMLoc: ALBESTI-PALEOLOGU, Sat: ALBESTI MURU, Nr: ALIMLoc: BUCOV, Sat: CHITORANI, Nr: ALIM",09/10/2023 15:50,,MN
49429,BRAILA,"Loc: MAXINENI, Sat: CORBU NOU, Str.: CORBU NOU",07/10/2023 10:26,,MN
