NUMAR LUCRARE,JUDEȚ,ADRESA,DATA ÎNCEPERE,DATA FINALIZARE,zona
49466,GALATI,Loc: VANATORI,08/10/2023 14:57,,MN
49465,GALATI,Loc: NICORESTILoc: BUCIUMENI,08/10/2023 15:03,,MN
49464,GALATI,"Loc: MUNTENI, Sat: MUNTENILoc: TEPU, Sat: TEPU DE JOS",08/10/2023 14:17,,MN
49463,PRAHOVA,"Loc: BARCANESTI, Sat: BARCANESTI",08/10/2023 14:30,,MN
49462,DAMBOVITA,"Loc: CONTESTI, Sat: BALTENI",08/10/2023 14:20,,MN
49461,BUZAU,"Loc: BUDA, Sat: BUDA, Satul: BUDA",08/10/2023 13:52,,MN
49460,VRANCEA,"Loc: GURA CALITEI, Sat: LACU LUI BABAN, Satul: LACU LUI BABAN",08/10/2023 12:50,,MN
49459,VRANCEA,"Loc: VINTILEASCA, Sat: VINTILEASCA, Satul: VINTILEASCA",08/10/2023 11:00,,MN
49429,BRAILA,"Loc: MAXINENI, Sat: CORBU NOU, Str.: CORBU NOU",07/10/2023 10:26,,MN
