NUMAR LUCRARE,JUDEȚ,ADRESA,DATA ÎNCEPERE,DATA FINALIZARE,zona
52295,VRANCEA,"Loc: PANCIU, Sat: PANCIULoc: STRAOANE, Sat: STRAOANE, Satul: STRAOANELoc: FITIONESTI, Sat: FITIONESTI, Satul: FITIONESTILoc: MOVILITA, Sat: MOVILITA, Satul: MOVILITA",11/01/2024 14:06,11/01/2024 15:30,MN
52294,VRANCEA,"Loc: VARTESCOIU, Sat: ROTARESTI",11/01/2024 14:10,11/01/2024 16:10,MN
52292,BUZAU,"Loc: NEHOIU, Sat: NEHOIU",11/01/2024 10:00,11/01/2024 15:01,MN
52290,BRAILA,"Loc: TRAIAN, Sat: URLEASCA",11/01/2024 12:20,,MN
52285,BUZAU,"Loc: BOZIORU, Sat: BOZIORU",11/01/2024 10:31,11/01/2024 15:30,MN
