NUMAR LUCRARE,JUDEȚ,ADRESA,DATA ÎNCEPERE,DATA FINALIZARE,zona
60304,BUZAU,"Loc: ZIDURI, Sat: CUCULEASA, Satul: CUCULEASA",30/08/2024 15:03,,MN
60303,VRANCEA,"Loc: PLOSCUTENI, Sat: PLOSCUTENI",30/08/2024 14:15,,MN
60301,DAMBOVITA,"Loc: VALEA LUNGA, Sat: VALEA LUNGA",30/08/2024 13:40,,MN
60298,DAMBOVITA,"Loc: PIETROSITA, Sat: PIETROSITA",30/08/2024 13:00,,MN
60297,GALATI,"Loc: FOLTESTI, Sat: STOICANI",30/08/2024 11:46,,MN
60296,DAMBOVITA,"Loc: GURA OCNITEI, Sat: OCHIURI",30/08/2024 11:15,,MN
60292,GALATI,"Loc: SMARDAN, Sat: M.KOGALNICEANULoc: SMARDAN, Sat: CISMELE",30/08/2024 10:23,,MN
60290,BRAILA,"Loc: TUFESTI, Sat: TUFESTI",30/08/2024 09:59,,MN
