NUMAR LUCRARE,JUDEȚ,ADRESA,DATA ÎNCEPERE,DATA FINALIZARE,zona
54057,GALATI,"Loc: GALATI, Sat: GALATI, Str.: IONEL FERNICLoc: GALATI, Sat: GALATI, Str.: NUCULUI",14/03/2024 13:20,,MN
54056,DAMBOVITA,"Loc: VISINA, Sat: VISINALoc: RASCAETI, Sat: RASCAETI",14/03/2024 13:05,,MN
54051,PRAHOVA,"Loc: SIRNA, Sat: HABUD",14/03/2024 11:45,14/03/2024 15:30,MN
54048,BRAILA,"Loc: INSURATEI, Sat: LACU REZILoc: INSURATEI, Sat: MARU ROSU",14/03/2024 11:16,,MN
54039,DAMBOVITA,"Loc: PUCIOASA, Sat: PUCIOASA, Str.: FLORIN POPESCU",14/03/2024 09:00,,MN
54033,DAMBOVITA,"Loc: TATARANI, Sat: CAPRIORULoc: MANESTI, Sat: MANESTILoc: MANESTI, Sat: DRAGAESTI PAMANTENI",14/03/2024 08:40,14/03/2024 16:00,MN
53847,DAMBOVITA,"Loc: CONTESTI, Sat: BALTENI",08/03/2024 18:00,,MN
