NUMAR LUCRARE,JUDEȚ,ADRESA,DATA ÎNCEPERE,DATA FINALIZARE,zona
58217,BRAILA,"Loc: BRAILA, Sat: BRAILA",09/07/2024 15:07,,MN
58216,DAMBOVITA,"Loc: GAESTI, Sat: GAESTI, Str.: 1 DECEMBRIE 1918",09/07/2024 14:45,,MN
58215,VRANCEA,"Loc: SIHLEA, Sat: CAIATA",09/07/2024 14:26,,MN
58214,VRANCEA,"Loc: DUMITRESTI, Sat: TINOASA",09/07/2024 13:37,,MN
58212,VRANCEA,"Loc: FOCSANI, Sat: FOCSANI, Calea: MUNTENIEI",09/07/2024 14:15,,MN
58211,GALATI,"Loc: NICORESTI, Sat: NICORESTILoc: NICORESTI, Sat: DOBRINESTI",09/07/2024 13:45,,MN
58201,GALATI,"Loc: TECUCI, Sat: TECUCI",09/07/2024 10:33,,MN
58181,BUZAU,"Loc: MAGURA, Sat: MAGURA",08/07/2024 22:07,,MN
