NUMAR LUCRARE,JUDEȚ,ADRESA,DATA ÎNCEPERE,DATA FINALIZARE,zona
62004,GALATI,"Loc: DRAGUSENI, Sat: FUNDEANU",03/11/2024 08:23,,MN
62003,PRAHOVA,"Loc: OLARI, Sat: OLARII VECHI",03/11/2024 08:10,,MN
62002,PRAHOVA,"Loc: GURA VADULUI, Sat: TOHANI",03/11/2024 08:10,,MN
62001,PRAHOVA,"Loc: COLCEAG, Sat: INOTESTI",03/11/2024 08:05,,MN
61999,GALATI,"Loc: CUZA VODA, Sat: CUZA VODA",03/11/2024 07:28,,MN
61998,GALATI,"Loc: CERTESTI, Sat: CERTESTI",03/11/2024 07:26,,MN
61997,GALATI,"Loc: POIANA, Sat: VISINA,  : VISINA",03/11/2024 07:13,,MN
61995,VRANCEA,"Loc: RACOASA, Sat: VARNITA, Satul: VARNITALoc: TIFESTI, Sat: TIFESTI, Satul: TIFESTI",03/11/2024 03:04,,MN
61994,PRAHOVA,"Loc: CIORANII-DE-SUS, Sat: CIORANII-DE-SUS",02/11/2024 23:15,,MN
