NUMAR LUCRARE,JUDEȚ,ADRESA,DATA ÎNCEPERE,DATA FINALIZARE,zona
50039,BUZAU,"Loc: SMEENI, Sat: SMEENI, Satul: SMEENI",25/10/2023 20:21,25/10/2023 22:30,MN
50038,DAMBOVITA,"Loc: PRODULESTI, Sat: PRODULESTI",25/10/2023 20:00,,MN
50031,VRANCEA,"Loc: PUFESTI, Sat: PUFESTI",25/10/2023 18:00,25/10/2023 22:45,MN
50025,PRAHOVA,"Loc: POIENARII BURCHII, Sat: POIENARII BURCHIILoc: POIENARII BURCHII, Sat: POIENARII BURCHII, Str.: ANTENELOR",25/10/2023 15:13,,MN
50023,PRAHOVA,"Loc: CAMPINA, Sat: CAMPINA, Str.: CAMPULUI",25/10/2023 14:54,,MN
