NUMAR LUCRARE,JUDEȚ,ADRESA,DATA ÎNCEPERE,DATA FINALIZARE,zona
51383,BRAILA,"Loc: VICTORIA, Sat: MIHAI BRAVU",04/12/2023 11:49,04/12/2023 15:00,MN
51381,BRAILA,"Loc: INSURATEI, Sat: MARU ROSULoc: INSURATEI, Sat: LACU REZI",04/12/2023 11:45,04/12/2023 15:00,MN
51380,GALATI,"Loc: MUNTENI, Sat: MUNTENI",04/12/2023 11:31,04/12/2023 16:00,MN
51377,VRANCEA,"Loc: FOCSANI, Sat: MANDRESTI-MUNTENI, Satul: MANDRESTI-MUNTENI",04/12/2023 10:37,04/12/2023 16:30,MN
51373,BUZAU,"Loc: PADINA, Sat: PADINA SAT VECHI, Satul: PADINA SAT VECHI",04/12/2023 09:03,04/12/2023 15:30,MN
50639,DAMBOVITA,"Loc: CONTESTI, Sat: BALTENI",15/11/2023 14:07,,MN
