NUMAR LUCRARE,JUDEȚ,ADRESA,DATA ÎNCEPERE,DATA FINALIZARE,zona
50799,BUZAU,"Loc: BECENI, Sat: GURA DIMIENII",18/11/2023 21:33,19/11/2023 13:34,MN
50798,BUZAU,"Loc: PARDOSI, Sat: PARDOSI",18/11/2023 19:32,19/11/2023 12:34,MN
50797,BUZAU,"Loc: RAMNICELU, Sat: COLIBASI",18/11/2023 18:32,19/11/2023 13:32,MN
50796,BUZAU,"Loc: LUCIU, Sat: LUCIU",18/11/2023 19:24,19/11/2023 10:24,MN
50795,BUZAU,"Loc: MANZALESTI, Sat: GURA BADICULUI",18/11/2023 21:23,,MN
50794,BUZAU,"Loc: SAGEATA, Sat: GAVANESTI",18/11/2023 19:22,19/11/2023 14:23,MN
50793,GALATI,"Loc: MUNTENI, Sat: MUNTENI, Str.: MIHAI VITEAZUL",19/11/2023 05:14,,MN
50792,BUZAU,"Loc: GHERASENI, Sat: GHERASENI",19/11/2023 07:22,19/11/2023 15:22,MN
50791,BRAILA,"Loc: UNIREA, Sat: VALEA CANEPII",19/11/2023 06:59,,MN
50790,GALATI,"Loc: SENDRENI, Sat: SENDRENI,  : SENDRENI",18/11/2023 20:57,,MN
50789,BRAILA,"Loc: TUFESTI, Sat: TUFESTI",19/11/2023 06:48,,MN
50788,PRAHOVA,"Loc: IZVOARELE, Sat: HOMORACIU",18/11/2023 20:00,,MN
50787,PRAHOVA,"Loc: MANECIU, Sat: MANECIU UNGURENI",19/11/2023 06:25,,MN
50786,VRANCEA,"Loc: BOLOTESTI, Sat: PIETROASALoc: BOLOTESTI, Sat: BOLOTESTILoc: BOLOTESTI, Sat: VITANESTII DE SUB MAGURALoc: BOLOTESTI, Sat: GAGESTI",19/11/2023 05:05,,MN
50785,VRANCEA,"Loc: MOVILITA, Sat: TROTUSANULoc: MOVILITA, Sat: FRECATEILoc: FITIONESTI, Sat: GHIMICESTILoc: MOVILITA, Sat: MOVILITALoc: FITIONESTI, Sat: HOLBANESTILoc: FITIONESTI, Sat: CIOLANESTI",19/11/2023 02:58,,MN
50784,VRANCEA,"Loc: PALTIN, Sat: PRAHUDALoc: REGHIU, Sat: URSOAIA",19/11/2023 01:15,,MN
50783,VRANCEA,"Loc: POIANA CRISTEI, Sat: TARATULoc: POIANA CRISTEI, Sat: PETREANULoc: POIANA CRISTEI, Sat: MAHRIULoc: POIANA CRISTEI, Sat: ODOBASCA",18/11/2023 23:41,,MN
50782,VRANCEA,"Loc: STRAOANE, Sat: MUNCELULoc: STRAOANE, Sat: STRAOANE",18/11/2023 23:03,,MN
50781,VRANCEA,"Loc: REGHIU, Sat: URSOAIALoc: PALTIN, Sat: PRAHUDA",19/11/2023 01:14,,MN
50780,BUZAU,"Loc: VADU PASII, Sat: VADU PASII, Satul: VADU PASII",19/11/2023 00:40,19/11/2023 14:21,MN
50779,VRANCEA,"Loc: CORBITA, Sat: CORBITA",18/11/2023 14:27,,MN
50778,VRANCEA,"Loc: ADJUD, Sat: ADJUD",18/11/2023 13:36,19/11/2023 16:30,MN
50777,PRAHOVA,"Loc: BUSTENI, Sat: BUSTENI, Str.: VICTORIEI",18/11/2023 23:15,,MN
50775,VRANCEA,"Loc: STRAOANE, Sat: STRAOANELoc: MOVILITA, Sat: MOVILITA",18/11/2023 23:02,,MN
50774,PRAHOVA,"Loc: VALEA DOFTANEI, Sat: TRAISTENI",18/11/2023 22:19,,MN
50772,BUZAU,"Loc: GLODEANU SILISTEA, Sat: COTORCA, Satul: COTORCA",18/11/2023 21:20,19/11/2023 12:21,MN
50769,BRAILA,"Loc: VISANI, Sat: CAINENI - BAILoc: VISANI, Sat: VISANILoc: VISANI, Sat: PLASOIU",18/11/2023 21:33,,MN
50768,BRAILA,"Loc: VIZIRU, Sat: VIZIRULoc: VIZIRU, Sat: LANURILE",18/11/2023 21:33,,MN
50767,BRAILA,"Loc: IANCA, Sat: TARLELE FILIULoc: CIRESU, Sat: IONESTILoc: CIRESU, Sat: BATOGU",18/11/2023 21:32,,MN
50766,BRAILA,"Loc: MOVILA MIRESII, Sat: MOVILA MIRESIILoc: MOVILA MIRESII, Sat: ESNALoc: GEMENELE, Sat: GEMENELELoc: GEMENELE, Sat: GAVANI",18/11/2023 21:32,,MN
50765,BRAILA,"Loc: TRAIAN, Sat: URLEASCA",18/11/2023 21:31,,MN
50764,BRAILA,"Loc: CIOCILE, Sat: CHIOIBASESTILoc: CIOCILE, Sat: CHICHINETULoc: CIOCILE, Sat: CIOCILE",18/11/2023 21:31,,MN
50763,BRAILA,"Loc: ROSIORI, Sat: ROSIORI",18/11/2023 21:30,,MN
50762,BRAILA,"Loc: CIRESU, Sat: VULTURENILoc: CIRESU, Sat: SCARLATESTILoc: ZAVOAIA, Sat: ZAVOAIALoc: DUDESTI, Sat: DUDESTI",18/11/2023 21:29,,MN
50761,BRAILA,"Loc: RAMNICELU, Sat: MIHAIL KOGALNICEANU(RAMNICELU)Loc: SALCIA TUDOR, Sat: SALCIA TUDORLoc: SALCIA TUDOR, Sat: GULIANCALoc: SALCIA TUDOR, Sat: OLANEASCALoc: SALCIA TUDOR, Sat: ARICIULoc: SALCIA TUDOR, Sat: CUZA VODA (SALCIA TUDOR)",18/11/2023 21:28,,MN
50760,BRAILA,"Loc: BARAGANUL, Sat: BARAGANUL",18/11/2023 21:28,,MN
50759,BRAILA,"Loc: VICTORIA, Sat: VICTORIA",18/11/2023 21:27,,MN
50758,BRAILA,"Loc: IANCA, Sat: PLOPULoc: IANCA, Sat: OPRISENESTI",18/11/2023 21:27,,MN
50757,BRAILA,"Loc: IANCA, Sat: BERLESCULoc: IANCA, Sat: PERISORU",18/11/2023 21:26,,MN
50755,BUZAU,"Loc: PODGORIA, Sat: PLESESTILoc: BUDA, Sat: DANULESTI",18/11/2023 19:04,19/11/2023 12:21,MN
50750,GALATI,"Loc: BUCIUMENI, Sat: HANTESTILoc: NICORESTI, Sat: FANTANILoc: NICORESTI, Sat: COASTA LUPEILoc: NICORESTI, Sat: MALURENI",18/11/2023 19:30,,MN
50745,PRAHOVA,"Loc: SOTRILE, Sat: PLAIUL CORNULUI",18/11/2023 19:49,,MN
50741,PRAHOVA,"Loc: TALEA, Sat: TALEA",18/11/2023 18:49,,MN
50740,GALATI,"Loc: PISCU, Sat: PISCU",18/11/2023 18:31,,MN
50737,VRANCEA,"Loc: HOMOCEA, Sat: COSTISALoc: PLOSCUTENI, Sat: PLOSCUTENILoc: ADJUD, Sat: ADJUDLoc: HOMOCEA, Sat: LESPEZILoc: PLOSCUTENI, Sat: ARGEALoc: HOMOCEA, Sat: HOMOCEA",18/11/2023 14:27,19/11/2023 13:00,MN
50732,VRANCEA,"Loc: TULNICI, Sat: GRESULoc: TULNICI, Sat: TULNICILoc: NEGRILESTI, Sat: NEGRILESTILoc: TULNICI, Sat: LEPSA",18/11/2023 15:50,,MN
50727,VRANCEA,"Loc: TIFESTI, Sat: CLIPICESTILoc: TANASOAIA, Sat: FELDIOARALoc: TIFESTI, Sat: TIFESTI",18/11/2023 14:50,19/11/2023 22:30,MN
50725,VRANCEA,"Loc: DUMITRESTI, Sat: LASTUNILoc: JITIA, Sat: JITIALoc: DUMITRESTI, Sat: BICESTII DE SUSLoc: CHIOJDENI, Sat: CHIOJDENI",18/11/2023 14:30,,MN
50710,VRANCEA,"Loc: CARLIGELE, Sat: BLIDARI",18/11/2023 13:17,,MN
50709,VRANCEA,"Loc: SOVEJA, Sat: DRAGOSLOVENILoc: SOVEJA, Sat: RUCARENILoc: CAMPURI, Sat: CAMPURI",18/11/2023 13:20,19/11/2023 16:25,MN
50707,GALATI,"Loc: NICORESTI, Sat: NICORESTI",18/11/2023 13:05,,MN
50639,DAMBOVITA,"Loc: CONTESTI, Sat: BALTENI",15/11/2023 14:07,,MN
