NUMAR LUCRARE,JUDEȚ,ADRESA,DATA ÎNCEPERE,DATA FINALIZARE,zona
60456,PRAHOVA,"Loc: VALEA DOFTANEI, Sat: TESILA, Str.: RUSU",05/09/2024 09:15,05/09/2024 13:00,MN
60455,PRAHOVA,"Loc: DRAJNA, Sat: OGRETIN",05/09/2024 08:30,05/09/2024 11:30,MN
60454,BUZAU,"Loc: ZIDURI, Sat: COSTIENI, Satul: COSTIENILoc: TOPLICENI, Sat: DEDULESTI, Satul: DEDULESTI",05/09/2024 08:30,,MN
60453,VRANCEA,"Loc: ADJUD, Sat: ADJUD, Satul: ADJUDU VECHI",05/09/2024 08:16,05/09/2024 16:00,MN
60452,DAMBOVITA,"Loc: GURA OCNITEI, Sat: ADANCA",05/09/2024 08:00,05/09/2024 16:00,MN
60451,PRAHOVA,"Loc: PLOIESTI, Sat: PLOIESTI, Str.: IPATESCU ANALoc: PLOIESTI, Sat: PLOIESTI, Str.: BOBILNA",05/09/2024 08:00,05/09/2024 13:45,MN
60450,VRANCEA,"Loc: VIDRA, Sat: SERBESTI, Satul: SERBESTI",05/09/2024 08:06,,MN
