NUMAR LUCRARE,JUDEȚ,ADRESA,DATA ÎNCEPERE,DATA FINALIZARE,zona
60603,DAMBOVITA,"Loc: VALEA MARE, Sat: FETENI, Str.: FETENI",11/09/2024 09:26,,MN
60602,BRAILA,"Loc: VICTORIA, Sat: MIHAI BRAVU",11/09/2024 08:58,,MN
60600,DAMBOVITA,"Loc: BUCSANI, Sat: HABENI, Str.: HABENI",11/09/2024 08:10,,MN
60597,DAMBOVITA,"Loc: ODOBESTI, Sat: BRANCOVEANULoc: ODOBESTI, Sat: CROVULoc: ODOBESTI, Sat: ZIDURI",11/09/2024 07:49,,MN
60596,PRAHOVA,"Loc: PAULESTI, Sat: COCOSESTI, Str.: PRINCIPALA COCOSESTI",11/09/2024 07:44,,MN
60595,BUZAU,"Loc: TISAU, Sat: HALES, Satul: HALES",11/09/2024 07:44,,MN
60590,DAMBOVITA,"Loc: TATARANI, Sat: GHEBOIENILoc: RAU ALB, Sat: RAU ALB",10/09/2024 23:29,,MN
60589,VRANCEA,"Loc: COTESTI, Sat: BUDESTI",10/09/2024 22:09,,MN
