NUMAR LUCRARE,JUDEȚ,ADRESA,DATA ÎNCEPERE,DATA FINALIZARE,zona
55659,BUZAU,"Loc: RACOVITENI, Sat: RACOVITENI",29/04/2024 20:01,,MN
55658,BUZAU,"Loc: VERNESTI, Sat: ZORESTI",29/04/2024 20:01,,MN
55656,GALATI,"Loc: BARCEA, Sat: BARCEA NOUA,  : BARCEA NOUA",29/04/2024 19:20,,MN
55655,PRAHOVA,"Loc: POSESTI, Sat: NUCSOARA DE JOS",29/04/2024 18:52,,MN
55647,GALATI,"Loc: CERTESTI, Sat: CARLOMANESTI,  : CARLOMANESTI",29/04/2024 16:04,,MN
55640,PRAHOVA,"Loc: BRAZI, Sat: BRAZI",29/04/2024 13:30,,MN
55637,PRAHOVA,"Loc: SIRNA, Sat: SIRNA",29/04/2024 13:30,,MN
