NUMAR LUCRARE,JUDEȚ,ADRESA,DATA ÎNCEPERE,DATA FINALIZARE,zona
50388,BUZAU,"Loc: TISAU, Sat: IZVORANU",06/11/2023 08:25,06/11/2023 12:25,MN
50387,BUZAU,"Loc: GALBINASI, Sat: BENTU",06/11/2023 08:24,06/11/2023 12:24,MN
50385,VRANCEA,"Loc: COTESTI, Sat: COTESTI",06/11/2023 07:26,06/11/2023 11:26,MN
50384,VRANCEA,"Loc: VALEA SARII, Sat: VALEA SARII",06/11/2023 07:26,06/11/2023 10:26,MN
50383,DAMBOVITA,"Loc: SOTANGA, Sat: SOTANGALoc: VULCANA PANDELE, Sat: VULCANA PANDELELoc: BRANESTI, Sat: BRANESTI",06/11/2023 04:33,,MN
50356,BRAILA,"Loc: VICTORIA, Sat: VICTORIA",05/11/2023 13:01,,MN
