NUMAR LUCRARE,JUDEȚ,ADRESA,DATA ÎNCEPERE,DATA FINALIZARE,zona
60328,GALATI,"Loc: TECUCI, Sat: TECUCI",31/08/2024 15:20,,MN
60327,DAMBOVITA,"Loc: BEZDEAD, Sat: MAGURALoc: BEZDEAD, Sat: BROSTENI",31/08/2024 15:10,,MN
60326,PRAHOVA,"Loc: SALCIILE, Sat: SALCIILE",31/08/2024 13:20,,MN
60325,DAMBOVITA,"Loc: SLOBOZIA MOARA, Sat: SLOBOZIA MOARA",31/08/2024 14:00,,MN
60324,DAMBOVITA,"Loc: CANDESTI, Sat: ANINOSANI",31/08/2024 12:30,,MN
60315,BRAILA,"Loc: TICHILESTI, Sat: TICHILESTI, Str.: TICHILESTI",31/08/2024 02:58,,MN
