NUMAR LUCRARE,JUDEȚ,ADRESA,DATA ÎNCEPERE,DATA FINALIZARE,zona
50640,GALATI,"Loc: BERESTI, Sat: BERESTI",15/11/2023 14:20,,MN
50639,DAMBOVITA,"Loc: CONTESTI, Sat: BALTENI",15/11/2023 14:07,,MN
50638,PRAHOVA,"Loc: PLOIESTI, Sat: PLOIESTI, Str.: POSTEILoc: PLOIESTI, Sat: PLOIESTI, Str.: PALTINISLoc: PLOIESTI, Sat: PLOIESTI, Str.: ARTEILoc: PLOIESTI, Sat: PLOIESTI, Str.: STADIONULUI",15/11/2023 13:40,,MN
50635,PRAHOVA,"Loc: RAFOV, Sat: RAFOV",15/11/2023 10:30,15/11/2023 15:00,MN
50634,GALATI,"Loc: BARCEA, Sat: BARCEA VECHE",15/11/2023 09:18,,MN
50633,DAMBOVITA,"Loc: CRANGURILE, Sat: PATROAIA VALE",15/11/2023 11:10,,MN
50631,PRAHOVA,"Loc: SALCIILE, Sat: SALCIILE",15/11/2023 10:30,15/11/2023 16:00,MN
50628,PRAHOVA,"Loc: TARGSORUL VECHI, Sat: STREJNIC, Str.: PRINCIPALALoc: TARGSORUL VECHI, Sat: STREJNIC, Str.: RADIOFARULUI",15/11/2023 09:30,15/11/2023 16:00,MN
50624,GALATI,"Loc: GOHOR, Sat: NARTESTI VALE",15/11/2023 08:50,15/11/2023 16:00,MN
