NUMAR LUCRARE,JUDEȚ,ADRESA,DATA ÎNCEPERE,DATA FINALIZARE,zona
48724,DAMBOVITA,"Loc: TITU, Sat: TITU, Str.: CUZA VODALoc: TITU, Sat: TITU, Str.: MAIOR STEFAN MIHAILEANULoc: TITU, Sat: TITU, Str.: TITU TARG STEJARULUI",11/09/2023 20:52,,MN
48723,PRAHOVA,"Loc: BAICOI, Sat: BAICOI, Str.: REPUBLICII",11/09/2023 19:44,,MN
48716,DAMBOVITA,"Loc: CREVEDIA, Sat: CREVEDIALoc: CREVEDIA, Sat: SAMURCASI",11/09/2023 14:45,,MN
48657,DAMBOVITA,"Loc: CONTESTI, Sat: BALTENI",08/09/2023 10:30,,MN
55235,MURES,"Loc: SIGHISOARA, Strada: ANA IPATESCU",11/09/2023 20:34,,TS
